2019-12-22 10:23:41.476946;/expose/112543538;['\r\n\r\nAusstattungsmerkmale: \r\n-Parkettboden\r\n-Badewanne/Dusche/WC\r\n-Gäste WC\r\n-exklusives Bad\r\n-Aufzug\r\n-Keller\r\n-Balkon\r\n-Erstbezug\r\n-Einbauküche\r\n-Küche mit Fenster\r\n-Fußbodenheizung\r\n-Bad mit Fenster\r\n-Abstellraum', 'Zentrum-West ist ein vielfältiges Stadtviertel - hier entdeckt man die unterschiedlichen Gesichter der Stadt. Das Bachviertel liegt direkt neben dem Elsterflutbecken, weist prächtige alte Villen auf und knüpft über den Johannapark hinweg an das Musikerviertel an. Im Übergangsbereich zwischen dem Zentrum-West und der Innenstadt befindet sich das Kolonnadenviertel - ein farbenfrohes und lebendiges und für Leipziger Verhältnisse junges Viertel. Durch die zentrale Lage besteht eine hervorragende Anbindung zu Nah- und Fernverkehr. Alle zentralen Punkte der Leipziger City sowie der Hauptbahnhof sind in wenigen Minuten erreichbar. Im Zentrum West befindet sich zudem ein Teil der Gottschedstraße. Der andere Teil führt - über die Käthe-Kollwitz-Straße hinaus - direkt in die City. Die Gottschedstraße ist eine der beliebtesten Kneipenmeilen Leipzigs und lädt mit einem reichhaltigen Angebot an Cafés und Restaurants zum Verweilen ein.', 'Folgende Unterlagen werden angefordert/benötigt:\r\n- Selbstauskunft\r\n- Schufaeinwilligung    \r\n- Vorvermieterbescheinigung \r\n- Kopie Personalausweis\r\n- Einkommensnachweise\r\n- Nachweis einer Haftpflichtversicherung\r\n\r\nDie Formulare finden Sie unter www.kuenne-immobilien.de/vermietung.\r\n\r\nDer Mietvertrag wird mit einer Mindestlaufzeit von zwei Jahren und nach der Mindestmietzeit mit einer Staffelmiete abgeschlossen.'];showqualicontactform;profile0;false;;true;premium;true;Sachsen;Leipzig;Deutschland;04105;51,343325149194;12,35808932871466;false;n;y;n;1580;8;5367601;n;first_time_use_after_refurbishment;001.5367601;y;;;no_information;3;;n;;n;;;13;wohnung_miete;no_information;0,active;2019;y;150.12;6;;n;;4;4;4;581467;no_information;https://pictures.immobilienscout24.de/listings/51554194-2264-4310-9018-63a46c8927a2-1341262225.jpg/ORIG/resize/118x118%3E/extent/118x118/format/jpg/quality/80;13;4.3;15.29;4.3;;Sachsen;Leipzig;Zentrum_Nordwest;112543538;351;"Waldstra&szlig;e";Waldstraße;100 MBit/s;true;;;100 MBit/s;true;MagentaZuhause L;web,email,bank,music,dl-ul,game,sd,mltstr,hd,fast-ul-dl;über VDSL;REGULAR;https://padlock.link/ml;https://padlock.link/ioml;telekom_layer_magenta_l;ONE_YEAR_FREE;40 MBit/s;;;apartment;;;04105
2019-12-22 10:23:42.258612;/expose/113502671;['Das Wohngebäude liegt in einer kleinen Nebenstraße in Schönau und ist mit einem ansehlichen Innenhof ausgestattet - der über Spielmöglichkeiten und einen Wäscheplatz verfügt. Durch die gute Anbindung an das Nahverkehrsnetz (Bus und Bahn) ist man in wenigen Minuten in der Innenstadt von Leipzig. Als Einkaufsmöglichkeit bietet sich das PEP und das Allee Center an - mit seiner Vielzahl an Geschäften und Restaurants sowie einem Kino. Im Südwesten Grünaus gelegenen ist der Kulkwitzer See.', 'Wohnung mit Aussicht ins Grüne. Die 3 Zimmer mit großem Balkon sind für eine kleine Familie gut geeignet. Vor Einzug müssen noch kleine Sanierungsarbeiten erledigt werden, die ca. 6 Wochen in Anspruch nehmen. Eine Vermietung ist frühestens ab dem 01.02.2020 möglich.'];showqualicontactform;profile0;false;;true;premium;true;Sachsen;Leipzig;Deutschland;04205;51,32870217242455;12,286928163507572;false;n;y;n;350;2;5415305;y;no_information;001.5415305;n;;;no_information;5;disabled;n;;n;78;;17;wohnung_miete;no_information;0,active;;n;68.68;3;;n;;3;3;6;134.2.15__3460--63;negotiable;https://pictures.immobilienscout24.de/listings/a536a673-03b6-453c-8113-8116ef0bc691-1321350224.jpg/ORIG/resize/118x118%3E/extent/118x118/format/jpg/quality/80;7;3.27;14.28;3.27;;Sachsen;Leipzig;Schönau;113502671;80;"Sch&ouml;nauer Ring";Schönauer_Ring;100 MBit/s;true;;;100 MBit/s;true;MagentaZuhause L;web,email,bank,music,dl-ul,game,sd,mltstr,hd,fast-ul-dl;über VDSL;REGULAR;https://padlock.link/ml;https://padlock.link/ioml;telekom_layer_magenta_l;ONE_YEAR_FREE;40 MBit/s;;;apartment;1981;4;04205
2019-12-22 10:23:43.109650;/expose/114974157;['Der Schritt vor die Haustür führt geradewegs hinein ins urbane Leben. Shopping,\xa0Kunst und Kultur, das alles finden Sie mitten in der City. In der Universitätsstraße bieten wir Ihnen komfortable 1- und 2-Raum-Wohnungen, zum Teil auch mit Einbauküche, direkt am Campus der Universität Leipzig. In Sekundenschnelle sind Studenten im Hörsaal oder in der Mensa des neu gestalteten Campus der zweitältesten Universität Deutschlands.'];showqualicontactform;profile0;false;;true;premium;true;Sachsen;Leipzig;Deutschland;04109;51,337979651907;12,377527000952828;true;n;n;n;253;1;17773;n;refurbished;001.17773;y;;;no_information;2;disabled;n;;n;47;central_heating;18;wohnung_miete;no_information;0,active;;y;36.11;1;;n;;2;2;6;1000.00000201.00001010;negotiable;https://pictures.immobilienscout24.de/listings/b9c8d49e-55ba-4063-b423-746c52309bd0-1341555783.jpg/ORIG/resize/118x118%3E/extent/118x118/format/jpg/quality/80;2;5.69;16.75;5.69;;Sachsen;Leipzig;Zentrum;114974157;83;"Universit&auml;tsstr.";Universitätsstr.;50 MBit/s;true;;;50 MBit/s;true;MagentaZuhause M;web,email,bank,music,dl-ul,game,sd,mltstr,hd,fast-ul-dl;über VDSL;REGULAR;https://padlock.link/mm;https://padlock.link/iomm;telekom_layer_magenta_m;ONE_YEAR_FREE;10 MBit/s;;383;no_information;1962;2;04109
2019-12-22 10:23:43.739500;/expose/110885983;['Charakterstark:\n\nOrt der Geborgenheit und Raum für abwechslungsreiche Lebenskonzepte.\n\nIhr neues Zuhause im StadtHausSüd ist repräsentativ, gut ausgestattet, verfügt über einen privaten Außenbereich und liegt in der facettenreichen, angesagten Leipziger Südvorstadt.\n\nEinige Wohnungen sind übrigens barrierefrei und per Tiefgarage und bequem mit dem Aufzug zu erreichen.\n\nDie Fotos zur Einheit sind teilweise Beispiele einer vergleichbaren Wohnung.\n\nDie Wohnungen werden unmöbliert und ohne Dekoration vermietet.', 'Unser Rückzugsort \n\nAussichtsreich: Balkon, Loggia, Dachterrasse oder Terrasse mit Garten\n\nWertig: Eiche-Echtholzparkett in allen Wohn-,Schlaf- und Arbeitszimmern, Flur/Diele und in offenen Küchen\n\nMarkenbewusst: hochwertige Bodenfliesen in Bädern und im Hauswirtschaftsraum mit Waschmaschinenanschluss und Abstellmöglichkeit für Wäschetrockner\n\nStilvoll: modern geflieste Bäder mit weißen Markensanitärobjekten (wandhängendes Tiefspül-WC, Waschtisch, verchromte Armatur, Badewanne und/oder bodengleiche Dusche, teilweise Gäste-WC\n\nBeliebt: deutsche Marken-Einbauküchen inklusive Markengeräte (Cerankochfeld, Heißluft-Backofen, Flachschirmdunstabzugshaube, Kühl-Gefrierkombination, Geschirrspülmaschine, Edelstahlspüle mit Armatur)\n\nIdeal: Fernwärme, Fußbodenheizung und Handtuchheizkörper im Bad\n\nSelbstverständlich: Breitbandkabel-Anschluss (Kabel Deutschland) Lan-Anschlussmöglichkeiten in jedem Zimmer\n\nSchützend: Kunststofffenster mit Isolierverglasung und Sonnenschutz durch Rollläden\n\nSicherheitshalber: Türsprechanlage mit Farb-Videoauge und Farbdisplay in der Wohnung\n\n*Die Bilder zeigen die Musterwohnung*\n\nDie vorgenannten Betriebs-/ Heizkostenvorauszahlungen stellen eine unverbindliche Schätzung der zu erwartenden Betriebskosten dar. Es wird ausdrücklich darauf hingewiesen, dass sich nach erfolgter Abrechnung auch Nachforderungsbeträge ergeben können.\n\nDer Mieter erhält eine Nettokaltmiete mietfrei und verzichtet im Gegenzug die ersten zwölf Monate seiner Mietzeit auf sein Recht zur ordentlichen Kündigung des Mietverhältnisses. Verlängert der Mieter sein Kündigungsverzicht freiwillig um weitere zwölf Monate, dann wird dem Mieter nach zwölf Monaten ein weiterer Monat nettokaltmietfrei gewährt.\n\nFür diese Wohnung sind Staffelmieten vorgesehen. Einzelheiten teilen wir Ihnen gern im Rahmen der Wohnungsbesichtigungen mit.', 'Familienfreundlich: Schön gestalteter Innenhof mit kleinem Spielbereich, verschiedene Schulen in der Umgebung sowie die Hochschule für Technik, Wirtschaft und Kultur, neu gestalteter Spielplatz am Steinplatz 3 Minuten entfernt.\n\nBesonderes: Gute Infrastruktur! Der Markkleeberger See/Cospudener See befindet sich in unmittelbarer Entfernung, die Leipziger Innenstadt ist bequem mit den öffentlichen Verkehrsmitteln in 5 Minuten zu erreichen. Und frische Brötchen gibt es übrigens in der Bäckerei im Erdgeschoss.', '- Erstbezug\n- Fernwärme\n- Gartenanteil / Mitbenutzung\n- Vollbad\n- Parkett\n- Fliesen\n- Waschmaschinenanschluss vorhanden'];showqualicontactform;profile0;false;;true;schaufenster;;Sachsen;Leipzig;Deutschland;04275;51,3195513467013;12,375829213998689;true;n;y;n;999;6;18286671;n;no_information;002.01009099501;n;;;no_information;;;n;;y;92.47;no_information;-;wohnung_miete;no_information;0,active;;y;93.76;4;true;y;;4;4;;3018.36057.0027;no_information;https://pictures.immobilienscout24.de/listings/3d222bc2-fb67-436c-8bd1-b9a13cb0a52b-1286841405.jpg/ORIG/resize/118x118%3E/extent/118x118/format/jpg/quality/80;8;4.47;16.11;4.47;84799;Sachsen;Leipzig;Südvorstadt;110885983;143.76;"Scharnhorststra&szlig;e 41A WE A.07";Scharnhorststraße_41A_WE_A.07;;;;;;;;;;;;;;;;;1235.23;apartment;2018;9;04275
2019-12-22 10:23:44.436836;/expose/114983693;"['Diese hochwertig ausgestattete 4-Raum-Wohnung befindet sich in einem neu sanierten Altbau mit beeindruckender Architektur. Vier sehr helle und freundliche Zimmer erstrecken sich hier auf ca. 127 Quadratmetern. Durch ihren pfiffigen Grundriss in Kombination mit den großen Fenstern sowie dem Echtholzparkett aus Eiche wird diese Immobilie zu einem richtigen Hingucker.\n\nÜber das gepflegte Treppenhaus gelangt zum Eingang dieser schönen Erdgeschosswohnung, hinter dem Sie ein großzügiger Flur empfängt. Linksseitig befinden sich zwei Schlafzimmer, ein weiteres finden Sie auf der rechten Seite. Das angrenzende Gäste-WC mit Tageslicht und Dusche sowie der Zugang zu dem Balkon, welcher einen fantastischen Blick in den begrünten Innenhof ermöglicht, sind nur wenige der zu erwartenden Highlights. Ein separater Flur führt zu dem Hauswirtschaftsraum sowie dem großen Badezimmer, welches neben einer Badewanne auch über eine Dusche, ein Doppelwaschbecken und ein Fenster verfügt. Die offen gestaltete Küche bekommt durch ihren dunkel gefliesten Fußboden einen sehr edlen Touch. Das angrenzende Wohnzimmer ist schön geschnitten und verfügt über einen weiteren Zugang zu dem Balkon, welcher Sie direkt in den eigenen ca. 40 Quadratmeter großen Garten führt. Ebenfalls ist ein Gemeinschaftsgarten für die Mieter, ausgestattet mit einen Sandkasten und Platz für Kinder, geschützt im Innenhof vorhanden. Ein privater Stellplatz kann für 40 € pro Monat angemietet werden.\n\nVereinbaren Sie jetzt einen Besichtigungstermin und überzeugen Sie sich selbst von dieser schönen Immobilie.\n', 'Dieses schöne Objekt befindet sich im Leipziger Stadtteil Dölitz, unweit von der Innenstadt entfernt. Während Sie hier eine fantastische Infrastruktur genießen, können Sie den Stadttrubel während eines Spaziergangs durch den Göthe- oder den Agra-Park für kurze Zeit vergessen. Mehrere Einkaufsmöglichkeiten sowie jegliche Bildungseinrichtungen, Ärzte und gemütliche Restaurants befinden sich in unmittelbarer Umgebung. Highlight bildet die Nähe zum Leipziger Neuseenland, welches über die Bundesstraße 2 in nur zehn Autominuten erreicht werden kann - die perfekte Lage für Groß und Klein.\n', 'Seit vielen Jahren beraten wir unsere Kunden erfolgreich beim Kauf oder der Anmietung von Immobilien in Leipzig und Umgebung. Informieren sie sich über unser großes Angebot an wunderschönen Häusern und Mietwohnungen auf unserer Homepage, oder rufen sie uns an. Wir beraten sie gerne.\n\nwww.willuhn-immobilien.de\n\n \n\nWiderrufsbelehrung\n\nWenn Sie als Verbraucher eine Leistung kostenpflichtig bestellen, haben sie das folgende Widerrufsrecht: Sie haben das Recht, binnen vierzehn Tagen ohne Angabe von Gründen diesen Vertrag zu widerrufen. Die Widerrufsfrist beträgt vierzehn Tage ab dem Tag des Vertragsabschlusses. Um Ihr Widerrufsrecht auszuüben, müssen Sie uns mittels einer eindeutigen Erklärung (z.B. ein mit der Post versandter Brief, Telefax oder E-Mail) über Ihren Entschluss, diesen Vertrag zu widerrufen, informieren. Sie können dafür das beigefügte Widerrufsformular www.vvv-leipzig-immobilien.de/Widerrufsformular.pdf verwenden, das jedoch nicht vorgeschrieben ist. Zur Wahrung der Widerrufsfrist reicht es aus, dass Sie die Mitteilung über die Ausübung des Widerrufsrechts vor Ablauf der Widerrufsfrist absenden.\n\n\nDer Widerruf ist zu richten an:\nWilluhn Immobilien e.K.\nInh. Sabine Willuhn\nScherlstrasse 14\n04103 Leipzig\nTel.: 0341-30321212\nFax: 0341-30321211\nE-Mail: info@willuhn-immobilien.de\n\nFolgen des Widerrufs\nWenn Sie diesen Vertrag widerrufen, haben wir Ihnen alle Zahlungen, die wir von Ihnen erhalten haben, einschließlich der Lieferkosten (mit Ausnahme der zusätzlichen Kosten, die sich daraus ergeben, dass Sie eine andere Art der Lieferung als die von uns angebotene, günstigste Standardlieferung gewählt haben), unverzüglich und spätestens binnen vierzehn Tagen ab dem Tag zurückzuzahlen, an dem die Mitteilung über Ihren Widerruf dieses Vertrags bei uns eingegangen ist. Für diese Rückzahlung verwenden wir dasselbe Zahlungsmittel, das Sie bei der ursprünglichen Transaktion eingesetzt haben, es sei denn, mit Ihnen wurde ausdrücklich etwas anderes vereinbart; in keinem Fall werden Ihnen wegen dieser Rückzahlung Entgelte berechnet. Haben Sie verlangt, dass die Dienstleistungen während der Widerrufsfrist beginnen soll, so haben Sie uns einen angemessenen Betrag zu zahlen, der dem Anteil der bis zu dem Zeitpunkt, zu dem Sie uns von der Ausübung des Widerrufsrechts hinsichtlich dieses Vertrags unterrichten, bereits erbrachten Dienstleistungen im Vergleich zum Gesamtumfang der im Vertrag vorgesehenen Dienstleistungen entspricht.\n\nHinweis zum vorzeitigen Erlöschen des Widerrufsrechts\nIhr Widerrufsrecht erlischt bei einem Vertrag zur Erbringung von Dienstleistungen vorzeitig, wenn wir die Dienstleistung vollständig erbracht haben und mit der Ausführung der Dienstleistung erst begonnen haben, nachdem Sie dazu Ihre ausdrückliche Zustimmung gegeben haben und gleichzeitig Ihre Kenntnis davon bestätigt haben, dass Sie Ihr Widerrufsrecht bei vollständiger Vertragserfüllung durch uns verlieren.\n']";showqualicontactform;profile0;false;;true;premium;true;Sachsen;Leipzig;Deutschland;04279;51,28930387621;12,391587971635072;true;n;y;n;1025;7;4178540;y;no_information;001.4178540;y;;energy_consumption;gas;;;n;;n;;central_heating;176;wohnung_miete;luxury;0,active;2019;y;127;6;;n;;4;4;4;317113;no_information;https://pictures.immobilienscout24.de/listings/b4bca66b-0b40-4848-9060-45625f124511-1341250728.jpg/ORIG/resize/118x118%3E/extent/118x118/format/jpg/quality/80;22;3.33;12.4;3.33;;Sachsen;Leipzig;Dölitz_Dösen;114983693;305;"Bornaische Stra&szlig;e";Bornaische_Straße;100 MBit/s;true;;;100 MBit/s;true;MagentaZuhause L;web,email,bank,music,dl-ul,game,sd,mltstr,hd,fast-ul-dl;über VDSL;REGULAR;https://padlock.link/ml;https://padlock.link/ioml;telekom_layer_magenta_l;ONE_YEAR_FREE;40 MBit/s;103;1330;ground_floor;;;04279
2019-12-22 10:23:45.156160;/expose/114306912;['Die 2-Raum-Wohnung befindet sich im Dachgeschoss eines Mehrfamilienhauses im angesagten Stadtteil Plagwitz.\n\nZu der schönen Wohnung gehören eine gemütliche Wohnküche mit Fenster, zwei separate Zimmer sowie ein Tageslichtbad mit Wanne. In der Einheit wird mit neuem Laminatboden versehen, ein Kellerabteil bietet zusätzlichen Stauraum.', '- Böden: neues, modernes Laminat\n- Bad: Tageslichtbad mit Wanne, gefliest\n- Wände & Decken: Raufaser Tapete weiß (neu)\n- Wohnküche mit neuer Einbauküche', 'Plagwitz ist ein wachsender und nachgefragter Stadtteil, der sich ca. 3 km westlich des Leipziger Stadtzentrums befindet. \nDie Metamorphose vom Industriestandort des 19. Jahrhunderts zum angesagten Wohn- und Arbeitsstandort verdankt Plagwitz unter anderem dem Umbau der denkmalgeschützten Fabrikgebäude zu Lofts und Büros sowie dem hohen Freizeitwert des Karl-Heine-Kanals sowie der vielen verzweigten Wasserwege mit ihren Uferpromenaden und historischen Brücken, die u.a. per Paddelboot erkundet werden können. \nDer vor allem von Familien, Künstlern und Studenten beliebte Stadtteil besticht durch eine Vielfalt an kreativer Szene. Lebensadern und beste Anlaufstellen zum Erkunden von Plagwitz sind die Karl-Heine-Straße sowie die Zschochersche Straße mit ihrem interessanten Mix aus Cafés, Kneipen und zahlreichen Geschäften des täglichen Bedarfs.', 'Lassen Sie sich diese Gelegenheit nicht entgehen und vereinbaren Sie gleich einen Besichtigungstermin mit unserem Vermietungsteam!\n\nSonderangebot: Kostenfreie Stellplatznutzung für ein Jahr !!\n\nWir freuen uns auf Sie !!'];showqualicontactform;profile0;false;;true;premium;true;Sachsen;Leipzig;Deutschland;04229;51,3234779369951;12,326949334662528;false;n;n;n;571;4;18111493;y;refurbished;009.67027a06-5d6f-408e-8739-82a88b30d05e;n;;energy_consumption;district_heating;4;;y;;y;;central_heating;41;wohnung_miete;normal;0,active;;n;63;3;;n;;2;2;4;114306912;no_information;https://pictures.immobilienscout24.de/listings/289efb45-c990-4fa9-9493-dc67c283bfdd-1341473020.jpg/ORIG/resize/118x118%3E/extent/118x118/format/jpg/quality/80;8;4.56;15.1;4.56;;Sachsen;Leipzig;Plagwitz;114306912;140;"Gie&szlig;erstra&szlig;e";Gießerstraße;100 MBit/s;true;;;100 MBit/s;true;MagentaZuhause L;web,email,bank,music,dl-ul,game,sd,mltstr,hd,fast-ul-dl;über VDSL;REGULAR;https://padlock.link/ml;https://padlock.link/ioml;telekom_layer_magenta_l;ONE_YEAR_FREE;40 MBit/s;83;711;roof_storey;1930;1;04229
2019-12-22 10:23:45.971921;/expose/113369241;['Mitten im belebten Stadtzentrum von Leipzig gelegen, besticht die Immobilie in der Hainstraße 6 durch seine repräsentative Fassade. Das Gebäude, welches im Jahr 1998 errichtet wurde, ist sechsgeschossig und beherbergt sowohl Einzelhandels- und Büroflächen als auch Wohnungen in den oberen Geschossen. \n\r\n\rDas Objekt ist sehr gut zu erreichen, der Hauptbahnhof mit den Möglichkeiten des öffentlichen Nah- und Fernverkehrs ist nur wenige Minuten entfernt. \n\r\n\rDie Nahversorgung ist in der Hainstraße sowie in den anliegenden Straßen der Innenstadt gegeben. \n\r', 'Diese Wohnung ist wie folgt ausgestattet:\r\r- 3 Zimmer\r- helle Wohnräume mit weißem Wandanstrich\r- Parkettfußboden in allen Wohnräumen sowie im Flur\r- Küche zugänglich vom Flur und Wohnbereich\r- Fußboden und Küchenspiegel des Küchenbereichs modern gefliest\r- modern gefliestes innenliegendes Badezimmer mit Badewanne, Dusche und Handtuchheizkörper\r- Gäste-WC mit Waschmaschinenplatz\r- Terrasse vom Wohnbereich begehbar\r- Abstellraum\r\rIm Haus befindet sich ein Aufzug. Ein Keller zur Wohneinheit ist verfügbar.', 'Die Stadt Leipzig mit rd. 582.000 Einwohnern ist neben der Landeshauptstadt Dresden die größte Stadt Sachsens und wirtschaftliches sowie kulturelles Zentrum der Region. Durch die tangierenden Autobahnen BAB 14 (Magdeburg-Dresden), die BAB 9 (Berlin-München), die BAB 38 (Leipzig-Göttingen) und den Flughafen Leipzig/Halle verfügt Leipzig über ein sehr gut ausgebautes Verkehrsnetz. \n\r\n\rDas Objekt in der Hainstraße 6 liegt im Zentrum der Stadt Leipzig. Die umliegende Bebauung ist durch Einzelhandelsflächen sowie Bürogebäude geprägt. \n\r', '- Ausstattung: Abstellraum, Dusche, Wanne\r\rWir bitten um Ihr Verständnis, dass alle Angaben und Preise unverbindlich sind und immer nur vorbehaltlich der Zustimmung des Eigentümers gelten.\n\r\rDie Anmietung der Wohnung ist ab sofort möglich.'];showqualicontactform;profile0;false;;true;premium;true;Sachsen;Leipzig;Deutschland;04109;51,341794865111;12,373945927811864;false;n;y;n;1182.5;7;17270687;y;well_kept;002.01008018163;n;;energy_consumption;district_heating;6;disabled;n;4711;y;195;central_heating;6;wohnung_miete;no_information;0,active;;y;139.19;6;;n;;3;3;;4611.011;no_information;https://pictures.immobilienscout24.de/listings/a73c0fcc-d9be-4321-83a9-b4d35e2fd342-1317779736.jpg/ORIG/resize/118x118%3E/extent/118x118/format/jpg/quality/80;13;5.69;16.75;5.69;;Sachsen;Leipzig;Zentrum;113369241;390;"Hainstra&szlig;e";Hainstraße;16 MBit/s;true;50 MBit/s;10 MBit/s;50 MBit/s;true;MagentaZuhause M Hybrid (2);web,email,bank,music,dl-ul,game,sd,mltstr,hd;über Hybrid;WITH_HYBRID;https://padlock.link/mmhy2;https://padlock.link/mmh2sa;telekom_layer_magenta_m_hybrid2;ONE_YEAR_FREE;2,4 MBit/s;;1572.5;apartment;1998;5;04109
2019-12-22 10:23:46.903783;/expose/114828410;['Der 2017 fertig gestellte Neubau verfügt über 6 Etagen und insgesamt 17 Wohneinheiten.\nDiese erreichen Sie bequem über den Personenaufzug. Ebenerdig finden Sie ein Parkdeck und 4 Außenstellplätze vor,\nein Außenstellplatz kann angemietet werden. Ein Fahrradraum steht allen Mieter zur Verfügung.\nBei der Planung wurde hoher Wert auf Energieeffizienz gelegt. Die Wärmeschutzdämmung, die Dreifachverglasung, der Kamin und die umweltfreundliche Fernwärme sorgen für niedrige Energiekosten.\nDurch die  Betriebskostenabrechnungen von 2017 und 2018\nbestätigt sich der hohe  energetische Standard des Gebäude, die Durchschnittswerte liegen pro m² bei 1,65€\nHochwertige Materialien in modernen Apartments und ein geschmackvolles Interieur sorgen für höchsten Wohnkomfort in bester Innenstadtlage.', 'Barrierefrei gelangen Sie vom Parkdeck über den geräumigen Lift in Ihre Wohnoase! \nDie raffiniert gestalteten, großzügigen Grundrisse bieten viel Raum für Inspiration und Gemütlichkeit. Große Fensterflächen fangen Wärme und Licht ein. \n\nÜber den Flur gelangen Sie in alle Räume der Wohnung. Der hochwertige Designboden mit Fußbodenheizung und elektrisch bedienbare Rollos vor den bodentiefen Fenstern, verleihen der Wohnung das moderne und luxeriöse Flair.\n\nDas Zeug zum Lieblingsplatz hat die 10 qm große Loggia mit Ostausrichtung,  ein idealer Ort für schöne Stunden mit Freunden und Familie. Gartenliebhaber haben hier genügend Platz um mit Ihrem grünen Daumen zu experimentieren. \n\nDer 30 m große Wohnraum bietet ein weiteres Highlight. Der Kingfire  Kamin verwöhnt Sie in der kalten Jahreszeit mit seiner behaglichen Wärme.\nDer Scheitholz Kamin hat eine selbstschließende Tür und ist raumluftunabhängig. Somit bietet der Kamin höchste Sicherheit.\nEin säubern der Glasfront wird unnötig durch ein selbstreinigendes Scheiben-Spülluftsystem. Der Hersteller garantiert eine ausgezeichnete und effiziente Heizleistung und Einsparungen bis zu 20%.\n\nGenießen und Wohlfühlen in einer durchdachten und nach Ihren Wünschen eingerichteten Küche spielen bei der Entscheidungsfindung eine wichtige Rolle. Dank der vorinstallierten Anschlüsse können Sie die Vorstellung von Ihrer Traumküche zeitnah in die Tat umsetzen.\n\nDie Wohnung verfügt über zwei Bäder, eines ist als Dusch und Wannenbad, das andere als reines Duschbad angelegt. Auch den Waschmaschinenanschluss finden Sie im geräumigen Duschbad.\nNatursteinfliesen, hochwertige Armaturen, das Einbauradio, der schwenkbarer LCD Fernseher, ebenerdige Rainshower, ein Doppelwaschtisch und ein Handtuchwandheizkörper  gehören zur Ausstattung.\n\nDeckendownlights sind in den Bädern und im Flur verbaut, eine Videogegensprechanlage ist in allen Wohnungen installiert.\n\nDas Schlafzimmer unterteilt sich in einen Ankleide und einen Schlafbereich. Im Gäste/Arbeitszimmer wird sich Ihr Besuch wie zu Hause fühlen.\n\nNicht zu vergessen ist der in der Wohnung integrierte Abstellraum, hier können Sie  ihr Kaminholz lagern.', 'Obwohl nur wenige Gehminuten vom lebendigen Augustusplatz entfernt, scheint die Zeit im graphischen Viertel still zu stehen! Eingebettet in ein gepflegtes Umfeld mit bestehender historischer Substanz und viel altem Baumbestand lässt es sich ruhig und erstklassig Leben.\n\nSämtliche Einrichtungen des täglichen Bedarfs sowie Schulen und Universitäten sind schnell erreicht. Oper und Gewandhaus sind nur ein Katzensprung entfernt. Die Anbindung an den öffentlichen Nah und Fernverkehr ist hervorragend.', 'Sind Sie neugierig geworden?\nDann vereinbaren Sie doch einen individuellen Einzelbesichtigungstermin mit mir.\nDafür stehe ich Ihnen jederzeit, gern auch an den Wochenenden zur Verfügung.\nIch freue mich auf Ihren Anruf!'];showqualicontactform;profile0;false;;true;premium;true;Sachsen;Leipzig;Deutschland;04103;51,3427815823258;12,388487425725716;false;n;y;y;1045;7;18522851;n;mint_condition;009.71e18452-78fa-40e6-9dc4-162ad2930ba3;y;NO_INFORMATION;energy_required;district_heating;4;;n;;n;;district_heating;26;wohnung_miete;sophisticated;0,active;2017;y;104.84;5;;n;1;3;3;6;114828410;no_information;https://pictures.immobilienscout24.de/listings/de440084-45d7-4653-bf97-afa836588520-1339048207.jpg/ORIG/resize/118x118%3E/extent/118x118/format/jpg/quality/80;13;4.65;15.98;4.65;;Sachsen;Leipzig;Zentrum_Ost;114828410;174;"B&uuml;ttnerstr.";Büttnerstr.;100 MBit/s;true;;;100 MBit/s;true;MagentaZuhause L;web,email,bank,music,dl-ul,game,sd,mltstr,hd,fast-ul-dl;über VDSL;REGULAR;https://padlock.link/ml;https://padlock.link/ioml;telekom_layer_magenta_l;ONE_YEAR_FREE;40 MBit/s;60.4;1219;apartment;2016;9;04103
