2019-12-22 10:22:58.718356;/expose/114786313;['Es handelt sich bei dem Objekt um ein Baudenkmal, daher besteht keine Pflicht zur Ausstellung von Energieausweisen.\r\rUnser vollständiges Wohnungsangebot in Leipzig und Umgebung finden Sie unter www.pisa-immobilien.de und \rweitere News unter https://www.facebook.com/PISA.IMMOBILIEN\r\rFür Rückfragen und Terminvereinbarungen stehen Ihnen die Makler der PISA IMMOBILIENMANAGEMENT GmbH - Co. KG gern zur Verfügung.\r', '++ 5,5-RW in der Südvorstadt ++\r\r- Maisonettewohnung\r\r- Aufzug\r\r- Terrasse\r\r- HWR\r\r- sehr große Küche mit Abstellraum\r\r- Zimmer mit Oberlicht\r\r- Bad mit Wanne, Dusche, Doppelwaschbecken und Fenster\r\r- Gäste-WC\r\r\r', 'Die Leipziger Südvorstadt grenzt unmittelbar an das Zentrum an. Sie erstreckt sich südlich von der Körnerstraße bis hin zur Richard-Lehmann-Straße sowie vom südlichem Auwald bis zum Bayerischen Bahnhof. Die Straßenzüge sind zum größten Teil durch gründerzeitliche, inzwischen sanierte, Altbauten geprägt. Das Sendezentrum des Mitteldeutschen Rundfunks (MDR) und die Hochschule für Technik, Wirtschaft und Kultur Leipzig (HTWK) sind bedeutende und prägnante Punkte der Südvorstadt. Geschäfte des täglichen Bedarfs, sowie Bus- und Bahnanbindung befinden sich in unmittelbarer Nähe. Die Fahrtzeit bis zur Innenstadt beträgt 10 Minuten.\rDurch den geplanten City-Tunnel mit Station am Bayerischen Bahnhof dürfte das Gebiet eine Aufwertung erfahren.\r In der Nähe befindlich: Universität, Kindertagesstätte, Nahverkehrsanbindung, Einkaufsmöglichkeit\r', ' BODENBELAG:\rFliesen/Laminat\rBAD:\rBad mit Wanne und Dusche, Doppelwaschbecken, Bad mit Fenster, Gäste WC, Boden: Fliesen/Stein\rKÜCHE:\rseparate Küche, Küche mit Fenster, Elektroherd, Anschluß für Geschirrspüler, Boden: Fliesen/Stein\rWASCHEN:\rAnschluss im Abstellraum\rWEITERES:\rBalkon, Zentralheizung (Gas), Maisonette (DG), Abstell: Keller oder Bodenabteil\rBitte haben Sie dafür Verständnis, dass alle Angaben und Preise sowie Reservierungen unverbindlich sind und immer nur vorbehaltlich der Zustimmung des Eigentümers gelten. Ein Rechtsanspruch auf ein Kauf- oder Mietvertrag kommt erst durch Gegenzeichnung des selbigen durch den Eigentümer zustande.'];showqualicontactform;profile0;false;;true;premium;true;Sachsen;Leipzig;Deutschland;04275;51,3179212548076;12,369218377516379;true;n;y;n;1499;7;5436764;n;refurbished;001.5436764;n;;no_information;gas;4;disabled;n;;n;;central_heating;67;wohnung_miete;normal;0,active;;y;156.48;7;;n;;5.5;5;;140530-M-02/4361/4.1;no_information;https://pictures.immobilienscout24.de/listings/bf6c34a5-17ab-4e54-a76c-e2f2e8d52ff8-1341080532.jpg/ORIG/resize/118x118%3E/extent/118x118/format/jpg/quality/80;18;4.5;16.11;4.5;;Sachsen;Leipzig;Südvorstadt;114786313;340;"August-Bebel-Stra&szlig;e";August-Bebel-Straße;100 MBit/s;true;;;100 MBit/s;true;MagentaZuhause L;web,email,bank,music,dl-ul,game,sd,mltstr,hd,fast-ul-dl;über VDSL;REGULAR;https://padlock.link/ml;https://padlock.link/ioml;telekom_layer_magenta_l;ONE_YEAR_FREE;40 MBit/s;;1839;maisonette;1890;1;04275
2019-12-22 10:22:59.386953;/expose/113502671;['Das Wohngebäude liegt in einer kleinen Nebenstraße in Schönau und ist mit einem ansehlichen Innenhof ausgestattet - der über Spielmöglichkeiten und einen Wäscheplatz verfügt. Durch die gute Anbindung an das Nahverkehrsnetz (Bus und Bahn) ist man in wenigen Minuten in der Innenstadt von Leipzig. Als Einkaufsmöglichkeit bietet sich das PEP und das Allee Center an - mit seiner Vielzahl an Geschäften und Restaurants sowie einem Kino. Im Südwesten Grünaus gelegenen ist der Kulkwitzer See.', 'Wohnung mit Aussicht ins Grüne. Die 3 Zimmer mit großem Balkon sind für eine kleine Familie gut geeignet. Vor Einzug müssen noch kleine Sanierungsarbeiten erledigt werden, die ca. 6 Wochen in Anspruch nehmen. Eine Vermietung ist frühestens ab dem 01.02.2020 möglich.'];showqualicontactform;profile0;false;;true;premium;true;Sachsen;Leipzig;Deutschland;04205;51,32870217242455;12,286928163507572;false;n;y;n;350;2;5415305;y;no_information;001.5415305;n;;;no_information;5;disabled;n;;n;78;;17;wohnung_miete;no_information;0,active;;n;68.68;3;;n;;3;3;6;134.2.15__3460--63;negotiable;https://pictures.immobilienscout24.de/listings/a536a673-03b6-453c-8113-8116ef0bc691-1321350224.jpg/ORIG/resize/118x118%3E/extent/118x118/format/jpg/quality/80;7;3.27;14.28;3.27;;Sachsen;Leipzig;Schönau;113502671;80;"Sch&ouml;nauer Ring";Schönauer_Ring;100 MBit/s;true;;;100 MBit/s;true;MagentaZuhause L;web,email,bank,music,dl-ul,game,sd,mltstr,hd,fast-ul-dl;über VDSL;REGULAR;https://padlock.link/ml;https://padlock.link/ioml;telekom_layer_magenta_l;ONE_YEAR_FREE;40 MBit/s;;;apartment;1981;4;04205
2019-12-22 10:23:00.893410;/expose/114842629;['Ihr neues Zuhause finden Sie hier! Das Dunckerviertel im Stadtteil Neulindenau zeichnet sich durch seine weitläufige Bebauung mit einem hohen Anteil an Grünflächen aus. Zu Fuß erreichen Sie mehrere erholsame Kleingartenanlagen, den Karl-Heine-Kanal und den Lindenauer Hafen. In der Nähe befinden sich Haltestellen des öffentlichen Nahverkehrs, Ärztehäuser, Schulen und Kindereinrichtungen.', 'gute Verkehrsanbindung Bus, Bahn,gute Einkaufsmöglichkeiten'];showqualicontactform;profile0;false;;true;premium;true;Sachsen;Leipzig;Deutschland;04179;51,3357691286667;12,308628850854303;true;n;y;n;485.21;3;17773;n;refurbished;001.17773;y;;;no_information;2;disabled;n;;n;84.38;central_heating;1;wohnung_miete;no_information;0,active;;n;70.32;3;;n;;3;3;3;1000.00072002.00001006;negotiable;https://pictures.immobilienscout24.de/listings/8f3ba3d0-4813-403b-a7b5-9bd29bd28578-1341557743.jpg/ORIG/resize/118x118%3E/extent/118x118/format/jpg/quality/80;2;3.4;16.24;3.4;;Sachsen;Leipzig;Neulindenau;114842629;84.39;Mansfelder Weg;Mansfelder_Weg;100 MBit/s;true;;;100 MBit/s;true;MagentaZuhause L;web,email,bank,music,dl-ul,game,sd,mltstr,hd,fast-ul-dl;über VDSL;REGULAR;https://padlock.link/ml;https://padlock.link/ioml;telekom_layer_magenta_l;ONE_YEAR_FREE;40 MBit/s;;653.98;no_information;1954;2;04179
2019-12-22 10:23:01.611978;/expose/114983806;"['Diese hochwertig ausgestattete 4-Raum-Wohnung befindet sich in einem neu sanierten Altbau mit beeindruckender Architektur. Vier sehr helle und freundliche Zimmer erstrecken sich hier auf knapp 108 Quadratmetern. Durch ihren pfiffigen Grundriss in Kombination mit den großen Fenstern sowie dem Echtholzparkett aus Eiche wird diese Immobilie zu einem richtigen Hingucker.\n\nÜber das gepflegte Treppenhaus, welches über einen Aufzug verfügt, erreicht man diese schöne Etagenwohnung im zweiten Obergeschoss. Hinter der verzierten Eingangstür empfängt Sie ein großzügiger Flur. Rechtsseitig des Flurs befinden sich zwei der drei Schlafzimmer. Das große Elternschlafzimmer ist schön geschnitten, verfügt über ein eigenes Gäste-WC mit Dusche und schafft durch seine drei Fenster eine sehr freundliche Atmosphäre. Die Trennwand ermöglicht die separate Nutzung eines Ankleidebereiches. Linksseitig des Flurs befindet sich ein weiteres sehr helles Schlafzimmer sowie das große Badezimmer mit Badewanne, Doppelwaschbecken und Tageslicht. Einen sehr edlen Touch verschafft der dunkel geflieste Fußboden, welcher auch in der offen gestalteten Küche anzufinden ist. Neben einer Speisekammer verfügt diese auch über einen Zugang zu dem schön ausgerichteten Balkon. Der großzügige Wohn- und Essbereich ist ebenfalls hell gestaltet und bietet ausreichend Platz um sich dekorativ einzurichten. Im Innenhof ist ein Gemeinschaftsgarten für die Mieter, ausgestattet mit einen Sandkasten und Platz für Kinder, geschützt vorhanden.\n\nVereinbaren Sie jetzt einen Besichtigungstermin und überzeugen Sie sich selbst von dieser schönen Immobilie.\n', 'Dieses schöne Objekt befindet sich im Leipziger Stadtteil Dölitz, unweit von der Innenstadt entfernt. Während Sie hier eine fantastische Infrastruktur genießen, können Sie den Stadttrubel während eines Spaziergangs durch den Göthe- oder den Agra-Park für kurze Zeit vergessen. Mehrere Einkaufsmöglichkeiten sowie jegliche Bildungseinrichtungen, Ärzte und gemütliche Restaurants befinden sich in unmittelbarer Umgebung. Highlight bildet die Nähe zum Leipziger Neuseenland, welches über die Bundesstraße 2 in nur zehn Autominuten erreicht werden kann - die perfekte Lage für Groß und Klein.\n', 'Seit vielen Jahren beraten wir unsere Kunden erfolgreich beim Kauf oder der Anmietung von Immobilien in Leipzig und Umgebung. Informieren sie sich über unser großes Angebot an wunderschönen Häusern und Mietwohnungen auf unserer Homepage, oder rufen sie uns an. Wir beraten sie gerne.\n\nwww.willuhn-immobilien.de\n\n \n\nWiderrufsbelehrung\n\nWenn Sie als Verbraucher eine Leistung kostenpflichtig bestellen, haben sie das folgende Widerrufsrecht: Sie haben das Recht, binnen vierzehn Tagen ohne Angabe von Gründen diesen Vertrag zu widerrufen. Die Widerrufsfrist beträgt vierzehn Tage ab dem Tag des Vertragsabschlusses. Um Ihr Widerrufsrecht auszuüben, müssen Sie uns mittels einer eindeutigen Erklärung (z.B. ein mit der Post versandter Brief, Telefax oder E-Mail) über Ihren Entschluss, diesen Vertrag zu widerrufen, informieren. Sie können dafür das beigefügte Widerrufsformular www.vvv-leipzig-immobilien.de/Widerrufsformular.pdf verwenden, das jedoch nicht vorgeschrieben ist. Zur Wahrung der Widerrufsfrist reicht es aus, dass Sie die Mitteilung über die Ausübung des Widerrufsrechts vor Ablauf der Widerrufsfrist absenden.\n\n\nDer Widerruf ist zu richten an:\nWilluhn Immobilien e.K.\nInh. Sabine Willuhn\nScherlstrasse 14\n04103 Leipzig\nTel.: 0341-30321212\nFax: 0341-30321211\nE-Mail: info@willuhn-immobilien.de\n\nFolgen des Widerrufs\nWenn Sie diesen Vertrag widerrufen, haben wir Ihnen alle Zahlungen, die wir von Ihnen erhalten haben, einschließlich der Lieferkosten (mit Ausnahme der zusätzlichen Kosten, die sich daraus ergeben, dass Sie eine andere Art der Lieferung als die von uns angebotene, günstigste Standardlieferung gewählt haben), unverzüglich und spätestens binnen vierzehn Tagen ab dem Tag zurückzuzahlen, an dem die Mitteilung über Ihren Widerruf dieses Vertrags bei uns eingegangen ist. Für diese Rückzahlung verwenden wir dasselbe Zahlungsmittel, das Sie bei der ursprünglichen Transaktion eingesetzt haben, es sei denn, mit Ihnen wurde ausdrücklich etwas anderes vereinbart; in keinem Fall werden Ihnen wegen dieser Rückzahlung Entgelte berechnet. Haben Sie verlangt, dass die Dienstleistungen während der Widerrufsfrist beginnen soll, so haben Sie uns einen angemessenen Betrag zu zahlen, der dem Anteil der bis zu dem Zeitpunkt, zu dem Sie uns von der Ausübung des Widerrufsrechts hinsichtlich dieses Vertrags unterrichten, bereits erbrachten Dienstleistungen im Vergleich zum Gesamtumfang der im Vertrag vorgesehenen Dienstleistungen entspricht.\n\nHinweis zum vorzeitigen Erlöschen des Widerrufsrechts\nIhr Widerrufsrecht erlischt bei einem Vertrag zur Erbringung von Dienstleistungen vorzeitig, wenn wir die Dienstleistung vollständig erbracht haben und mit der Ausführung der Dienstleistung erst begonnen haben, nachdem Sie dazu Ihre ausdrückliche Zustimmung gegeben haben und gleichzeitig Ihre Kenntnis davon bestätigt haben, dass Sie Ihr Widerrufsrecht bei vollständiger Vertragserfüllung durch uns verlieren.\n']";showqualicontactform;profile0;false;;true;premium;true;Sachsen;Leipzig;Deutschland;04279;51,28930387621;12,391587971635072;true;n;y;n;939;6;4178540;y;no_information;001.4178540;y;NO_INFORMATION;energy_consumption;gas;2;;n;;n;;central_heating;176;wohnung_miete;luxury;0,active;2019;y;108;5;;n;;4;4;4;317114;no_information;https://pictures.immobilienscout24.de/listings/1e8f54b6-148b-4499-ba2b-1bcf03b477db-1341255209.jpg/ORIG/resize/118x118%3E/extent/118x118/format/jpg/quality/80;19;3.33;12.4;3.33;;Sachsen;Leipzig;Dölitz_Dösen;114983806;260;"Bornaische Stra&szlig;e";Bornaische_Straße;100 MBit/s;true;;;100 MBit/s;true;MagentaZuhause L;web,email,bank,music,dl-ul,game,sd,mltstr,hd,fast-ul-dl;über VDSL;REGULAR;https://padlock.link/ml;https://padlock.link/ioml;telekom_layer_magenta_l;ONE_YEAR_FREE;40 MBit/s;103;1199;apartment;;;04279
2019-12-22 10:23:02.366307;/expose/110886227;['Raum für alles, Freiraum für jeden: Das neu entstehende Wohnensemble Garten Carré im Graphischen Viertel erfüllt die Ansprüche urban orientierter Singles ebenso wie die Bedürfnisse moderner Familien. Die unterschiedlichen Wohnungstypen überzeugen mit einer wertigen Ausstattung, privaten Außenbereichen und Annehmlichkeiten wie Aufzug und Tiefgarage. Für ein harmonisches Miteinander und gelebte Nachbarschaft steht Ihnen der großzügige und mit viel Grün gestaltete Innenhof im Herzen des Garten Carré offen.', '• Weitsichtig: Balkon, Dachterrasse oder Terrasse/Garten\r\n• Natürlich: Eiche-Echtholzparkett in allen Wohn-, Schlaf-,Kinder-/Arbeits- bzw. Gästezimmern, Flur/Diele und in offenen Küchen\r\n• Exklusiv: hochwertige Marken-Bodenfliesen in (geschlossenen) Küchen, Bädern und im Abstellraum\r\n• Repräsentativ: modern geflieste Bäder mit weißen Marken-Sanitärobjekten (wandhängendes Tiefspül-WC, Waschtisch, verchromte Armaturen, Badewanne und/oder bodengleiche Dusche, teilw. mit Gäste-WC\r\n• Einladend: deutsche Marken-Einbauküche inklusive Marken-Geräte (Cerankochfeld, Heißluft-Backofen, Flachschirm-Dunstabzugshaube, Kühl-Gefrierkombination,Geschirrspülmaschine, Edelstahlspüle mit Armatur)\r\n• Behaglich: Fußbodenheizung, Handtuchheizkörper (Bad)\r\n• Hell: Wände mit Malerflies tapeziert und weiß gestrichen\r\n• Multimedia: Breitbandkabel-Anschluss\r\n• Schützend: Kunststofffenster mit 3-fach-Isolierverglasung, Sonnenschutz durch Rollläden\r\n• Sicherheitshalber: Türsprechanlage mit Farb-Videoauge und Farbdisplay in der Wohnung\r\n• Komfortabel: Pkw-Stellplätze in der Tiefgarage, mit\r\ndem Aufzug geht es bequem auf die Wohnungsetage\r\n• Extra: Geschäfte im Erdgeschoss', 'Das GartenCarré ist zuhause im Zentrum-Ost im Graphischen Viertel – ein beliebter und lebhafter\r\nLeipziger Stadtteil mit erstklassiger Infrastruktur.\r\n\r\n\r\nALLES ZUM GREIFEN NAH\r\nFür den täglichen Bedarf erwarten Sie unterschiedlichste Einkaufsmöglichkeiten in unmittelbarer Nähe. Kultur, Shopping, Business, Bildung und Ausgehen – auch das ist alles zu Fuß erreichbar. Bis zum Augustusplatz mit Gewandhaus, Universität und Konzerthaus sind es zum Beispiel nur 10 Gehminuten. Ebenfalls nur einen Katzensprung\r\nentfernt ist die wunderschöne Altstadt. Genießen Sie die vielen geschichtsträchtigen Jugendstil-Gebäude und berühmten Sehenswürdigkeiten.\r\n\r\n\r\nENTSPANNUNG PUR – IM PARK, ZOO ODER AM SEE\r\nRelaxen können Sie je nach Lust und Laune in den vielen Parks und Grünanlagen der Stadt, zum Beispiel im Clara-Zetkin-Park oder im berühmten Leipziger Zoo. Im Sommer bieten die zahlreichen Seen im Süden Leipzigs eine willkommene Abwechslung.\r\n\r\n\r\nZENTRALER GEHTʼS NICHT\r\nMit mehreren Tram- und Buslinien ist der Stadtteil gut an den Öffentlichen Personennahverkehr angeschlossen. Der Hauptbahnhof liegt nur 10 Gehminuten entfernt. Über die Bundesstraße B2 gelangen Sie auf die A14 – und von da aus in nicht mal einer halben Stunde zum internationalen Leipzig/Halle Airport. Falls Sie das Fernweh packt.', '- Waschmaschinenanschluss vorhanden\n- Vollbad\n- Parkett\n- Keller\n- Erstbezug'];showqualicontactform;profile0;false;;true;schaufenster;;Sachsen;Leipzig;Deutschland;04103;51,3347544576297;12,475476585419747;true;n;y;n;847.27;6;18286671;n;no_information;002.01009099501;y;;;no_information;;;n;;y;66.7;;26;wohnung_miete;no_information;0,active;;y;79.24;3;true;y;;3;3;;3009.36402.0002;no_information;https://pictures.immobilienscout24.de/listings/b67d4291-dc66-4544-9098-c7a3e135fdda-1341602435.jpeg/ORIG/resize/118x118%3E/extent/118x118/format/jpg/quality/80;8;2.84;11.88;2.84;80443;Sachsen;Leipzig;Engelsdorf;110886227;113.19;"Querstra&szlig;e ";Querstraße_;100 MBit/s;true;;;100 MBit/s;true;MagentaZuhause L;web,email,bank,music,dl-ul,game,sd,mltstr,hd,fast-ul-dl;über Glasfaser;REGULAR;https://padlock.link/ml;https://padlock.link/ioml;telekom_layer_magenta_l;ONE_YEAR_FREE;40 MBit/s;;1027.16;apartment;2018;9;04103
2019-12-22 10:23:03.191222;/expose/94170380;['Das Mehrfamilienhaus befindet sich in einer ruhig gelegenen Lage im Stadtteil Gohlis Nord. Das Gebäude ist voll unterkellert und verfügt über einen Trocken- sowie Fahrradraum. Der Innenhof ist begrünt und ein Spielplatz erfreut Ihre Kinder.', 'Die 3-Raumwohnung befindet sich im 2. Obergeschoss. Sie verfügt über ein großes Wohnzimmer, separate Küche und ein modern gefliestes Bad mit Wanne. Die Wohnung wurde renoviert, der Fußboden wurde mit Laminat ausgestattet.\nAuf Wunsch stellen wir Ihnen gern eine Einbauküche zur Verfügung.\n\n+ einen Monat Kaltmietfreiheit sichern, bei zeitnahem Abschluss eines Mietvertrages +', 'Die angebotene Wohnung befindet sich in Gohlis Nord in einer begrünten Wohnanlage. Ein kleiner Wald ist fußläufig erreichbar und lädt zum Spaziergang ein. Einkaufsmöglichkeiten für den täglichen Bedarf, sowie Kitas und eine Grundschule sind in unmittelbarer Nähe.', 'Bei Zustandekommen des Mietvertrags wird Ihnen  die erste Kaltmiete geschenkt. Gern vereinbaren wir mit Ihnen einen Besichtigungstermin unter 0341 - 256 594 547. \n\nSollte es sich hierbei nicht um Ihre Traumwohnung handeln, rufen Sie dennoch an. Wir finden auch für Sie die passende Wohnung.'];showqualicontactform;profile0;false;;true;premium;true;Sachsen;Leipzig;Deutschland;04157;51,38088237723799;12,363887740652617;false;n;y;n;410;3;15702674;y;well_kept;002.01002851216;y;;energy_consumption;district_heating;2;disabled;n;1877;n;69.5;no_information;44;wohnung_miete;normal;0,active;2017;n;62.23;3;;n;;3;3;4;3.03/1877;negotiable;https://pictures.immobilienscout24.de/listings/f3406e7b-33b8-4e49-9000-a90a5c26dc18-1126603065.jpg/ORIG/resize/118x118%3E/extent/118x118/format/jpg/quality/80;17;3.13;;;;Sachsen;Leipzig;Gohlis_Nord;94170380;69.5;Sylter Str.;Sylter_Str.;100 MBit/s;true;;;100 MBit/s;true;MagentaZuhause L;web,email,bank,music,dl-ul,game,sd,mltstr,hd,fast-ul-dl;über VDSL;REGULAR;https://padlock.link/ml;https://padlock.link/ioml;telekom_layer_magenta_l;ONE_YEAR_FREE;40 MBit/s;111.01;549;apartment;1987;4;04157
2019-12-22 10:23:03.978242;/expose/114308006;['Die gemütliche kleine Wohnung befindet sich in einem ruhigen Hinterhaus des Grundstückes Breslauer Straße 12..\n\nEs erwartet Sie ein 2-Zimmer-Apartment mit einer offenen Küche inkl. neuer Einbauküche und ein geräumiges Tageslichtbad. \nVom Wohnzimmer aus gelangen Sie in das kuschlige Schlafzimmer.', '- Böden: neues, modernes Laminat\n- Bad: vollständige Sanierung (neue Fliesen & sanitärgegenstände)\n- Wände & Decken: Raufaser Tapete weiß (neu)', 'Der südöstlich gelegene Stadtteil Stötteritz ist einer der ruhigsten in ganz Leipzig. Die Magistrale Holzhäuser Straße trennt das Viertel im Bezug auf die Häuserlandschaft. Während man im östlichen Teil von Stötteritz größtenteils sanierte Gründerzeitbauten vorfindet, stehen im westlichen Teil vornehmlich, ab 1915 erbaute, großzügige Wohnhäuser und Villen. Besonders Studenten und Familien mit Kindern wohnen in diesem Stadtteil mit ihrem unverwechselbaren Flair. Freizeitaktivitäten erschließen sich durch das angrenzende Stötteritzer Wäldchen oder das Völkerschlachtdenkmal. Einkaufsmöglichkeiten für den täglichen Bedarf sind etliche vorhanden und die Innenstadt ist gut angeschlossen.', 'Wir freuen uns auf die Besichtigung mit Ihnen !!'];showqualicontactform;profile0;false;;true;premium;true;Sachsen;Leipzig;Deutschland;04299;51,3231879658713;12,414617550061774;false;n;n;n;499;3;18111493;y;refurbished;009.67027a06-5d6f-408e-8739-82a88b30d05e;y;NO_INFORMATION;energy_consumption;oil;1;;y;;y;;no_information;12;wohnung_miete;normal;0,active;;n;55;2;;n;;2;2;3;114308006;no_information;https://pictures.immobilienscout24.de/listings/3d01fee7-fefd-49e7-b9ae-48d7348b7293-1339826514.jpg/ORIG/resize/118x118%3E/extent/118x118/format/jpg/quality/80;9;4.13;14.64;4.13;;Sachsen;Leipzig;Stötteritz;114308006;131;"Breslauer Stra&szlig;e";Breslauer_Straße;100 MBit/s;true;;;100 MBit/s;true;MagentaZuhause L;web,email,bank,music,dl-ul,game,sd,mltstr,hd,fast-ul-dl;über VDSL;REGULAR;https://padlock.link/ml;https://padlock.link/ioml;telekom_layer_magenta_l;ONE_YEAR_FREE;40 MBit/s;158;630;ground_floor;1912;1;04299
2019-12-22 10:23:04.793009;/expose/114867929;"['Das um 1885 erbaute Mehrfamilienhaus wurde im Jahr 2009 umfassend saniert.', 'Wohnräume: In allen Wohnräumen befinden sich Anschlüsse für Telefon und Kabelfernsehen. Als Bodenbelag wurde dunkles Laminat ausgewählt.\r\n\r\nBadezimmer: Besonderes Augenmerk verdient das modern designte Bad. Es verfügt über eine Badewanne. Über dem mit Holzapplikationen umrandeten, eckigen Waschbecken ist bereits ein passender Spiegel integriert. Auch an die Beleuchtung wurde gedacht, von der Decke strahlen Halogenspots. Alles in allem wurde ein Badezimmer geschaffen, in dem Sie sich durch und durch wohlfühlen werden.\r\n\r\nKüche: Der Fliesenspiegel der Küche besteht aus großen, granitartigen Fliesen in modernem Design.\r\n\r\nFlur: Der Flur verfügt ebenfalls über einen Laminatboden. In die Flurdecke sind Halogenspots integriert.\r\n\r\nBalkon: Der über die Küche zugängliche Balkon bietet einen gemütlichen Platz zum Entspannen an der frischen Luft.', 'Das Objekt befindet sich im beliebten Stadtteil Gohlis. In wenigen Gehminuten erreichen sie das Rosental und damit Leipzigs grünen Gürtel. Ob Startpunkt zur Fahrradtour, zum Joggen oder Spaziergang mit ihrem Vierbeiner. Hier können SIe ""fernab der Stadt"" die Natur genießen. Öffentliche Verkehrsmittel und Einkaufsmöglichkeiten befinden sich vor der Haustür. Das Stadtzentrum erreichen Sie mit dem Auto oder Fahrrad in ca. 10 Minuten.']";showqualicontactform;profile0;false;;true;premium;true;Sachsen;Leipzig;Deutschland;04155;51,3652516628435;12,365690400110566;false;n;y;n;380;2;3916561;y;well_kept;001.3916561;y;;;no_information;2;;n;;n;;central_heating;2;wohnung_miete;sophisticated;0,active;2009;n;50.11;2;;n;;2;2;3;Magdeburger2 WE04;no_information;https://pictures.immobilienscout24.de/listings/1f359e10-e4ed-4163-93d8-586894be7a80-1339636698.jpg/ORIG/resize/118x118%3E/extent/118x118/format/jpg/quality/80;10;4.02;14.2;4.02;;Sachsen;Leipzig;Gohlis_Süd;114867929;140;"Magdeburger Stra&szlig;e";Magdeburger_Straße;100 MBit/s;true;;;100 MBit/s;true;MagentaZuhause L;web,email,bank,music,dl-ul,game,sd,mltstr,hd,fast-ul-dl;über VDSL;REGULAR;https://padlock.link/ml;https://padlock.link/ioml;telekom_layer_magenta_l;ONE_YEAR_FREE;40 MBit/s;;520;apartment;1885;1;04155
2019-12-22 10:23:05.445743;/expose/114974156;['Innerstädtisch, neben großen Parkanlagen und in der Nachbarschaft des alten Reichsgerichtes und den Hochschulen für Grafik und Buchkunst Theater und Musik gelegen, bietet Ihnen das Musikviertel alle Vorzüge des modernen Wohnens. Genießen Sie den Blick aus dem Fenster über Leipzigs Innenstadt sowie den Clara-Zetkin-Park. Richten Sie sich Ihre Wohnung nach Ihren Wünschen vor. Wir beraten Sie gern. Ein Parkplatz für Ihren PKW kann am Grundstück oder in unmittelbarer Umgebung angemietet werden.', 'gute Verkehrsanbindung Bus, Bahn,gute Einkaufsmöglichkeiten'];showqualicontactform;profile0;false;;true;premium;true;Sachsen;Leipzig;Deutschland;04107;51,3302976071645;12,36350767264732;true;n;y;n;205;1;17773;n;no_information;001.17773;y;;;no_information;4;disabled;n;;n;40;central_heating;6;wohnung_miete;no_information;0,active;;y;28.75;1;;n;;1;1;6;1000.00003204.00001037;negotiable;https://pictures.immobilienscout24.de/listings/c7353fb7-d26e-4b54-b554-cdfe17a44f58-1341555688.jpg/ORIG/resize/118x118%3E/extent/118x118/format/jpg/quality/80;2;4.55;15.7;4.55;;Sachsen;Leipzig;Zentrum_Süd;114974156;45;"Schw&auml;grichenstr.";Schwägrichenstr.;16 MBit/s;true;50 MBit/s;10 MBit/s;50 MBit/s;true;MagentaZuhause M Hybrid (2);web,email,bank,music,dl-ul,game,sd,mltstr,hd;über Hybrid;WITH_HYBRID;https://padlock.link/mmhy2;https://padlock.link/mmh2sa;telekom_layer_magenta_m_hybrid2;ONE_YEAR_FREE;2,4 MBit/s;;290;no_information;1982;4;04107
