2019-12-22 10:22:10.331979;/expose/114621140;['Ihr neues Zuhause erwartet Sie im Hochparterre eines sanierten Mehrfamilienhauses.\n\nEin Kellerabteil gehört mit zum Angebot und kann kostenfrei genutzt werden.', 'Zu den zwei gut geschnittenen Wohnräumen gehören noch ein Tageslichtbad mit Wanne sowie eine separate Küche mit Fenster.\n\nVom Wohnzimmer aus gelangen Sie in das Schlafzimmer.\n\nDie Wohnräume sind mit modernem Laminat ausgelegt.', 'Ein bei den Leipzigern sehr beliebter Stadtteil ist Großzschocher, südwestlich vom Stadtzentrum gelegen.\nAufgelockerte Bebauung und großzügige Grünanlagen erhöhen den Wohnkomfort in diesem Gebiet.\nDie Anbindung an den öffentlichen Nahverkehr ist sehr gut. Einkaufsmöglichkeiten sowie Schulen und Dienstleister sind im Wohngebiet vorhanden.', 'Für eine Besichtigung freuen wir uns auf Ihren Anruf unter: 0341 / 256 594 536.\nSollte es sich hierbei noch nicht um Ihre Traumwohnung handeln, freuen wir uns ebenfalls auf Ihren Anruf - wir finden bestimmt auch für Sie etwas Passendes.\n\nAlle Angaben in diesem Exposé wurden sorgfältig und so vollständig wie möglich erfasst. Gleichwohl kann das Vorhandensein von Fehlern nicht ausgeschlossen werden. Die Angaben in diesem Exposé erfolgen daher ohne jede Gewähr. Maßgeblich sind die im Mietvertrag geschlossenen Vereinbarungen. Mietverhandlungen sind ausschließlich über die benannte Verwaltung zu führen. Mietpreisänderungen bleiben vorbehalten.'];showqualicontactform;profile0;false;;true;schaufenster;true;Sachsen;Leipzig;Deutschland;04249;51,303035744189;12,325026006989843;false;n;n;n;315;2;15702674;y;refurbished;002.01002851216;y;NO_INFORMATION;energy_consumption;district_heating;0;disabled;n;;n;65;central_heating;25;wohnung_miete;no_information;0,active;2016;n;45.52;2;;n;;2;2;4;2.07-6506;negotiable;https://pictures.immobilienscout24.de/listings/fbac38f1-2539-4019-8af9-12c94e2f1075-1335938575.jpg/ORIG/resize/118x118%3E/extent/118x118/format/jpg/quality/80;12;3;12.66;3;;Sachsen;Leipzig;Großzschocher;114621140;46;Karl-Heft-Str. ;Karl-Heft-Str._;100 MBit/s;true;;;100 MBit/s;true;MagentaZuhause L;web,email,bank,music,dl-ul,game,sd,mltstr,hd,fast-ul-dl;über VDSL;REGULAR;https://padlock.link/ml;https://padlock.link/ioml;telekom_layer_magenta_l;ONE_YEAR_FREE;40 MBit/s;70;426;raised_ground_floor;1965;2;04249
2019-12-22 10:22:11.026505;/expose/112543538;['\r\n\r\nAusstattungsmerkmale: \r\n-Parkettboden\r\n-Badewanne/Dusche/WC\r\n-Gäste WC\r\n-exklusives Bad\r\n-Aufzug\r\n-Keller\r\n-Balkon\r\n-Erstbezug\r\n-Einbauküche\r\n-Küche mit Fenster\r\n-Fußbodenheizung\r\n-Bad mit Fenster\r\n-Abstellraum', 'Zentrum-West ist ein vielfältiges Stadtviertel - hier entdeckt man die unterschiedlichen Gesichter der Stadt. Das Bachviertel liegt direkt neben dem Elsterflutbecken, weist prächtige alte Villen auf und knüpft über den Johannapark hinweg an das Musikerviertel an. Im Übergangsbereich zwischen dem Zentrum-West und der Innenstadt befindet sich das Kolonnadenviertel - ein farbenfrohes und lebendiges und für Leipziger Verhältnisse junges Viertel. Durch die zentrale Lage besteht eine hervorragende Anbindung zu Nah- und Fernverkehr. Alle zentralen Punkte der Leipziger City sowie der Hauptbahnhof sind in wenigen Minuten erreichbar. Im Zentrum West befindet sich zudem ein Teil der Gottschedstraße. Der andere Teil führt - über die Käthe-Kollwitz-Straße hinaus - direkt in die City. Die Gottschedstraße ist eine der beliebtesten Kneipenmeilen Leipzigs und lädt mit einem reichhaltigen Angebot an Cafés und Restaurants zum Verweilen ein.', 'Folgende Unterlagen werden angefordert/benötigt:\r\n- Selbstauskunft\r\n- Schufaeinwilligung    \r\n- Vorvermieterbescheinigung \r\n- Kopie Personalausweis\r\n- Einkommensnachweise\r\n- Nachweis einer Haftpflichtversicherung\r\n\r\nDie Formulare finden Sie unter www.kuenne-immobilien.de/vermietung.\r\n\r\nDer Mietvertrag wird mit einer Mindestlaufzeit von zwei Jahren und nach der Mindestmietzeit mit einer Staffelmiete abgeschlossen.'];showqualicontactform;profile0;false;;true;premium;true;Sachsen;Leipzig;Deutschland;04105;51,343325149194;12,35808932871466;false;n;y;n;1580;8;5367601;n;first_time_use_after_refurbishment;001.5367601;y;;;no_information;3;;n;;n;;;13;wohnung_miete;no_information;0,active;2019;y;150.12;6;;n;;4;4;4;581467;no_information;https://pictures.immobilienscout24.de/listings/51554194-2264-4310-9018-63a46c8927a2-1341262225.jpg/ORIG/resize/118x118%3E/extent/118x118/format/jpg/quality/80;13;4.3;15.29;4.3;;Sachsen;Leipzig;Zentrum_Nordwest;112543538;351;"Waldstra&szlig;e";Waldstraße;100 MBit/s;true;;;100 MBit/s;true;MagentaZuhause L;web,email,bank,music,dl-ul,game,sd,mltstr,hd,fast-ul-dl;über VDSL;REGULAR;https://padlock.link/ml;https://padlock.link/ioml;telekom_layer_magenta_l;ONE_YEAR_FREE;40 MBit/s;;;apartment;;;04105
2019-12-22 10:22:11.722666;/expose/113502671;['Das Wohngebäude liegt in einer kleinen Nebenstraße in Schönau und ist mit einem ansehlichen Innenhof ausgestattet - der über Spielmöglichkeiten und einen Wäscheplatz verfügt. Durch die gute Anbindung an das Nahverkehrsnetz (Bus und Bahn) ist man in wenigen Minuten in der Innenstadt von Leipzig. Als Einkaufsmöglichkeit bietet sich das PEP und das Allee Center an - mit seiner Vielzahl an Geschäften und Restaurants sowie einem Kino. Im Südwesten Grünaus gelegenen ist der Kulkwitzer See.', 'Wohnung mit Aussicht ins Grüne. Die 3 Zimmer mit großem Balkon sind für eine kleine Familie gut geeignet. Vor Einzug müssen noch kleine Sanierungsarbeiten erledigt werden, die ca. 6 Wochen in Anspruch nehmen. Eine Vermietung ist frühestens ab dem 01.02.2020 möglich.'];showqualicontactform;profile0;false;;true;premium;true;Sachsen;Leipzig;Deutschland;04205;51,32870217242455;12,286928163507572;false;n;y;n;350;2;5415305;y;no_information;001.5415305;n;;;no_information;5;disabled;n;;n;78;;17;wohnung_miete;no_information;0,active;;n;68.68;3;;n;;3;3;6;134.2.15__3460--63;negotiable;https://pictures.immobilienscout24.de/listings/a536a673-03b6-453c-8113-8116ef0bc691-1321350224.jpg/ORIG/resize/118x118%3E/extent/118x118/format/jpg/quality/80;7;3.27;14.28;3.27;;Sachsen;Leipzig;Schönau;113502671;80;"Sch&ouml;nauer Ring";Schönauer_Ring;100 MBit/s;true;;;100 MBit/s;true;MagentaZuhause L;web,email,bank,music,dl-ul,game,sd,mltstr,hd,fast-ul-dl;über VDSL;REGULAR;https://padlock.link/ml;https://padlock.link/ioml;telekom_layer_magenta_l;ONE_YEAR_FREE;40 MBit/s;;;apartment;1981;4;04205
2019-12-22 10:22:13.184432;/expose/114875055;['Unsere Wohnanlage liegt im nördlichen Stadtteil von Möckern. Unweit unserer Wohnanlage finden Sie die Burgaue, das Leutzscher Holz und das Naherholungsgebiet Auensee. Einkaufsmöglichkeiten gibt es auf der Georg-Schumann-Straße, z.B. im EKZ\xa0am Viadukt oder in der AXIS-Passage. Kindergärten und Schulen sind im Wohngebiet angesiedelt. Es besteht mit den Buslinien 80, 190 und 191, den Straßenbahnlinien 10 und 11 sowie mit der S-Bahn eine gute Verkehrsanbindung.', 'gute Verkehrsanbindung Bus, Bahn und S-Bahn,gute Einkaufsmöglichkeiten'];showqualicontactform;profile0;false;;true;schaufenster;true;Sachsen;Leipzig;Deutschland;04159;51,3695417152732;12,348725010566346;true;n;y;n;370;2;17773;n;refurbished;001.17773;y;;;no_information;1;disabled;n;;n;65;central_heating;47;wohnung_miete;no_information;0,active;;n;61.46;3;;n;;3;3;4;1000.00080501.00001060;negotiable;https://pictures.immobilienscout24.de/listings/2038c5ce-fbc0-4cfc-9aee-839920c45151-1341556154.jpg/ORIG/resize/118x118%3E/extent/118x118/format/jpg/quality/80;2;3.8;14.48;3.8;;Sachsen;Leipzig;Möckern;114875055;70;Faradaystr.;Faradaystr.;100 MBit/s;true;;;100 MBit/s;true;MagentaZuhause L;web,email,bank,music,dl-ul,game,sd,mltstr,hd,fast-ul-dl;über VDSL;REGULAR;https://padlock.link/ml;https://padlock.link/ioml;telekom_layer_magenta_l;ONE_YEAR_FREE;40 MBit/s;;505;no_information;1931;1;04159
2019-12-22 10:22:13.937692;/expose/114621140;['Ihr neues Zuhause erwartet Sie im Hochparterre eines sanierten Mehrfamilienhauses.\n\nEin Kellerabteil gehört mit zum Angebot und kann kostenfrei genutzt werden.', 'Zu den zwei gut geschnittenen Wohnräumen gehören noch ein Tageslichtbad mit Wanne sowie eine separate Küche mit Fenster.\n\nVom Wohnzimmer aus gelangen Sie in das Schlafzimmer.\n\nDie Wohnräume sind mit modernem Laminat ausgelegt.', 'Ein bei den Leipzigern sehr beliebter Stadtteil ist Großzschocher, südwestlich vom Stadtzentrum gelegen.\nAufgelockerte Bebauung und großzügige Grünanlagen erhöhen den Wohnkomfort in diesem Gebiet.\nDie Anbindung an den öffentlichen Nahverkehr ist sehr gut. Einkaufsmöglichkeiten sowie Schulen und Dienstleister sind im Wohngebiet vorhanden.', 'Für eine Besichtigung freuen wir uns auf Ihren Anruf unter: 0341 / 256 594 536.\nSollte es sich hierbei noch nicht um Ihre Traumwohnung handeln, freuen wir uns ebenfalls auf Ihren Anruf - wir finden bestimmt auch für Sie etwas Passendes.\n\nAlle Angaben in diesem Exposé wurden sorgfältig und so vollständig wie möglich erfasst. Gleichwohl kann das Vorhandensein von Fehlern nicht ausgeschlossen werden. Die Angaben in diesem Exposé erfolgen daher ohne jede Gewähr. Maßgeblich sind die im Mietvertrag geschlossenen Vereinbarungen. Mietverhandlungen sind ausschließlich über die benannte Verwaltung zu führen. Mietpreisänderungen bleiben vorbehalten.'];showqualicontactform;profile0;false;;true;schaufenster;true;Sachsen;Leipzig;Deutschland;04249;51,303035744189;12,325026006989843;false;n;n;n;315;2;15702674;y;refurbished;002.01002851216;y;NO_INFORMATION;energy_consumption;district_heating;0;disabled;n;;n;65;central_heating;25;wohnung_miete;no_information;0,active;2016;n;45.52;2;;n;;2;2;4;2.07-6506;negotiable;https://pictures.immobilienscout24.de/listings/fbac38f1-2539-4019-8af9-12c94e2f1075-1335938575.jpg/ORIG/resize/118x118%3E/extent/118x118/format/jpg/quality/80;12;3;12.66;3;;Sachsen;Leipzig;Großzschocher;114621140;46;Karl-Heft-Str. ;Karl-Heft-Str._;100 MBit/s;true;;;100 MBit/s;true;MagentaZuhause L;web,email,bank,music,dl-ul,game,sd,mltstr,hd,fast-ul-dl;über VDSL;REGULAR;https://padlock.link/ml;https://padlock.link/ioml;telekom_layer_magenta_l;ONE_YEAR_FREE;40 MBit/s;70;426;raised_ground_floor;1965;2;04249
2019-12-22 10:22:14.957691;/expose/114842629;['Ihr neues Zuhause finden Sie hier! Das Dunckerviertel im Stadtteil Neulindenau zeichnet sich durch seine weitläufige Bebauung mit einem hohen Anteil an Grünflächen aus. Zu Fuß erreichen Sie mehrere erholsame Kleingartenanlagen, den Karl-Heine-Kanal und den Lindenauer Hafen. In der Nähe befinden sich Haltestellen des öffentlichen Nahverkehrs, Ärztehäuser, Schulen und Kindereinrichtungen.', 'gute Verkehrsanbindung Bus, Bahn,gute Einkaufsmöglichkeiten'];showqualicontactform;profile0;false;;true;premium;true;Sachsen;Leipzig;Deutschland;04179;51,3357691286667;12,308628850854303;true;n;y;n;485.21;3;17773;n;refurbished;001.17773;y;;;no_information;2;disabled;n;;n;84.38;central_heating;1;wohnung_miete;no_information;0,active;;n;70.32;3;;n;;3;3;3;1000.00072002.00001006;negotiable;https://pictures.immobilienscout24.de/listings/8f3ba3d0-4813-403b-a7b5-9bd29bd28578-1341557743.jpg/ORIG/resize/118x118%3E/extent/118x118/format/jpg/quality/80;2;3.4;16.24;3.4;;Sachsen;Leipzig;Neulindenau;114842629;84.39;Mansfelder Weg;Mansfelder_Weg;100 MBit/s;true;;;100 MBit/s;true;MagentaZuhause L;web,email,bank,music,dl-ul,game,sd,mltstr,hd,fast-ul-dl;über VDSL;REGULAR;https://padlock.link/ml;https://padlock.link/ioml;telekom_layer_magenta_l;ONE_YEAR_FREE;40 MBit/s;;653.98;no_information;1954;2;04179
2019-12-22 10:22:15.632792;/expose/114786315;['Unser vollständiges Wohnungsangebot in Leipzig und Umgebung finden Sie unter www.pisa-management.de und \rweitere News unter https://www.facebook.com/PISA.IMMOBILIEN \r\rFür Rückfragen und Terminvereinbarungen stehen Ihnen die Makler der PISA IMMOBILIENMANAGEMENT GmbH - Co. KG gern zur Verfügung.\r', '++ Geräumige 2-RW am Park ++\r\r- großes Wohnzimmer\r\r- Laminatboden\r\r- Bad mit Wanne und Fenster\r\r- separate Küche mit Fenster\r\r- WM-anschluss in der Küche\r\r- Zentralheizung\r', 'Kleinzschocher, ein Stadtteil im Südwesten von Leipzig, bietet durch den nahgelegenen Volkspark und den nur wenige Kilometer entfernten Cospudener See zahlreiche Möglichkeiten zur Freizeitgestaltung und Erholung. \r\rKulturelle Unterhaltung für Jungund Alt findet man unter anderem im Lichtspielhaus Schauburg -Am Adler-. Zahlreiche Einkaufsmöglichkeiten befinden sich meist in kurzer fußläufiger Entfernung und das Stadtzentrum Leipzigs ist mit den öffentlichen Verkehrsmitteln in nur wenigen Minuten erreichbar. In der Nähe befindlich: Grundschule, Realschule, Hauptschule, Gymnasium, Universität, Fachhochschule, Kindertagesstätte, Nahverkehrsanbindung, Einkaufsmöglichkeit\r', ' BODENBELAG:\rLaminat\rBAD:\rBad mit Fenster, Bad mit Wanne, Boden: Fliesen/Stein\rKÜCHE:\rseparate Küche, Küche mit Fenster, Anschluss für Elektroherd, Anschluß für Geschirrspüler, Boden: Fliesen/Stein\rWASCHEN:\rAnschluss in Küche\rWEITERES:\rZentralheizung, Abstell: Keller\rEs handelt sich bei dem Objekt um ein Baudenkmal, daher besteht keine Pflicht zur Ausstellung von Energieausweisen.\rBitte haben Sie dafür Verständnis, dass alle Angaben und Preise sowie Reservierungen unverbindlich sind und immer nur vorbehaltlich der Zustimmung des Eigentümers gelten. Ein Rechtsanspruch auf ein Kauf- oder Mietvertrag kommt erst durch Gegenzeichnung des selbigen durch den Eigentümer zustande.'];showqualicontactform;profile0;false;;true;premium;true;Sachsen;Leipzig;Deutschland;04229;51,3167632788154;12,322009933381855;true;n;n;n;354;2;5436764;y;no_information;001.5436764;n;;no_information;no_information;1;disabled;n;;n;;central_heating;30;wohnung_miete;normal;0,active;;y;63;3;;n;;2;2;;140530-M-18/4367/03;no_information;https://pictures.immobilienscout24.de/listings/5d82b47c-49d8-43fb-a605-108012b96a3e-1339350104.jpg/ORIG/resize/118x118%3E/extent/118x118/format/jpg/quality/80;15;3.68;15.45;3.68;;Sachsen;Leipzig;Kleinzschocher;114786315;145;"Knauthainer Stra&szlig;e";Knauthainer_Straße;100 MBit/s;true;;;100 MBit/s;true;MagentaZuhause L;web,email,bank,music,dl-ul,game,sd,mltstr,hd,fast-ul-dl;über VDSL;REGULAR;https://padlock.link/ml;https://padlock.link/ioml;telekom_layer_magenta_l;ONE_YEAR_FREE;40 MBit/s;;499;no_information;;;04229
2019-12-22 10:22:16.305179;/expose/114121224;['Das Objekt befindet sich in der historisch gewachsenen Ortsmitte von Leipzig-Thekla. Erbaut in den 1990er Jahren verfügt der Komplex über zwei Gebäudeflügel, welche nach Innen zu einem Platz hin offen sind. Für Komfort sorgen eine Tiefgarage und ein Personenaufzug, welcher alle Ebenen barrierefrei erschließt.', '- innenliegendes Bad mit Dusche\n- Küche mit Fenster\n- Abstellkammer\n- Aufzug', 'Das Wohn- und Geschäftshaus befindet sich in Leipzig-Thekla, in einem gefragten Wohngebiet im Nordosten von Leipzig (nur 15 min vom Zentrum entfernt). Der grüne Stadtteil am Rande der Parthenaue ist geprägt von Einfamilienhäusern und liegt unweit der Leipziger Messe (Luftlinie ca. 2,5 km entfernt) und dem Flughafen. Das BMW-Werksgelände und der Gewerbe- & Industriepark Leipzig Nord-Ost befinden sich ebenso in unmittelbarer Nähe. Durch einen Straßenbahnanschluss sowie einen kurzen Weg zur Autobahn A14, lassen sich alle infrastrukturellen Vorzüge der Großstadt nutzen. Es besteht eine direkte Anbindung an die BAB 14 und an den öffentlichen Nahverkehr, die Straßenbahnlinie 9 und die Buslinien 79, 80 und 81. In unmittelbarer Umgebung finden Sie Einkaufsmöglichkeiten, verschiedene Schulen, Kindertagesstätten und diverse gastronomische Einrichtungen.'];;profile0;false;;true;schaufenster;true;Sachsen;Leipzig;Deutschland;04349;51,3799154986805;12,431727846856228;false;n;y;n;443;3;1169856;n;well_kept;001.1169856;y;;energy_consumption;gas;4;;n;;n;;central_heating;83;wohnung_miete;normal;0,active;;y;59.09;2;;n;1;2;2;;Tauchaer 83 4.OG;negotiable;https://pictures.immobilienscout24.de/listings/f3ae6eb2-d8a7-48f3-b121-757cdf2b7a7a-1329255571.jpg/ORIG/resize/118x118%3E/extent/118x118/format/jpg/quality/80;9;3;10.23;3;;Sachsen;Leipzig;Thekla;114121224;148;"Tauchaer Stra&szlig;e";Tauchaer_Straße;100 MBit/s;true;;;100 MBit/s;true;MagentaZuhause L;web,email,bank,music,dl-ul,game,sd,mltstr,hd,fast-ul-dl;über VDSL;REGULAR;https://padlock.link/ml;https://padlock.link/ioml;telekom_layer_magenta_l;ONE_YEAR_FREE;40 MBit/s;174;591;apartment;;;04349
2019-12-22 10:22:17.054148;/expose/114189279;['Wir beraten Sie gerne unter 0341 - 9135 820 oder info@pisa-immobilien.de\r\rWeitere Informationen zum Objekt -Heeresbäckerei- finden Sie auf unserer Website unter: https://pisa-immobilien.de/de/unternehmen/aktuelles/heeresbaeckerei/\r\rBitte beachten Sie, dass Tierhaltung ausschließlich vorbehaltlich der Zustimmung des Eigentümers erfolgen kann.\r\rDie im Exposé dargestellten Bilder sind teilweise Referenzfotos eines bereits fertiggestellten Objekts. \r\rSie betreten bei Besichtigungen Baustellengelände. Bitte berücksichtigen Sie dies bei Ihrer Kleider- und Schuhauswahl.', '++ Blick ins Grüne GARANTIERT! ++\r\r- große Loggia\r\r- moderne Designbäder\r\r- exklusives Bad mit Wanne u. Dusche\r\r- Gästebad\r\r- Hauswirtschaftsraum\r\r- offene Küche \r\r- Videowechselsprechanlage\r\r- Tiefgaragenstellplatz gg. Aufpreis', 'Im Leipziger Norden zwischen den beliebten Wohnvierteln Gohlis und Möckern entsteht auf einem über 36.000m² großen ehemaligen Kasernengelände ein imposantes Sanierungs- und Neubauprojekt.\r\rWer individuell wohnen will, wird in der Heeresbäckerei fündig:\r\rFehmarner Straße 10 - Haus 02\r\r+ 1,5 bis 4 Raumwohnungen auf einer Fläche von 40 bis 150 Quadratmetern\r+ Balkone, Loggias oder Terrassen mit Gartenanteil\r+ ausgewählte Parkettböden\r+ moderne Designbäder mit hochwertiger Sanitärausstattung\r+ Holzfenster \r+ moderne Fußbodenheizung in allen Räumen\r+ glatt gespachtelte Wände\r+ zugehöriges Kellerabteil bei allen Wohnungen\r+ Fahrradraum vorhanden\r+ Tiefgaragenstellplätze (gegen Aufpreis)\r+ Personenaufzug vom Keller bis zum Dachgeschoss\r\rDie markante Klinkerfassade der Industriearchitektur bleibt dank Denkmalgerechter Sanierung erhalten. \rÜppige Bepflanzung machen die autofreie Fläche zum grünen Herzstück des Geländes. Idyllische Ruhezonen sind dort ebenso zu finden wie einorigineller Erlebnisspielplatz. Ein Wasserlauf durchzieht das Parkähnliche Areal.\r\rGerade einmal 5km trennen die Heeresbäckerei vom Stadtzentrum. Zu den Autobahnen A9 und A14 sind es nur kurze Wege und in wenigen Autominuten erreicht man von hier die Niederlassungen von Porsche, Amazon, BMW oder DHL. \r In der Nähe befindlich: Grundschule, Realschule, Hauptschule, Gymnasium, Universität, Fachhochschule, Kindertagesstätte, Nahverkehrsanbindung, Einkaufsmöglichkeit\r', ' BODENBELAG:\rParkett\rBAD:\rBad mit Wanne und Dusche, Innenliegendes Bad (kein Fenster), sehr exklusives Bad, Doppelwaschbecken, Gäste Bad, Boden: Fliesen/Stein\rKÜCHE:\roffene Küche, Küche mit Fenster, Anschluss für Elektroherd, Anschluß für Geschirrspüler, Boden: Parkett/Dielen\rWASCHEN:\rAnschluss im Abstellraum\rWEITERES:\rLoggia, Innenhof mit Grünflächen, Fussbodenheizung, Abstell: Keller, PKW-Stellplatz: Pflicht\rEs handelt sich bei dem Objekt um ein Baudenkmal, daher besteht keine Pflicht zur Ausstellung von Energieausweisen.\rBitte haben Sie dafür Verständnis, dass alle Angaben und Preise sowie Reservierungen unverbindlich sind und immer nur vorbehaltlich der Zustimmung des Eigentümers gelten. Ein Rechtsanspruch auf ein Kauf- oder Mietvertrag kommt erst durch Gegenzeichnung des selbigen durch den Eigentümer zustande.'];showqualicontactform;profile0;false;;true;premium;true;Sachsen;Leipzig;Deutschland;04157;51,3723627627038;12,356117459003979;true;n;y;n;1136.5;7;5436764;y;refurbished;001.5436764;n;;no_information;no_information;3;disabled;n;;n;;no_information;10;wohnung_miete;normal;0,active;2019;y;133.71;6;;n;1;4;4;;140530-M-16/4349/02/WE29;no_information;https://pictures.immobilienscout24.de/listings/357c52c7-b51b-4a3e-b961-a785fd9d4cb7-1339339925.jpg/ORIG/resize/118x118%3E/extent/118x118/format/jpg/quality/80;15;3.2;14.23;3.2;;Sachsen;Leipzig;Gohlis_Nord;114189279;347.65;"Fehmarner Stra&szlig;e";Fehmarner_Straße;;;;;;;;;;;;;;;;;1484.15;no_information;1877;1;04157
