2020-01-02 00:56:38.542909;/expose/113732584;['Die hier angebotene Zweiraumwohnung verfügt über einen geräumigen Flurbereich, in dem genügend Platz für Ihre Garderobe ist. Ebenso ein großes und helles Wohnzimmer sowie ein großzügiges Schlafzimmer. Die möblierte Küche ist modern eingerichtet und bietet genügend Stauraum und Platz zum Kochen sowie zum gemütlichen Sitzen. Das Tageslichtbad bietet genügend Bewegungsfreiheit, ist ansprechend gestaltet und sauber. Ausgestattet ist es mit einer Badewanne, Waschbecken, WC und einem Waschmaschinenanschluss.  Ein Kellerabteil steht Ihnen auch zur Verfügung.\nIm Haus befindet sich ein Aufzug sowie ein behindertengerechter Zugang. Mit diesem können Sie gut Ihre Wohnung in der 2. Etage erreichen. Ein im Haus ansässiger Pflegedienst unterstützt Sie auf Wunsch. Hilft Ihnen im Haushalt, bei der Essenzubereitung, begleitet Sie zu Ärzten und übernimmt Ihre Pflege. Wenn Sie möchten, können Sie sich zum geselligen Beisammen sein oder zum gemeinsamen Mittagessen im Erdgeschoß des Hauses mit den anderen Bewohnern treffen.  Sie zahlen nur, was Sie tatsächlich in Anspruch nehmen und haben dennoch die Sicherheit, dass im Bedarfsfall jemand für Sie da ist. Es wird keine monatliche Servicepauschale verlangt.', 'Sie erwartet eine sehr gepflegte Wohnung mit guter und ansprechender Ausstattung in einem denkmalgeschützten, sanierten Haus.  Flur-, Wohn- und Schlafbereich wurden mit  Laminat in warmer Holzoptik verlegt. Bad mit  und Küche sind gefließt.', 'Sehr gute,  zentrale Lage in Nähe der alten Messe. Fußläufig erreichen Sie verschiedene kleine Geschäfte, Cafès und Restaurants, einen Supermarkt, Friseur und Fußpflege. In unmittelbarer Nähe lädt der Friedenspark zum Spazieren ein. Zur Straßenbahnhaltestelle mit bequemen Einstieg sind es nur wenige Schritte.', 'Unsere Mitarbeiterin Frau Kolb nimmt Sie gern auf eine Führung durch die Wohnung, das Haus und die Umgebung mit. Vereinbaren Sie einen Besichtigungstermin unter 0176 22205832 oder 0341 67907221.  Auf Wunsch sind wir Ihnen bei der Zusammenstellung Ihrer Unterlagen für den Eigentümer und Vermieter behilflich.\n\nHaftung:\nDie von uns gemachten Angaben haben wir nach bestem Wissen und Gewissen nach Informationen des Vermieters und den uns übergebenen Informationen zusammengestellt. Eine Gewähr für diese Angaben können wir nicht übernehmen. Wichtige Zahlen und Informationen sind zu überprüfen.'];showqualicontactform;profile0;false;true;standard;Sachsen;Leipzig;Deutschland;04317;51,3269722398228;12,400458341050717;false;n;n;y;460;3;18252275;y;well_kept;009.dc9c5f7a-9d70-4170-a92b-2fa7e5a81b53;y;;;district_heating;2;;n;;y;;no_information;89;wohnung_miete;normal;0,active;;y;61;3;n;;2;2;4;19-005-02;negotiable;https://pictures.immobilienscout24.de/listings/2e0ffc7e-e791-428f-aba5-e9b061a9a272-1322898138.jpg/ORIG/resize/118x118%3E/extent/118x118/format/jpg/quality/80;12;4.38;16.31;4.38;Sachsen;Leipzig;Reudnitz_Thonberg;113732584;130;"Prager Stra&szlig;e";Prager_Straße;100 MBit/s;true;;;100 MBit/s;true;MagentaZuhause L;web,email,bank,music,dl-ul,game,sd,mltstr,hd,fast-ul-dl;über VDSL;REGULAR;https://padlock.link/ml;https://padlock.link/ioml;telekom_layer_magenta_l;ONE_YEAR_FREE;40 MBit/s;;590;apartment;1888;1;04317
2020-01-02 00:56:39.784947;/expose/113722200;"[""Die 11-geschossige Wohnanlage wurde 1985 erbaut und 2017 generalsaniert. Die hochwertig sanierten Wohnungen verfügen über eine Vielfalt von Grundrissen. Von einer kleinen 1-Raum-Wohnung bis hin zu einer geräumigen 3-Raum-Wohnung ist in diesem Objekt alles vorhanden. Der ebenerdige Aufzug fährt bis in das 10. Wohngeschoss. Die Wohnungen verfügen teilweise über einen Balkon oder einer Loggia. Die barrierearme Ausstattung der Wohnung spricht besonders Senioren an. Im Erdgeschoss der Offenburger Straße 9-15 befinden sich die Begnungsstätte und Sozialstation der 'AWO'."", '- Aufzug (Bitte beachten Sie, dass der Aufzug nur bis in die 9. Etage fährt und eine Etage zu Fuss zurückzulegen ist)\r\n- hochwertiger schadstofffreier Bodenbelag in modernem Design\r\n- neue, repräsentatvie Innentüren', ""Mitten im Herzen von Grünau wohnen Sie unweit des Kulkwitzer Sees. Neben dem Schönauer Park und dem Robert-Koch-Park bietet Grünau attraktive Freizeitangebote zum Baden, Spazieren und andere zahlreiche sportliche Aktivitäten. Durch die Vielfalt diverser Bus-, Straßen- und S-Bahnlinien ist die Anbindung an andere Orte optimal. Die Dinge des täglichen Bedarfs erhalten Sie in den nahe gelegenen Einkaufscentern 'Allee-Center' und 'PEP-Center'. Verschiedene Gesundheitszentren mit Fach- und Allgemeinärzten, aber auch Physiotherapien, Apotheken und Sanitätshäusern ermöglichen eine solide und gesicherte Gesundheitsversorgung.""]";showqualicontactform;profile0;false;true;standard;Sachsen;Leipzig;Deutschland;04209;51,3212067719009;12,288789789972672;false;n;n;n;444.7;3;32969;n;refurbished;001.32969;y;;energy_required;district_heating;10;disabled;n;;n;23;floor_heating;13;wohnung_miete;no_information;0,active;;n;46.81;2;n;;2;2;11;203/3/140__7374--193;negotiable;https://pictures.immobilienscout24.de/listings/f10df379-e59e-4c2b-b85e-e76ad2781b4e-1329384996.jpg/ORIG/resize/118x118%3E/extent/118x118/format/jpg/quality/80;15;3.28;10.05;3.28;Sachsen;Leipzig;Grünau_Mitte;113722200;79;Offenburger Str.;Offenburger_Str.;100 MBit/s;true;;;100 MBit/s;true;MagentaZuhause L;web,email,bank,music,dl-ul,game,sd,mltstr,hd,fast-ul-dl;über VDSL;REGULAR;https://padlock.link/ml;https://padlock.link/ioml;telekom_layer_magenta_l;ONE_YEAR_FREE;40 MBit/s;69;;apartment;1985;4;04209
2020-01-02 00:56:45.704569;/expose/113779623;['Helle, gemütliche Altbauwohnung in guter Westlage.', 'Die Wohnung verfügt über ein größeres\nWohnzimmer sowie ein kleineres\nSchlafzimmer.\nDas Bad ist gefliest und mit einer Badewanne\nausgestattet.\nDie Küche ist geräumig und ebenfalls gefliest.', 'Die Wohnung liegt im schönen, aufstrebenden Stadtteil Alt-Lindenau.\nDas Viertel ist mit einem historischen Ortskern\nausgestattet und liegt sowohl zentrumsnah, wie auch\nmitten im Grünen.\nIn wenigen erreichen Sie Einkaufsmöglichkeiten, Ärzte und Apotheken fußläufig. Die ÖPNV bietet eine gute\nAnbindung zur City, Bars, Restaurants, dem Leutzscher\nHolz, der Burgaue und dem Auensee. Zu Fuß erreicht\nman innerhalb von ein paar Minuten den Lindenauer\nMarkt. Über die B181 gelangen Sie bequem nach\nGünthersdorf, Richtung Merseburg oder zur A9, gen\nFlughafen.'];showqualicontactform;profile0;false;true;standard;Sachsen;Leipzig;Deutschland;04177;51,3383234591256;12,337676058807508;false;n;n;n;390;2;4334786;n;no_information;001.4334786;y;;;;;;n;;n;60;central_heating;21;wohnung_miete;no_information;0,active;;n;55.36;2;n;;2;2;2;113779623;negotiable;https://pictures.immobilienscout24.de/listings/bf3b5c09-2c0d-4797-b4ec-6f484d4a794b-1323535421.jpg/ORIG/resize/118x118%3E/extent/118x118/format/jpg/quality/80;7;4.49;15.09;4.49;Sachsen;Leipzig;Altlindenau;113779623;60;"Angerstra&szlig;e";Angerstraße;100 MBit/s;true;;;100 MBit/s;true;MagentaZuhause L;web,email,bank,music,dl-ul,game,sd,mltstr,hd,fast-ul-dl;über VDSL;REGULAR;https://padlock.link/ml;https://padlock.link/ioml;telekom_layer_magenta_l;ONE_YEAR_FREE;40 MBit/s;;510;apartment;;;04177
2020-01-02 00:56:46.599111;/expose/113722196;"['Die 11-geschossige Wohnanlage wurde 1985 erbaut und 2017 teilsaniert. Von einer kleinen 1-Raum-Wohnung mit knapp 33 m² bis hin zu einer großen 4-Raum-Wohnung mit knapp 89 m² weist das Objekt eine Vielzahl diverser Grundrisse auf. Die Wohnungen verfügen teilweise über Balkone. Ein ebenerdiger Aufzug fährt bis in das 10. Wohngeschoss.', 'Die Wohnung ist kurzfristig bezugsfertig. Das Bad ist gefliest und mit einer Wanne ausgestattet. Die Wände und Decken sind Raufaser weiß. Der PVC hat ein Laminatoptikdekor in Bucheoptik.', ""Mitten im Herzen von Grünau wohnen Sie unweit des Kulkwitzer Sees. Neben dem Schönauer Park und dem Robert-Koch-Park bietet Grünau attraktive Freizeitangebote zum Baden, Spazieren und andere zahlreiche sportliche Aktivitäten. Durch die Vielfalt diverser Bus-, Straßen- und S-Bahnlinien ist die Anbindung an andere Orte optimal. Die Dinge des täglichen Bedarfs erhalten Sie in den nahe gelegenen Einkaufscentern 'Allee-Center' und 'PEP-Center'. Verschiedene Gesundheitszentren mit Fach- und Allgemeinärzten, aber auch Physiotherapien, Apotheken und Sanitätshäusern ermöglichen eine solide und gesicherte Gesundheitsversorgung.""]";showqualicontactform;profile0;false;true;standard;Sachsen;Leipzig;Deutschland;04209;51,3214837891404;12,289575681430268;false;n;n;n;331.5;2;32969;y;well_kept;001.32969;y;;energy_consumption;district_heating;1;disabled;n;;n;63;central_heating;18;wohnung_miete;no_information;0,active;;n;66.3;3;n;;2;2;11;201/1/67__7138--193;negotiable;https://pictures.immobilienscout24.de/listings/989a69fd-3e0d-411e-b7e9-07aac58ec817-1329384987.jpg/ORIG/resize/118x118%3E/extent/118x118/format/jpg/quality/80;13;3.28;10.05;3.28;Sachsen;Leipzig;Grünau_Mitte;113722196;100;Ludwigsburger Str.;Ludwigsburger_Str.;16 MBit/s;true;50 MBit/s;10 MBit/s;50 MBit/s;true;MagentaZuhause M Hybrid (2);web,email,bank,music,dl-ul,game,sd,mltstr,hd;über Hybrid;WITH_HYBRID;https://padlock.link/mmhy2;https://padlock.link/mmh2sa;telekom_layer_magenta_m_hybrid2;ONE_YEAR_FREE;2,4 MBit/s;108;;apartment;1985;4;04209
2020-01-02 00:56:52.546906;/expose/113724951;"['Komplett neusaniertes Mehrfamilienhaus nach höchstem Standard mit 15 Wohneinheiten und Aufzug sowie Videosprechanlage.\r\n\r\nGut durchdachte Grundrisse ermöglichen ein komfortables modernes Wohnen.\r\n\r\nDas Treppenhaus ist im Altbaucharme dem Original nachgebildet mit hölzerner Briefkastenanlage. \r\n\r\nDer Innenhof lädt ein zur Erholung und verspricht gemütliche Stunden; ausgestattet mit Spiel- und Grillecke.', 'Videosprechanlage Fußbodenheizung\nDie einzelnen Etagen sind bequem mit Lift zu erreichen.\r\n\r\nDie Fußböden sind mit Echtholzparkett ausgelegt.\r\n\r\nDie Bäder sind modern gefliest und beinhalten hochwertige Sanitäranlagen.\r\n\r\nVom großzügigen hellem Wohnzimmer mit offener Küche gelangt man auf den sonnigen Balkon.\r\n\r\nWeiterhin gibt es 3 fast gleichgroße Räume - Schlaf- und Kinderzimmer. Alle Räume sind separat vom Flur aus begehbar.\r\n\r\nDas Tageslichtbad verfügt über eine Wanne sowie Waschmaschinenanschluss.  Ferner gibt es ein Gästebad  mit Dusche. In den Bäder ist ein bluethootfähiges Radio installiert.\r\n\r\nIn der kalten Jahreszeit wird eine angenehme Wärme über die Fußbodenheizung in der Wohnung verbreitet.\r\n\r\nFlur, Küche und Bad sind mit LED-Deckenstrahlern ausgestattet.', 'Der Stadtteil Gohlis gehört zu den beliebtesten Wohngegenden Leipzigs. Hier befinden sich prachtvolle Gründerzeithäuser, ausgedehnte Parkanlagen, unterschiedlichste Einkaufsmöglichkeiten und eine gute Verkehrsanbindung.\r\n\r\nDer Arthur-Brettschneider-Park und das Rosental laden zu Spaziergängen ein.', 'Sämtliche Angaben dieses Exposes beruhen auf Informationen des Vermieters. Wir bitten um Verständnis dafür, dass wir für deren Richtigkeit keine Gewähr übernehmen können.\r\n\r\nSämtliche Angebote veröffentlichen wir unter www.abakus-makler.de']";showqualicontactform;profile0;false;true;standard;Sachsen;Leipzig;Deutschland;04157;51,3666325437404;12,374278834828326;false;n;y;n;1145.9;7;14935796;y;mint_condition;001.14935796;n;;;no_information;4;disabled;y;11;n;;central_heating;61;wohnung_miete;sophisticated;0,active;2018;y;118;5;n;;4;4;;f281-14;no_information;https://pictures.immobilienscout24.de/listings/b8efa6b4-c594-4da4-9d2e-410b7fe2ee92-1326465356.jpg/ORIG/resize/118x118%3E/extent/118x118/format/jpg/quality/80;19;4.07;14.7;4.07;Sachsen;Leipzig;Gohlis_Mitte;113724951;259.71;"Coppistra&szlig;e";Coppistraße;100 MBit/s;true;;;100 MBit/s;true;MagentaZuhause L;web,email,bank,music,dl-ul,game,sd,mltstr,hd,fast-ul-dl;über VDSL;REGULAR;https://padlock.link/ml;https://padlock.link/ioml;telekom_layer_magenta_l;ONE_YEAR_FREE;40 MBit/s;;1405.61;roof_storey;;;04157
2020-01-02 00:56:53.463386;/expose/113768073;['Der Flur mit Stauraum ist optimal. Von hier aus gelangen Sie ins Bad mit Wanne und Waschmaschienenanschluß, ins Schlafzimmer und in das helle Wohnzimmer.  Der Balkon ist über das Wohnzimmer begehbar und von hier aus haben Sie einen wunderbaren Blick nach Süden. Die Küche ist mit einer EBK ausgestattet . Das Haus wird über Fernwärme versorgt, Lifte und Türsprechanlagen sind vorhanden.\nDer Grundriß ist nicht maßstabsgerecht. Die entsprechende Möblierung sind nur Vorschläge und sind nicht Bestandteil unseres Angebotes mit Ausnahme der Küchenzeile. \nTG im Objekt, Anmietung Stellplatz möglich. \nAlle Angaben zum Objekt und dem Mietpreis sowie Größen der Wohnungen beruhen auf den Angaben des Eigentümers. Für die Richtigkeit übernehmen wir keine Gewährleistung.', 'Das Objekt liegt sehr schön im Stadtteilzentrum Leipzig-Grünau, westlich von Leipzig. Optimale Anbindung an das öffentliche Verkehrsnetz (S-Bahn, Straßenbahn und Bus). Im Objekt befinden sich sehr gute Einkaufsmöglichkeiten wie Supermarkt,  Banken, Bäcker, Apotheke, Optiker, Sport-Center, sowie medizinische Versorgungen im Objekt.', 'Mehr Immobilienangebote finden Sie unter www.volpina-hausverwaltung.de'];showqualicontactform;profile0;false;true;standard;Sachsen;Leipzig;Deutschland;04209;51,3228477068661;12,28844779281932;false;n;y;y;419;3;17534634;y;no_information;002.01008232518;n;;energy_consumption;district_heating;2;;n;;y;;district_heating;41;wohnung_miete;no_information;0,active;;y;49.24;2;n;1;2;2;11;37409 0 090 0;no_information;https://pictures.immobilienscout24.de/listings/35b86b6f-a120-466c-bab8-1d035d15738e-1323356837.jpg/ORIG/resize/118x118%3E/extent/118x118/format/jpg/quality/80;14;3.28;10.05;3.28;Sachsen;Leipzig;Grünau_Mitte;113768073;135;Stuttgarter Allee;Stuttgarter_Allee;100 MBit/s;true;;;100 MBit/s;true;MagentaZuhause L;web,email,bank,music,dl-ul,game,sd,mltstr,hd,fast-ul-dl;über VDSL;REGULAR;https://padlock.link/ml;https://padlock.link/ioml;telekom_layer_magenta_l;ONE_YEAR_FREE;40 MBit/s;72;554;apartment;1995;5;04209
2020-01-02 00:56:59.469308;/expose/113767455;['Hier bieten wir Ihnen eine großzügige, helle und hochwertig ausgestattete 2-Zimmer-Wohnung in einem gepflegten Mehrfamilienhaus an. Das Gebäude befindet sich in direkter Nähe zum Karl-Heine-Kanal in einer ruhigen Anliegerstraße im beliebten Stadtteil Plagwitz.\nDerzeitig wird die Wohung komplett renoviert, Besichtigung ist möglich, Bezug ab 15.12.2019.', 'Derzeit wird die Wohnung komplett renoviert, Fußböden und Malerarbeiten neu!\n- sehr großzügige helle 2-Zimmer-Wohnung mit schöner großer Wohnküche\n- Laminat in Flur und in den Wohnräumen\n- zwei schöne helle Wohnräume, separat vom Flur begehbar\n- große Wohnküche mit Fliesenspiegel, Fußboden gefliest\n- mit kleinem Abstellraum\n- hell gefliestes Bad mit Wanne und Waschmaschinenanschluss\n- super Grundriss mit vielen Gestaltungsmöglichkeiten\n- Wohnung gehört einen Kellerraum\nDie Innenfotos dienen nur zur Veranschaulichung der Austattung und stammen von einer des gleichen Gebäudes.', 'Der nahegelegene Clara-Zetkin-Park, das Küchenholz sowie der Karl-Heine-Kanal bieten Ihnen zahlreiche Freizeitmöglichkeiten. \n- sehr gute Nahverkehrsanbindung, Straßenbahnhaltestelle sind fußläufig in wenigen Minuten erreichbar.\n- vielfältige Einkaufsmöglichkeiten, Geldinstitute, medizinische Einrichtungen, Apotheke, Post und Gastronomie in nächster Nähe\n- Kindereinrichtungen und Schulen in der Nähe', 'Sind Sie an weiteren Immobilienangeboten interessiert, bitte sprechen Sie uns unter Tel.0341 9625107 oder 0172 2993465 an, wir inserieren nur ein Teil unserer aktuellen Mietangebote.\nGemäß § 16 EnEV Abs. 4 Satz 2 sind Baudenkmäler (auch Ensembles) von der Pflicht zur Vorlage eines Energieausweises ausgenommen.'];showqualicontactform;profile0;false;true;standard;Sachsen;Leipzig;Deutschland;04229;51,3262564705216;12,334709863458114;false;n;n;n;470;3;17555039;y;first_time_use;002.01007987075;y;;energy_required;gas;1;;y;1;n;;gas_heating;2;wohnung_miete;sophisticated;0,active;;n;69.9;3;n;;2;2;;Nau2R1;negotiable;https://pictures.immobilienscout24.de/listings/8dd50e7f-825e-46ba-839d-6d149a7060c2-1323343452.jpg/ORIG/resize/118x118%3E/extent/118x118/format/jpg/quality/80;10;4.58;15.1;4.58;Sachsen;Leipzig;Plagwitz;113767455;140;"Naumburger Stra&szlig;e";Naumburger_Straße;100 MBit/s;true;;;100 MBit/s;true;MagentaZuhause L;web,email,bank,music,dl-ul,game,sd,mltstr,hd,fast-ul-dl;über VDSL;REGULAR;https://padlock.link/ml;https://padlock.link/ioml;telekom_layer_magenta_l;ONE_YEAR_FREE;40 MBit/s;116.3;610;apartment;1910;1;04229
2020-01-02 00:57:00.584486;/expose/113722199;"[""Die 11-geschossige Wohnanlage wurde 1985 erbaut und 2017 generalsaniert. Die hochwertig sanierten Wohnungen verfügen über eine Vielfalt von Grundrissen. Von einer kleinen 1-Raum-Wohnung bis hin zu einer geräumigen 3-Raum-Wohnung ist in diesem Objekt alles vorhanden. Der ebenerdige Aufzug fährt bis in das 10. Wohngeschoss. Die Wohnungen verfügen teilweise über einen Balkon oder einer Loggia. Die barrierearme Ausstattung der Wohnung spricht besonders Senioren an. Im Erdgeschoss der Offenburger Straße 9-15 befinden sich die Begnungsstätte und Sozialstation der 'AWO'."", '- geflieste Bäder mit Wanne und ebenerdiger Dusche\r\n- Aufzug (Bitte beachten Sie, dass der Aufzug nur bis in die 9. Etage fährt und eine Etage zu Fuss zurückzulegen ist)\r\n- hochwertiger schadstofffreier Bodenbelag in modernem Design\r\n- neue, repräsentatvie Innentüren', ""Mitten im Herzen von Grünau wohnen Sie unweit des Kulkwitzer Sees. Neben dem Schönauer Park und dem Robert-Koch-Park bietet Grünau attraktive Freizeitangebote zum Baden, Spazieren und andere zahlreiche sportliche Aktivitäten. Durch die Vielfalt diverser Bus-, Straßen- und S-Bahnlinien ist die Anbindung an andere Orte optimal. Die Dinge des täglichen Bedarfs erhalten Sie in den nahe gelegenen Einkaufscentern 'Allee-Center' und 'PEP-Center'. Verschiedene Gesundheitszentren mit Fach- und Allgemeinärzten, aber auch Physiotherapien, Apotheken und Sanitätshäusern ermöglichen eine solide und gesicherte Gesundheitsversorgung.""]";showqualicontactform;profile0;false;true;standard;Sachsen;Leipzig;Deutschland;04209;51,3214185373026;12,288698189539307;false;n;n;n;547.11;4;32969;n;refurbished;001.32969;y;;energy_required;district_heating;10;disabled;n;;n;24;floor_heating;11;wohnung_miete;no_information;0,active;;n;57.59;2;n;;2;2;11;203/2/92__7326--193;negotiable;https://pictures.immobilienscout24.de/listings/52004682-d0fe-4828-9b33-eb5327dc4d9f-1322813232.jpg/ORIG/resize/118x118%3E/extent/118x118/format/jpg/quality/80;15;3.28;10.05;3.28;Sachsen;Leipzig;Grünau_Mitte;113722199;87.39;Offenburger Str.;Offenburger_Str.;100 MBit/s;true;;;100 MBit/s;true;MagentaZuhause L;web,email,bank,music,dl-ul,game,sd,mltstr,hd,fast-ul-dl;über VDSL;REGULAR;https://padlock.link/ml;https://padlock.link/ioml;telekom_layer_magenta_l;ONE_YEAR_FREE;40 MBit/s;69;;apartment;1985;4;04209
2020-01-02 00:57:06.543912;/expose/113767179;['Das Wohn- und Geschäftshaus Nordplatz 2 wurde um 1900 erbaut und befindet sich in der Liste der „Kulturdenkmäler“ der Stadt Leipzig. Das Wohngebäude in geschlossener Bebauung in Ecklage zur Nordstraße/Pfaffendorfer Straße verfügt über eine historische Putzfassade und charakteristische, geätzte Treppenhausfenster aus der Zeit der Errichtung. Über einen imposanten Treppenaufgang mit Wandholzvertäfelung und ausladenden Stuckornament gelangen Sie im Hochparterre in eine Büroeinheit sowie eine Praxis. In den übrigen 4 Geschossen (inkl. Dachgeschoss) sind Wohnungen (teilweise mit Balkonen) zu finden. Das Objekt wird über Fernwärme beheizt. Die Warmwasseraufbereitung erfolgt zentral. Über den Aufzug gelangen Sie bequem bis fast vor die Wohnungstür.', 'Genießen Sie eine atemberaubende Aussicht über den Dächern von Leipzig.\r\rIhre Wohnung bietet Ihnen, bei der Gestaltung, Ihre Kreativität spielen zu lassen.\r\rSie lieben gesellige und entspante Abend im Freundeskreis? Dann lässt der großzügig Raum (ca. 32 qm) Spielraum zu oder doch lieber individuelle Rückzugsorte? Auch dann haben Sie alle Möglichkeiten zur Gestaltung.\r\rWann möchten Sie Ihr neues Zuhause besichtigen? Rufen Sie mich an!\r\r\r\r', 'Highlight des Stadtteils Zentrum-Nord ist der Leipziger Zoo mit seinen zahlreichen Attraktionen. Am Nordplatz prägen die Michaeliskirche sowie Gründerzeit- und Jugendstilhäuser das Wohnumfeld. Das Rosental ist als beliebtes Naherholungsgebiet fußläufig in 5 Minuten erreichbar und die pulsierende Leipziger Innenstadt in 8 Minuten.  Direkt auf der belebten Pfaffendorfer Straße ist ein Haltepunkt der Tram-Linie 12, die in nördliche Richtung den beliebten Stadtteil Gohlis erschließt und in südliche Richtung bis zum östlich gelegenen Johannisplatz verkehrt.', '- Ausstattung: Wannenbad, Zentrale Warmwasserversorgung, Bad mit WC, Bodenfliesen in Bad, Diele, Haustürsprechanlage, Isolierverglasung, Küche, Warmwasserzähler, Waschmasch.-Anschluss, Zimmer\r\rCovivio - eines der größten Immobilienunternehmen in Europa, 20 Jahre Wachstum und Leistung.\rOb Büroimmobilien in Italien und Frankreich, Hotels in vielen europäischen Ländern sowie Wohnungen und Gewerbeeinheiten in Deutschland, Covivio entdeckt Räume neu, verbindet Arbeiten, Reisen sowie Wohnen miteinander und entwickelt zeitgemäße Konzepte des Zusammenlebens. Als europäisches Unternehmen mit 850 Mitarbeitern überwindet Covivio Grenzen, möchte überall den gleichen, bestmöglichen Service bieten und diesen auch in Zukunft auf die sich ändernden Bedürfnisse ihrer Kunden ausrichten.\r\rIn Deutschland besitzt und bewirtschaftet Covivio über 41.000 Wohnimmobilien mit einem Vermögenswert von rund 5 Milliarden Euro in den Städten Berlin, Leipzig, Dresden, Hamburg sowie in der Rhein-Ruhr-Region.'];;profile0;false;true;standard;Sachsen;Leipzig;Deutschland;04105;51,3515580842137;12,373816570088307;false;n;n;n;486;3;59497;n;refurbished;001.59497;n;;no_information;district_heating;4;disabled;n;4711;n;89;district_heating;2;wohnung_miete;no_information;0,active;;y;74.09;3;n;;2;2;;0106.010511-019;no_information;https://pictures.immobilienscout24.de/listings/af79fa93-7182-4fe1-ba71-31064ef76ee5-1323338450.jpg/ORIG/resize/118x118%3E/extent/118x118/format/jpg/quality/80;8;4.42;14.02;4.42;Sachsen;Leipzig;Zentrum_Nord;113767179;202;Nordplatz;Nordplatz;100 MBit/s;true;;;100 MBit/s;true;MagentaZuhause L;web,email,bank,music,dl-ul,game,sd,mltstr,hd,fast-ul-dl;über VDSL;REGULAR;https://padlock.link/ml;https://padlock.link/ioml;telekom_layer_magenta_l;ONE_YEAR_FREE;40 MBit/s;;688;no_information;1888;1;04105
2020-01-02 00:57:07.487618;/expose/113724958;"['Komplett neusaniertes Mehrfamilienhaus nach höchstem Standard mit 15 Wohneinheiten und Aufzug sowie Videosprechanlage.\r\n\r\nGut durchdachte Grundrisse ermöglichen ein komfortables modernes Wohnen.\r\n\r\nDas Treppenhaus ist im Altbaucharme dem Original nachgebildet mit hölzerner Briefkastenanlage. \r\n\r\nDer Innenhof lädt ein zur Erholung und verspricht gemütliche Stunden; ausgestattet mit Spiel- und Grillecke.', 'Videosprechanlage\nDie einzelnen Etagen sind bequem mit Lift zu erreichen.\r\n\r\nDie Fußböden sind mit Echtholzparkett ausgelegt.\r\n\r\nDie Bäder sind modern gefliest und beinhalten hochwertige Sanitäranlagen.\r\n\r\nWohnzimmer und Küche befinden sich im gleichen Raum, von dem man auch den sonnigen Balkon erreicht.\r\n\r\nWeiterhin gibt es 1 geräumiges Eck-Schlafzimmer und 2 Kinderzimmer. Die Räume sind separat vom Flur aus begehbar.\r\n\r\nDas Tageslichtbad verfügt über eine Wanne und Dusche sowie einen Waschmaschinenanschluss. Ferner gibt es ein Gäste - WC. In den Bäder ist ein bluethootfähiges Radio installiert.\r\n\r\nIn der kalten Jahreszeit wird eine angenehme Wärme über die Fußbodenheizung in der Wohnung verbreitet.\r\n\r\nFlur, Küche und Bad sind mit LED-Deckenstrahlern ausgestattet.', 'Der Stadtteil Gohlis gehört zu den beliebtesten Wohngegenden Leipzigs. Hier befinden sich prachtvolle Gründerzeithäuser, ausgedehnte Parkanlagen, unterschiedlichste Einkaufsmöglichkeiten und eine gute Verkehrsanbindung.\r\n\r\nDer Arthur-Brettschneider-Park und das Rosental laden zu Spaziergängen ein.', 'Sämtliche Angaben dieses Exposes beruhen auf Informationen des Vermieters. Wir bitten um Verständnis dafür, dass wir für deren Richtigkeit keine Gewähr übernehmen können.\r\n\r\nSämtliche Angebote veröffentlichen wir unter www.abakus-makler.de']";showqualicontactform;profile0;false;true;standard;Sachsen;Leipzig;Deutschland;04157;51,3666325437404;12,374278834828326;false;n;y;n;1215.89;7;14935796;y;mint_condition;001.14935796;n;;;no_information;4;disabled;y;31;n;;central_heating;61;wohnung_miete;sophisticated;0,active;2018;y;125;6;n;;4;4;;f281-15;no_information;https://pictures.immobilienscout24.de/listings/c48f3230-b68a-4977-9f10-27f917b184df-1326460558.jpg/ORIG/resize/118x118%3E/extent/118x118/format/jpg/quality/80;18;4.07;14.7;4.07;Sachsen;Leipzig;Gohlis_Mitte;113724958;275.77;"Coppistra&szlig;e";Coppistraße;100 MBit/s;true;;;100 MBit/s;true;MagentaZuhause L;web,email,bank,music,dl-ul,game,sd,mltstr,hd,fast-ul-dl;über VDSL;REGULAR;https://padlock.link/ml;https://padlock.link/ioml;telekom_layer_magenta_l;ONE_YEAR_FREE;40 MBit/s;;1491.66;roof_storey;;;04157
