2020-01-02 00:12:59.799971;/expose/114220407;['1905 bis 1912 wurde die denkmalgeschützte Wohnanlage mit ihrer architektonischen Einmaligkeit von der Hausgenossenschaft für Eisenbahnbedienstete errichtet und in den Jahren 1997-2000 umfassend saniert und umgebaut.  Die hochwertige Ausstattung der Wohnungen mit Laminatboden sowie der individuelle Grundriss verleihen eine harmonische Atmosphäre.', 'Balkon an Küche, geräumiger Flur, helles und großzügiges Wohnzimmer, Bad mit Badewanne\nAbstellkammer Boden, Keller', 'Die Engelsgärten, eine grüne Oase in Leipzig-Engelsdorf  unweit von der Autobahn, dem\nStadtzentrum und der Shoppingmeile Pausdorf-Center. Viele Einkaufsmöglichkeiten für den \ntäglichen Bedarf sind vorhanden. Einige Kinderbetreuungsstätten sowie Arztpraxen in \nunmittelbarer Nähe sind ein weiteres Plus für die Wohnanlage.\nDas denkmalgeschützte Wohnensemble besticht mit einem parkähnlichen und gepflegten\nInnenhof mit Spielplätzen, Bänken zum Verweilen, Möglichkeiten zur aktiven \nFreizeitgestaltung.\n\nVerkehrsanbindungen\nBusverbindung, Straßenbahnverbindung, regionaler Zugverkehr, Autobahnanbindung, \nNähe zum Flughafen\n\nÄrztliche Versorgung- medizinische Betreuung\nÄrztehaus in der Werkstättenstraße\nZahnarztpraxen, Allgemeinmediziner, Fußpflege und Kosmetik, Mobiler Pflegedienst\n\nEinkaufsmöglichkeiten/ Dienstleister\nSchreib- und Zeitschriftenverkauf \nReisebüro, Netto-Markt mit Bäcker, Norma- Markt mit Bäcker und Fleischer\nGetränkeladen mit Imbissversorgung, Griechisches und Italienisches Restaurant\nKosmetiksalon, Bestattungsunternehmen, \nWäscherei, Fitnessstudio,  Videothek, Sparkasse, Gasthof Alt Engelsdorf mit Bowling-Bahn\nSportplatz, Paunsdorf – Center', 'Küche und Bad mit Fliesen, Wohnräume mit Laminatboden'];showqualicontactform;profile0;false;true;standard;Sachsen;Leipzig;Deutschland;04319;51,3359167675108;12,475348841353975;false;n;y;n;407;3;17945966;y;well_kept;002.01008434144;y;;;gas;2;disabled;y;;n;;central_heating;24;wohnung_miete;normal;0,active;2000;n;58.1;2;n;1;2;2;3;114220407;negotiable;https://pictures.immobilienscout24.de/listings/eb22f263-7d19-4aaf-b10f-ba2754c9527a-1329980847.jpg/ORIG/resize/118x118%3E/extent/118x118/format/jpg/quality/80;12;2.81;11.88;2.81;Sachsen;Leipzig;Engelsdorf;114220407;134;"Klingerstra&szlig;e";Klingerstraße;100 MBit/s;true;;;100 MBit/s;true;MagentaZuhause L;web,email,bank,music,dl-ul,game,sd,mltstr,hd,fast-ul-dl;über VDSL;REGULAR;https://padlock.link/ml;https://padlock.link/ioml;telekom_layer_magenta_l;ONE_YEAR_FREE;40 MBit/s;;541;no_information;1912;1;04319
2020-01-02 00:13:05.743224;/expose/114220041;['Willkommen im QUARTIER BONAPPARTE\r\rEntdecken Sie eine erfrischende Mischung aus historischer Nachbarschaft und moderner Architektur. Vier moderne Stadtvillen mit einer anliegenden Tiefgarage und einer großzügigen Grünanlage faszinieren vom ersten Augenblick an.\r\r* Verteilt auf 4 Stadtvillen entstehen 31 hochwertige Wohnungen sowie 7 Penthouses\r* 10 verschiedene Grundrisstypen mit viel Raum zum Entspannen und Spielen\r* Bezugsfertig zum 01.03.2020\r\r', '4 Zimmer im 1. OG * auch in anderen Etagen verfügbar * | Solarthermie | Balkon  | Echtholz-Parkett | Fußbodenheizung | offene Küche | modern & hochwertiges Badezimmer mit Badewanne, Dusche & Fenster | Gäste WC | Einbauradio im Badezimmer mit AUX-Anschluss | gespachtelte Wände | helle Räume | bodentiefe Fenster mit 3fach Verglasung | Abstellraum | LED-Deckenspots im Flur & Badezimmer | TV & Internet Anschluss in allen Wohnräumen | Videosprechanlage | Tiefgarage mit Gebäudeanschluss | Lüftungsanlagen mit Wärmerückgewinnung | KfW 55 | Hausmeisterservice | \n\r', '*Wohnen am Völkerschlachtdenkmal* rund um das südlich der Messestadt gelegene Domizil findet man alles, was für den täglichen Bedarf benötigt wird, z.B. Bäcker, Apotheke, Lebensmittelmarkt sowie viele andere Einzelhandels- und Dienstleistungsgeschäfte.\r\rEine infrastrukturelle Erschließung und die hervorragende Verkehrsanbindung machen das Quartier Bonapparte besonders attraktiv. \rPrager Straße 181 - 187 \r04299 Leipzig\r\rVilla Léon - HAUS 3', 'Das Angebotene Objekt befindet sich derzeit noch im Bau. Wir bitten um Ihr Verständnis, dass es sich bei den gezeigten Bildern um Referenzbilder vergleichbarer Wohnungen oder Unverbindlicher Visualisierungen handelt. \n\r\n\rWir freuen uns auf eine Besichtigung mit Ihnen. Rufen Sie gleich an. \n\rIhr LEWO-Team\n\r\n\r'];showqualicontactform;profile0;false;true;standard;Sachsen;Leipzig;Deutschland;04299;51,3124532120129;12,415358159476352;false;n;y;y;963.8;6;524857;y;first_time_use;001.524857;n;;energy_required;solar_heating:gas;1;;y;;n;;floor_heating;185;wohnung_miete;sophisticated;0,active;;y;91.79;4;y;1;4;4;;P181WE26;no_information;https://pictures.immobilienscout24.de/listings/e24ef6a4-f08e-4797-87cd-e9478beb114a-1329972006.jpg/ORIG/resize/118x118%3E/extent/118x118/format/jpg/quality/80;11;3.99;14.64;3.99;Sachsen;Leipzig;Stötteritz;114220041;270.78;Pragerstr.;Pragerstr.;100 MBit/s;true;;;100 MBit/s;true;MagentaZuhause L;web,email,bank,music,dl-ul,game,sd,mltstr,hd,fast-ul-dl;über Glasfaser;REGULAR;https://padlock.link/ml;https://padlock.link/ioml;telekom_layer_magenta_l;ONE_YEAR_FREE;40 MBit/s;;1234.58;apartment;2019;9;04299
2020-01-02 00:13:06.706482;/expose/114206192;"[""Die 11-geschossige Wohnanlage wurde 1985 erbaut und 2017 generalsaniert. Die hochwertig sanierten Wohnungen verfügen über eine Vielfalt von Grundrissen. Von einer kleinen 1-Raum-Wohnung bis hin zu einer geräumigen 3-Raum-Wohnung ist in diesem Objekt alles vorhanden. Der ebenerdige Aufzug fährt bis in das 10. Wohngeschoss. Die Wohnungen verfügen teilweise über einen Balkon oder einer Loggia. Die barrierearme Ausstattung der Wohnung spricht besonders Senioren an. Im Erdgeschoss der Offenburger Straße 9-15 befinden sich die Begnungsstätte und Sozialstation der 'AWO'."", '- ebenerdiger Zugang bis und in der Wohnung\r\n- Aufzug \r\n- hochwertiger schadstofffreier Bodenbelag in modernem Design\r\n- einbruchhemmende Wohnungseingangstür\r\n- Decken und Wände mit Tapeten ausgestattet\r\n- modern ausgestattetes Bad mit bodengleicher Dusche \r\n- Fußbodenheizung, im Bad zusätzlicher Handtuchheizkörper\r\n- Münz-Waschmaschinenraum in der 9. Etage\r\n- Kabelanschluss für Telefon, TV und Internet\r\n- schwellenloser Balkon (Süd/Westrichtung)', ""Mitten im Herzen von Grünau wohnen Sie unweit des Kulkwitzer Sees. Neben dem Schönauer Park und dem Robert-Koch-Park bietet Grünau attraktive Freizeitangebote zum Baden, Spazieren und andere zahlreiche sportliche Aktivitäten. Durch die Vielfalt diverser Bus-, Straßen- und S-Bahnlinien ist die Anbindung an andere Orte optimal. Die Dinge des täglichen Bedarfs erhalten Sie in den nahe gelegenen Einkaufscentern 'Allee-Center' und 'PEP-Center'. Verschiedene Gesundheitszentren mit Fach- und Allgemeinärzten, aber auch Physiotherapien, Apotheken und Sanitätshäusern ermöglichen eine solide und gesicherte Gesundheitsversorgung.""]";showqualicontactform;profile0;false;true;standard;Sachsen;Leipzig;Deutschland;04209;51,3212067719009;12,288789789972672;false;n;y;n;235.5;1;32969;y;refurbished;001.32969;y;;energy_required;district_heating;9;disabled;n;;n;30;central_heating;13;wohnung_miete;no_information;0,active;;n;23.55;1;n;;1;1;11;203/3/134__7368--193;negotiable;https://pictures.immobilienscout24.de/listings/4adc96e6-64b0-43f4-a4c7-016ada4334e1-1329750027.jpg/ORIG/resize/118x118%3E/extent/118x118/format/jpg/quality/80;15;3.28;10.05;3.28;Sachsen;Leipzig;Grünau_Mitte;114206192;47.65;Offenburger Str.;Offenburger_Str.;100 MBit/s;true;;;100 MBit/s;true;MagentaZuhause L;web,email,bank,music,dl-ul,game,sd,mltstr,hd,fast-ul-dl;über VDSL;REGULAR;https://padlock.link/ml;https://padlock.link/ioml;telekom_layer_magenta_l;ONE_YEAR_FREE;40 MBit/s;69;;apartment;1985;4;04209
2020-01-02 00:13:12.987636;/expose/114211513;"['Die Wohnanlagen in Grünau erstrecken sich über die Wohnkomplexe WK 2, 4, 5.2 und 7.    \nDie 1-5 Zimmer-Wohnungen im sanierten Neubau sind meist mit Balkon und teilweise mit Aufzügen ausgestattet.\nHier finden alle Generationen ein Zuhause. Die Kleinstwohnungen sind besonders für Azubis und Studenten geeignet. Eine Gästewohnung kann von Besuchern genutzt werden.\nDer WK 2 in unmittelbarer Nachbarschaft zu Leipzig-Lindenau profitiert von den zahlreichen Grünflächen und Parks. Große grüne Höfe mit Spielmöglichkeiten aber auch ausreichend Stellflächen und Parkplätze vor der Haustür prägen das Bild.\nDie Wohnanlage im WK 4 bietet im außergewöhnlich gestalteten Innenhof große Spielgeräte und schöne Sitzecken, ebenso wie Ruhezonen. Es gibt Aufzüge, Tiefgaragenstellplätze und zum Teil Mietergärten.\nUnsere im Zentrum von Grünau befindlichen Bestände im WK 5.2 (fußläufig Allee-Center und PEP) werden fortlaufend komplex saniert (2016 beginnend mit der Heidelberger Straße) und mit Aufzügen ausgestattet. Diese Arbeiten werden 2017 im Karree weiter fortgeführt. Einige Wohnungen verfügen zusätzlich über einen kleinen Mietergarten.\nIm WK 7 befindet sich eine ebenso ruhige wie grüne Wohnanlage. Hervorzuheben sind Spielplätze, Ökowiese und die entspannte Parksituation. \nAls Sonderwohnform stehen behindertengerechte Wohnungen im Erdgeschoss mit separatem Zugang zur Verfügung.', 'Bad mit Dusche\n Tapete: Wand & Decke\n Fussboden: PVC', 'Durch den Stadtumbau wurde dieses Neubaugebiet aufgelockert und mit viel Wohngrün ausgestattet. Die EKZ „Allee-Center"", „PEP"" und „Ratzelbogen"" bieten vielfältigste Angebote verschiedenster Händler. Kindertageseinrichtungen, Schulen, Ärzte, zahlreiche Kultur-, Freizeit- und Sporteinrichtungen, Vereine, Bibliotheken und das Erlebnis- bad „Grünauer Welle"" gibt es vor Ort.\nDer Stadtteil Grünau am südwestlichen Stadtrand Leipzigs ist umgeben von Natur und besitzt attraktive Einkaufs- und Freizeitmöglichkeiten. \nDie angrenzende, großzügige Landschaft mit dem Naherholungsgebiet Kulkwitzer See, den Grünauer Lachen, dem Robert-Koch- und dem Schönauer Park laden zum Erholen ein.\nGrünau verfügt über eine hervorragende Anbindung an den öffentlichen Nahverkehr mit Tram, Bus und S-Bahn sowie über einen Autobahnzubringer.']";showqualicontactform;profile0;false;true;standard;Sachsen;Leipzig;Deutschland;04205;51,3247671509719;12,265969378457836;false;n;y;n;317;2;605967;n;no_information;001.605967;n;;energy_consumption;district_heating;0;disabled;n;;n;60;district_heating;13;wohnung_miete;normal;0,active;;n;63.4;3;n;;3;3;;9402.021;no_information;https://pictures.immobilienscout24.de/listings/d32690f2-93f6-4d8f-81fe-6f50b4e1d70c-1329850342.jpg/ORIG/resize/118x118%3E/extent/118x118/format/jpg/quality/80;2;2.88;null;2.88;Sachsen;Leipzig;Grünau_Nord;114211513;120;Taurusweg;Taurusweg;16 MBit/s;true;50 MBit/s;10 MBit/s;50 MBit/s;true;MagentaZuhause M Hybrid (2);web,email,bank,music,dl-ul,game,sd,mltstr,hd;über Hybrid;WITH_HYBRID;https://padlock.link/mmhy2;https://padlock.link/mmh2sa;telekom_layer_magenta_m_hybrid2;ONE_YEAR_FREE;2,4 MBit/s;75.1;437;ground_floor;1982;4;04205
2020-01-02 00:13:13.885702;/expose/114216834;['Willkommen im QUARTIER BONAPPARTE\r\rEntdecken Sie eine erfrischende Mischung aus historischer Nachbarschaft und moderner Architektur. Vier moderne Stadtvillen mit einer anliegenden Tiefgarage und einer großzügigen Grünanlage faszinieren vom ersten Augenblick an.\r\r* Verteilt auf 4 Stadtvillen entstehen 31 hochwertige Wohnungen sowie 7 Penthouses\r* 10 verschiedene Grundrisstypen mit viel Raum zum Entspannen und Spielen\r* Bezugsfertig zum 01.03.2020\r\r', '2 Zimmer im Erdgeschoss mit Garten | Solarthermie | mega große Terrasse | Echtholz-Parkett | Fußbodenheizung | offene Küche | modern & hochwertiges Badezimmer mit Badewanne  | alle Fenster mit Außenrolläden | Einbauradio im Badezimmer mit AUX-Anschluss | gespachtelte Wände | helle Räume | bodentiefe Fenster mit 3fach Verglasung |  | LED-Deckenspots im Flur & Badezimmer | TV & Internet Anschluss in allen Wohnräumen | Videosprechanlage | Tiefgarage mit Gebäudeanschluss | Lüftungsanlagen mit Wärmerückgewinnung | KfW 55 | Hausmeisterservice | \n\r', '*Wohnen am Völkerschlachtdenkmal* rund um das südlich der Messestadt gelegene Domizil findet man alles, was für den täglichen Bedarf benötigt wird, z.B. Bäcker, Apotheke, Lebensmittelmarkt sowie viele andere Einzelhandels- und Dienstleistungsgeschäfte.\r\rEine infrastrukturelle Erschließung und die hervorragende Verkehrsanbindung machen das Quartier Bonapparte besonders attraktiv. \rPrager Straße 181 - 187 \r04299 Leipzig\r\rVilla Stéphanie - HAUS 4', 'Das Angebotene Objekt befindet sich derzeit noch im Bau. Wir bitten um Ihr Verständnis, dass es sich bei den gezeigten Bildern um Referenzbilder vergleichbarer Wohnungen oder Unverbindlicher Visualisierungen handelt. \n\r\n\rWir freuen uns auf eine Besichtigung mit Ihnen. Rufen Sie gleich an. \n\rIhr LEWO-Team\n\r\n\r'];showqualicontactform;profile0;false;true;standard;Sachsen;Leipzig;Deutschland;04299;51,3123866968756;12,41548583748282;false;n;y;y;671.11;5;524857;y;first_time_use;001.524857;n;;energy_required;solar_heating;0;;y;;n;;floor_heating;187;wohnung_miete;sophisticated;0,active;;y;61.01;3;y;1;2;2;;P181WE34;no_information;https://pictures.immobilienscout24.de/listings/45d21f7b-ea24-4852-a2a3-03d999fbadcf-1336711670.jpg/ORIG/resize/118x118%3E/extent/118x118/format/jpg/quality/80;13;3.99;14.64;3.99;Sachsen;Leipzig;Stötteritz;114216834;179.98;Pragerstr.;Pragerstr.;;;;;;false;;;;;;;;;;;851.09;ground_floor;2019;9;04299
2020-01-02 00:13:19.803253;/expose/114243954;['Die sanierte Wohnanlage liegt im nördlichen Stadtteil Gohlis, in einem gepflegten und grünen Umfeld. Zum Arthur-Bretschneider-Park sind es von hier aus nur wenige Minuten zu Fuß. Einkaufsmöglichkeiten und kleinere Dienstleister gibt es im nahen Einkaufscenter Gohlis-Park und auf der Landsberger Straße. Die Wohnungen sind überwiegend bezugsfertig saniert und verfügen über ein Tageslichtbad mit Wanne oder Dusche und eine Küche mit Fenster und Fliesenspiegel.', 'gute Verkehrsanbindung Bus, Bahn und S-Bahn,gute Einkaufsmöglichkeiten'];showqualicontactform;profile0;false;true;standard;Sachsen;Leipzig;Deutschland;04157;51,371587914114;12,365706043871027;true;n;n;n;290;1;17773;n;refurbished;001.17773;y;;;no_information;1;disabled;n;;n;45;central_heating;31;wohnung_miete;no_information;0,active;;n;46.22;2;n;;2;2;5;1000.00091102.00001003;negotiable;https://pictures.immobilienscout24.de/listings/c20c0ebd-82f0-40fd-bccb-ded85a73bae9-1342909816.jpg/ORIG/resize/118x118%3E/extent/118x118/format/jpg/quality/80;2;3.2;14.23;3.2;Sachsen;Leipzig;Gohlis_Nord;114243954;55;Viertelsweg;Viertelsweg;100 MBit/s;true;;;100 MBit/s;true;MagentaZuhause L;web,email,bank,music,dl-ul,game,sd,mltstr,hd,fast-ul-dl;über VDSL;REGULAR;https://padlock.link/ml;https://padlock.link/ioml;telekom_layer_magenta_l;ONE_YEAR_FREE;40 MBit/s;;390;no_information;1960;2;04157
2020-01-02 00:13:20.747888;/expose/114213902;['Das Objekt ist ein sanierter Altbau mit gutem Mieterklientel und wird durch einen Hausmeisterdienst betreuut. Im Kellerbereich gibt es zu jeder Wohnung einen kleinen Abstellraum sowie einen Waschmaschinen- und Trockenraum. Der Innenhof verfügt über eine kleine Grünanlage, welche gemeinschaftlich von den Mietern genutzt wird.', 'Die Wohnung befindet sich im 3.Obergeschoß = Dachgeschoß des Hauses und wurde komplett neu saniert. Bodenbelag in den Wohnräumen ist neues Laminat, Bad und Küche sind gefliest. Das Tageslichtbad ist mit modernen Fliesen, einer neuen Dusche und neuen Sanitäranlagen ausgestattet. Die Küche bietet Platz für einen Essbereich. Das Wohnzimmer mit seinen Erkerfenstern ist hell und lichtdurchflutet und bietet viele Gestaltungsmöglichkeiten. Alle Räume sind vom Flur begehbar. Alle Türen der Wohnung erhielten einen neuen Anstrich.', 'Das Objekt befindet sich in einer ruhigen Seitenstraße mit Anliegerverkehr im Stadtteil Großzschocher. Öffentliche Verkehrsmittel, Einklaufsmöglichkeiten, Kindereinrichtungen und Schulen befinden sich in unmittelbarer Nähe und sind fußläufig in kürzester Zeit erreichbar. In 1 km Entfernung liegt das Naherholungszentrum Cospudener See und Ratsholz.', 'Für einen Aufpreis von mtl. 50,- €, würde der Vermieter eine Küche einbauen.'];showqualicontactform;profile0;false;true;standard;Sachsen;Leipzig;Deutschland;04249;51,302959795472;12,32982896810821;false;n;n;n;695;5;865377;y;well_kept;001.865377;y;;energy_consumption;no_information;3;;y;3;n;;central_heating;14;wohnung_miete;sophisticated;0,active;1996;n;85;4;n;;3;3;3;399;no_information;https://pictures.immobilienscout24.de/listings/b30f5139-1a04-4300-9339-e4d4b2bd5493-1329878566.jpg/ORIG/resize/118x118%3E/extent/118x118/format/jpg/quality/80;14;3;12.66;3;Sachsen;Leipzig;Großzschocher;114213902;201;Buttergasse;Buttergasse;100 MBit/s;true;;;100 MBit/s;true;MagentaZuhause L;web,email,bank,music,dl-ul,game,sd,mltstr,hd,fast-ul-dl;über Glasfaser;REGULAR;https://padlock.link/ml;https://padlock.link/ioml;telekom_layer_magenta_l;ONE_YEAR_FREE;40 MBit/s;;896;other;1906;1;04249
2020-01-02 00:13:26.660412;/expose/114202380;['- Nähe zum Kulkwitzer See- vielfältige Einkaufsmöglichkeiten- wenige Minuten zum öffentlichen Verkehrsnetz- Schulen und Kitas in unmittelbarer Nähe', 'Die Wohnung hat einen Balkon, der Fußboden ist mit PVC oder Linoleum, Fliesen belegt. Das Bad ist mit einer Badewanne  ausgestattet. Medial kann Analog TV, Digital TV, Internet, Telefonie über TV-Kabel von PrimaCom Berlin GmbH angeboten werden.', 'Die Wohnung liegt in einer normalen Wohnlage an einer Nebenstraße. In unmittelbarer Nähe befinden sich: Einzelhandelseinrichtungen, Dienstleister, Ärzte, Schulen, Gastronomie, Erhohlungs- und Freizeiteinrichtungen, öffentliche Grünanlagen oder Parkflächen, Haltestellen der Buslinien: 62,  des ÖPNV.', 'Es sind Genossenschaftsanteile gemäß Satzung zu zeichnen. Der angegebene Mietpreis kann auf Grund individueller Ausstattungswünsche variieren.'];showqualicontactform;profile0;false;true;standard;Sachsen;Leipzig;Deutschland;04207;51,3117544386634;12,261286865260985;false;n;y;n;361.14;2;437975;n;negotiable;001.437975;n;B;energy_consumption;district_heating;3;;n;;n;75.63;central_heating;12;wohnung_miete;no_information;0,active;;n;68.14;3;n;;3;3;6;836/3/9__6791--154;yes;https://pictures.immobilienscout24.de/listings/92aa0e6e-6007-4d8c-9374-eb5adb516716-1329715479.jpg/ORIG/resize/118x118%3E/extent/118x118/format/jpg/quality/80;12;3.85;13.34;3.85;Sachsen;Leipzig;Lausen_Grünau;114202380;56.56;"Binzer Stra&szlig;e";Binzer_Straße;100 MBit/s;true;;;100 MBit/s;true;MagentaZuhause L;web,email,bank,music,dl-ul,game,sd,mltstr,hd,fast-ul-dl;über VDSL;REGULAR;https://padlock.link/ml;https://padlock.link/ioml;telekom_layer_magenta_l;ONE_YEAR_FREE;40 MBit/s;65;;apartment;1984;4;04207
2020-01-02 00:13:28.425630;/expose/114216341;['Zur Information: Alle Angebote finden Sie übersichtlich und im Detail auf unserer Homepage unter www.mund-immobilien.de.\n\nAb sofort vermieten wir eine frisch sanierete Wohnung in Mockau.\n\nSie befindet sich im Erdgeschoss eines ruhig gelegenen Mehrfamilienhauses.\n\nZur Verfügung stehen Ihnen zwei Zimmer, Flur, Küche und Tageslichtbad mit Dusche.\n\nEs besteht die Mögligkeit für 60,00 € / Monat eine Garage anzumieten.\n\n \n\nEnergieausweis: entfällt, Ausnahmetatbestand der EnEV \n\n \n\nFür weitere Informationen und Einblicke besuchen Sie unsere Homepage: www.mund-immobilien.de. Am besten Sie verpassen keines unserer Angebote und werden Fan auf Facebook oder folgen uns auf Twitter!\n\nSie wollen Ihre Immobilie verkaufen? Egal ob Mehrfamilien- oder Einfamilienhaus, Eigentumswohnung, Grundstück oder Neubau- bzw. Bauträgerprojekt. Wir vermitteln kompetent, transparent und zügig Ihre Immobilie, bundesweit.\n\n \n', '- Laminat\n\n- Tageslichtbad mit Dusche\n\n- Garage 60,00 € / Monat zusätzlich\n\n \n\n \n\n \n', 'Der Stadtteil Mockau ist bei Familien mit Kindern sehr beliebt. Sie genießen eine hervorragende Anbindung zur A 14 und B 2 und sind mit der Straßenbahnlinie 9 in nur 12 Minuten in der City! Zudem haben Sie das Mockaucenter und den Abtnaundorfer Park vor Ihrer Haustür\n\n \n\n \n\n \n', 'Sie wollen Ihre Immobilie verkaufen? Oftmals haben wir den richtigen Käufer bereits in unserer Kundenkartei.\n\nSie möchten den Marktwert Ihrer Immobilie wissen? Unsere Spezialisten stehen Ihnen für ein unverbindliches Gespräch sehr gerne zur Verfügung.\n\nWir freuen uns über Ihre Kontaktaufnahme unter info@mund-immobilien.de oder (0341) 44258 210.\n\nWeitere Angebote unter: www.mund-immobilien.de. Am besten Sie verpassen keines unserer Angebote und werden Fan auf Facebook oder folgen Sie uns auf Twitter!\n\nHAFTUNG:\n\nAlle Angaben zum Objekt basieren auf erteilten Auskünften und Informationen Dritter. Für die Richtigkeit oder Vollständigkeit der Angaben kann deshalb keine Haftung übernommen werden. Die versandten Exposés und sonstigen Unterlagen stellen lediglich eine unverbindliche Vorabinformation dar. Die Haftung der Mund Immobilien GmbH ist ausschließlich auf vorsätzliches oder grob fahrlässiges Verhalten beschränkt.\n'];showqualicontactform;profile0;false;true;standard;Sachsen;Leipzig;Deutschland;04357;51,3641861481355;12,405118971898542;false;n;n;n;365;2;12303497;n;no_information;001.12303497;y;;;gas;;;n;;n;;central_heating;21;wohnung_miete;normal;0,active;;n;60;2;n;;2;2;;ErSchn-2210;no_information;https://pictures.immobilienscout24.de/listings/3c2abc8b-c690-40a0-b3be-fe845caa2dd3-1329914929.jpg/ORIG/resize/118x118%3E/extent/118x118/format/jpg/quality/80;6;3.01;13.63;3.01;Sachsen;Leipzig;Mockau_Süd;114216341;140;"Berthastra&szlig;e";Berthastraße;100 MBit/s;true;;;100 MBit/s;true;MagentaZuhause L;web,email,bank,music,dl-ul,game,sd,mltstr,hd,fast-ul-dl;über VDSL;REGULAR;https://padlock.link/ml;https://padlock.link/ioml;telekom_layer_magenta_l;ONE_YEAR_FREE;40 MBit/s;;505;ground_floor;;;04357
2020-01-02 00:13:34.341045;/expose/114203874;['Sie suchen eine gemütliche Bleibe in ruhiger Lage? Gefunden! Zwei helle, gut geschnittene Wohnräume, eine große Wohnküche und das freundliche Bad mit Fenster und Wanne sind die Eckdaten dieser schönen Wohnung. Die quasi neue EBK kann gegen eine geringe Ablöse vom jetzigen Mieter übernommen werden. Am Besten machen Sie sich bei einer Besichtigung selber ein Bild von Ihrem neuen Zuhause. ', 'Ihr neues Zuhause befindet sich ca. 5 km südwestlich des Leipziger Stadtzentrums, im aufstrebenden Stadtteil Kleinzschocher, in einer ruhigen Nebenstraße. In diesem Gebiet finden Sie die komplette, urbane Infrastruktur mit sehr guten Verkehrsanbindungen, Einkaufs- und Dienstleistungseinrichtungen, Schulen, Kitas und ärztlicher Versorgung. Auch Restaurants und Cafés sind vorhanden. Der Volkspark Kleinzschocher, als Teil des Leipziger Auwaldgürtels, liegt nur wenige Gehminuten entfernt. Neben ausgedehnten Wiesenflächen gibt es dort auch ein Sommerbad. Der Bootsverleih an der Weißen Elster ist ebenfalls schnell erreicht.'];showqualicontactform;profile0;false;true;standard;Sachsen;Leipzig;Deutschland;04229;51,3173322447405;12,326525953644303;false;n;n;n;270;1;16378737;n;refurbished;002.01003009980;y;;;gas;2;;n;;n;40;central_heating;3;wohnung_miete;normal;0,active;;n;44;2;n;;2;2;3;5714;no_information;https://pictures.immobilienscout24.de/listings/b44ba72c-00cf-4a96-980f-c7c54f9dacd7-1333824563.jpg/ORIG/resize/118x118%3E/extent/118x118/format/jpg/quality/80;12;3.68;15.45;3.68;Sachsen;Leipzig;Kleinzschocher;114203874;40;"Creuziger Stra&szlig;e";Creuziger_Straße;100 MBit/s;true;;;100 MBit/s;true;MagentaZuhause L;web,email,bank,music,dl-ul,game,sd,mltstr,hd,fast-ul-dl;über VDSL;REGULAR;https://padlock.link/ml;https://padlock.link/ioml;telekom_layer_magenta_l;ONE_YEAR_FREE;40 MBit/s;;350;roof_storey;;;04229
2020-01-02 00:13:35.336212;/expose/114220635;['Diese  sehr schön geschnittene 2-Raum Wohnung (64,00 m²) verfügt über eine gefliester Küche, einem Wannenbad mit WM-Anschluss. Die  großen und gut isolierten Fenster, lassen die Räume  hell und freundlich wirken.', 'Ausstattung \n\nBalkon\nBad im Wanne         gefliest\nKüche                     gefliest\nZimmer / Flur          Laminat wird gerade neu verlegt', 'Leipzig Eutritzsch hat eine gut ausgebaute Infrastruktur, erreichbar mit Straßenbahn, S-Bahn und Buslinien. In unmittelbarer Nähe befinden sich viele Einkaufsmöglichkeiten, Kindergärten und Schulen. Dieser Stadtteil hat sich in den letzten Jahren zu einer bevorzugten Wohnlage entwickelt.\r\nSie erreichen z.B. das Zentrum, Bahnhof und Universität mit den öffentlichen Verkehrsmitteln in ca. 10 Minuten. Über die Delitzscher Straße haben Sie eine gute Verkehrsanbindung an die A14. '];showqualicontactform;profile0;false;true;standard;Sachsen;Leipzig;Deutschland;04129;51,361887793065;12,387790237748392;false;n;y;n;416;3;12406381;y;well_kept;001.12406381;y;;;oil;3;disabled;n;222;n;70.4;central_heating;16;wohnung_miete;no_information;0,active;2019;n;64;3;n;;2;2;4;Salz 3.OG li;negotiable;https://pictures.immobilienscout24.de/listings/969bc60e-0064-4b0f-977b-505eeac8e3df-1329981942.png/ORIG/resize/118x118%3E/extent/118x118/format/jpg/quality/80;13;4.04;13.92;4.04;Sachsen;Leipzig;Eutritzsch;114220635;70.4;"Salzmannstra&szlig;e";Salzmannstraße;100 MBit/s;true;;;100 MBit/s;true;MagentaZuhause L;web,email,bank,music,dl-ul,game,sd,mltstr,hd,fast-ul-dl;über VDSL;REGULAR;https://padlock.link/ml;https://padlock.link/ioml;telekom_layer_magenta_l;ONE_YEAR_FREE;40 MBit/s;;556.8;apartment;;;04129
