2020-01-02 00:53:57.637744;/expose/113832653;['Bei dem Neubauobjekt handelt es sich um ein Mehrfamilienhaus, welches in einer Baulücke entstanden ist. Der Neubau ist sehr zentral zum Stadtzentrum gelegen, welches man in 10 Gehminuten erreicht. \nDas Haus verfügt über 5 Vollgeschosse, ein Maisonettegeschoss und eine Tiefgarage mit 12 Stellplätzen. \nDie beiden Erdgeschosswohnungen wurden mit 2 großen Terrassen, sowie einem Gartenanteil für die Wohnungen geplant.\nAlle Wohnungen verfügen über Balkon, Terrasse oder/und Loggia.', 'WE 12 - Maisonette 4\nObergeschoss + DG mit Dachterrasse\n- 2 Tiefgaragenplätze\n4.OG\n- 2 Kinderzimmer, Schlafzimmer\n- Bad mit Fenster, Wanne und Dusche\n- Gäste WC mit Dusche\n- Ankleidezimmer\nDachgeschoss\n- große Dachterrasse\n- großes Wohn-/Koch- und Esszimmer\n- Hauswirtschaftsraum mit WA Anschluss\n- Gäste WC\n- Arbeits-/Gästezimmer\n\nAusstattungsangaben zum Objekt:\n* hochwertige, anspruchsvolle Ausstattung\n* Fußbodenheizung mit Einzelthermostaten\n* Decken- und Wände glatt gespachtelt\n* Böden:\nendversiegeltes Fertigparkett & Fliesen (im modernen Design)\n* Badezimmer und Gäste WC:\n- hochwertige Sanitärkeramik, z.T. Einbauradio, Handtuchheizkörper, großer Spiegel, Deckenspots\n* Duschen: bodengleiche Elemente mit Echtglasabtrennung, Handtuchheizkörper\n* Balkone, Terrassen und Loggia:\nWPC Diele als Fußbodennutzschicht und vollflächige Verkleidung, 1 Außenleuchte, 1 Steckdose, Außenwasserhahn, blickdichte Verkleidung\n* Fenster: \n3-fach Verglasung mit ISO Wärmeschutzglas, Schallschutzklasse 3\n* motorgetriebene Rollläden\n* Türen: \n* Innentüren/Zargen mit glatter, weißer Oberfläche beschichtet\n* Wohnungseingangstür weiß beschichtet mit Türspion\n* Haustüranlage mit Teilverglasung\n* Gegensprechanlage mit Videofunktion\n* Personenaufzug mit Zustieg auf den Wohnebenen, sowie der Kellerebene\n* Treppenhaus - und Fassadengestaltung erfolgt nach Farb- und Gestaltungskonzept\n* Tiefgarage mit elektrisch betriebenen Tor und Handsender\n* in allen Räumen sind Steckdosen, Deckenbrennstellen, Antennenansschlüsse und Telefonanschlüsse ausreichend vorhanden\n* gepflegter Garten am Haus\n* Medien: Kabel Deutschland und Telecom', 'Der Neubau befindet sich im Stadteil Zentrum Süd/Ost. Das Mehrfamilienhaus liegt in einer ruhigen Nebenstraße, öffentliche Verkehrsanbindungen erreicht man in wenigen Gehminuten. \nRestaurants, sowie Supermärkte sind fußläufig perfekt erreichbar. \nDas Ärtzehaus am Johannisplatz erreichen Sie in 5 Gehminuten.\nDie Wohnlage besticht durch seine zentrale Lage zur Innenstadt, Ihr Auto kann also  in der Tiefgarage stehen bleiben und Sie spazieren völlig stressfrei zu Ihren Unternehmungen.', 'Die Angaben zum Objekt wurden vom Eigentümer oder sonstigen Dritten übermittelt.\nWir bitten um Verständnis, dass wir keine Garantie für die Richtigkeit und Vollständigkeit übernehmen können.\n\nNehmen Sie mit uns Kontakt auf, anschauen lohnt sich! Wir zeigen Ihnen gern diese charmante Wohnung.'];showqualicontactform;profile0;false;true;standard;Sachsen;Leipzig;Deutschland;04103;51,33722788878322;12,385418497467032;false;n;y;n;2208;9;15321492;y;first_time_use;001.15269393;n;B;energy_required;district_heating;4;;y;2011;n;;central_heating;23;wohnung_miete;sophisticated;0,active;2018;y;183.96;7;y;;5;5;5;Jo23-WE12;negotiable;https://pictures.immobilienscout24.de/listings/585a83d7-df86-4ee5-b636-94f9226619ef-1340539188.jpg/ORIG/resize/118x118%3E/extent/118x118/format/jpg/quality/80;18;4.89;16.45;4.89;Sachsen;Leipzig;Zentrum_Südost;113832653;423;Johannisgasse;Johannisgasse;50 MBit/s;true;;;50 MBit/s;true;MagentaZuhause M;web,email,bank,music,dl-ul,game,sd,mltstr,hd,fast-ul-dl;über VDSL;REGULAR;https://padlock.link/mm;https://padlock.link/iomm;telekom_layer_magenta_m;ONE_YEAR_FREE;10 MBit/s;65;2791;apartment;2019;9;04103
2020-01-02 00:53:58.535678;/expose/113861499;['Die 2- bis 4-Zimmer-Wohnungen verfügen standardmäßig über eine gehobene und zeitgemäße Ausstattung: Echtholzparkett, Feinputze, Fußbodenheizung und CAT7-Verkabelung generieren großen Komfort. In den Bädern finden sich exklusive italienische Fliesen und geschmackvolle moderne Armaturen sowie bodengleiche Duschen und/oder Badewannen. Fast jede Wohnung verfügt über mindestens einen Balkon, eine Loggia oder Terrasse. Eine eigene Tiefgarage mit 77 Stellplätzen verschafft den Bewohnern eine entspannte Parkplatzsituation.\r\rAusstattungsdetails:\r• Einbauküchen\r• Echtholzparkett\r• Fußbodenheizung\r• feingeputzte Wände\r• CAT7-Verkabelung\r• hochwertige Badfliesen und Armaturen\r• bodengleiche Duschen\r• Handtuch-Heizkörper im Bad\r• vorinstallierte Beleuchtungskomponenten in Bad und Flur\r• Außenjalousien (mind. für Schlafzimmer)\r• Balkon/Loggia/Terrasse\r• Kellerabteil zu jeder Wohnung\r\rTeilweise verfügen die Wohnungen über\r• zwei Bäder in unterschiedlicher Ausführung (Wannenbad, Duschbad, Vollbad)\r• Gäste-WC\r• Abstellraum\r• Ankleide\r• bodentiefe Fenster\r\rZur Wohnung kann ein Stellplatz angemietet werden (á monatlich 85,00 € bzw. 65,00 € für Verschiebeparker zzgl. 7,50 € Nebenkosten).\n\rDer 1. Monat ist kaltmietfrei!\n\rVerglaster Balkon (siehe Visualisierung). Vorderelemente aufschiebbar, Seitenteile fest.', 'Die Ausstattungsdetails finden Sie in der Objektbeschreibung bzw. im Detail in den Wohnungsgrundrissen.', 'Waldstraßenviertel\r\rNordwestlich der Leipziger Innenstadt liegt das größte zusammenhängende und am besten erhaltene Gründerzeitviertel Europas, das Waldstraßenviertel. Das einmalige Wohnviertel, mit seinen grünen und ruhigen Nebenstraßen, gehört zu den attraktivsten und beliebtesten Wohngegenden Leipzigs. \rDie Waldstraße als zentrale Achse des Viertels bietet zahlreiche Restaurants und Einkaufsmöglichkeiten und die Verkehrsanbindung ist auf Grund der zentralen Lage ausgezeichnet.\r\rAm Waldplatz\r\rDie Lage bietet vielfältigste Freizeitaktivitäten – in fünf Minuten zu Fuß ins Stadion, in zwei Minuten zum Paddeln am Stadthafen, in drei Minuten mit dem Rad zum Shoppen oder Schlemmen zum Marktplatz oder Hauptbahnhof und die Joggingstrecke im Grünen startet auf der gegenüberliegenden Straßenseite. Erdulden muss man nur den gelegentlichen Torjubel aus dem Stadion.\r•\tHauptbahnhof Leipzig in 5 Minuten Fahrzeit mit Auto, Fahrrad oder Tram erreichbar\r•\tAutobahn A14 in rund 10 km Entfernung\r•\tZum Flughafen Leipzig/Halle nur ca. 20 Minuten mit dem Auto \r•\tÖPNV mit mehreren Tram-Linien nur wenige Meter vom Objekt entfernt\r•\tEinkaufsmöglichkeiten im direkten Umfeld\r•\t3 Kindertagesstätten, 1 Grundschule und 1 Oberschule im Viertel\r\rLeipzig\r\rLeipzig ist mit rund 596.500 Einwohnern (Stand: 31.12.18) bundesweit die elftgrößte Stadt und bildet ein Zentrum für Wirtschaft, Bildung und Handel sowie Verwaltung, Kultur und Verkehr in Ostdeutschland und Sachsen. Neben Frankfurt am Main ist die Stadt ein historisches Zentrum des Buchdrucks und -handels. Außerdem befinden sich in Leipzig eine der ältesten Universitäten sowie die ältesten Hochschulen sowohl für Handel als auch für Musik in Deutschland. Die Messestadt Leipzig genießt darüber hinaus weltweiten Ruf als wirtschaftlicher und kreativer Hotspot mit hervorragender Infrastruktur. \r', 'Spezifische Ausbaudetails entnehmen Sie bitte dem Grundriss bzw. fragen Sie gerne bei unserem Vermietungsteam nach.\n\r\n\rDoreen Doll\n\rVermietungsmanagerin\n\r\n\rTel:          0341 / 96 21 08 - 7304\n\rFunk.:      0172 / 765 90 25\n\r\n\rFr. Hinterthür \n\rVermietungsassistentin\n\r\n\r0341 / 269 20 70\n\r\n\rZzgl. zur Miete fallen 7,50€ Kabelpauschale für Fernsehen an.\n\rDiese sind bereits in den Nebenkosten berücksichtigt.\n\r'];;profile0;false;true;standard;Sachsen;Leipzig;Deutschland;04109;51,34166000247651;12,358719371147053;true;n;y;y;567.56;4;5408770;y;first_time_use;001.5408770;y;C;energy_required;no_information;3;;y;;y;;central_heating;91;wohnung_miete;sophisticated;0,active;;y;42.01;2;y;1;2;2;;15047;yes;https://pictures.immobilienscout24.de/listings/b3ec22e0-d4cd-4cea-bbe9-c911ff1cbcaf-1329577686.jpg/ORIG/resize/118x118%3E/extent/118x118/format/jpg/quality/80;14;4.45;15.17;4.45;Sachsen;Leipzig;Zentrum_West;113861499;117.63;"Friedrich-Ebert-Stra&szlig;e";Friedrich-Ebert-Straße;;;;;;false;;;;;;;;;;78;692.69;apartment;2019;9;04109
2020-01-02 00:54:04.509747;/expose/113832577;['Bei dem Neubauobjekt handelt es sich um ein Mehrfamilienhaus, welches in einer Baulücke entstanden ist. Der Neubau ist sehr zentral zum Stadtzentrum gelegen, welches man in 10 Gehminuten erreicht. \nDas Haus verfügt über 5 Vollgeschosse, ein Maisonettegeschoss und eine Tiefgarage mit 12 Stellplätzen. \nDie beiden Erdgeschosswohnungen wurden mit 2 großen Terrassen, sowie einem Gartenanteil für die Wohnungen geplant.\nAlle Wohnungen verfügen über Balkon, Terrasse oder/und Loggia.', 'WE 11 - 3.Obergeschoss mit Balkon und Loogia\n- Tiefgarage\n- großes Wohn-/Koch+Esszimmer mit Zugang Loggia + Balkon\n- Schlafzimmer mit Ankleide\n- Kinderzimmer \n- Hauswirtschaftsraum mit WA Anschluss\n- Badezimmer mit Wanne und Dusche\n- Gäste-WC \n\nAusstattungsangaben zum Objekt:\n* hochwertige, anspruchsvolle Ausstattung\n* Fußbodenheizung mit Einzelthermostaten\n* Decken- und Wände glatt gespachtelt\n* Böden:\nendversiegeltes Fertigparkett & Fliesen (im modernen Design)\n* Badezimmer und Gäste WC:\n- hochwertige Sanitärkeramik, z.T. Einbauradio, Handtuchheizkörper, großer Spiegel, Deckenspots\n* Duschen: bodengleiche Elemente mit Echtglasabtrennung, Handtuchheizkörper\n* Balkone, Terrassen und Loggia:\nWPC Diele als Fußbodennutzschicht und vollflächige Verkleidung, 1 Außenleuchte, 1 Steckdose, Außenwasserhahn, blickdichte Verkleidung\n* Fenster: \n3-fach Verglasung mit ISO Wärmeschutzglas, Schallschutzklasse 3\n* motorgetriebene Rollläden\n* Türen: \n* Innentüren/Zargen mit glatter, weißer Oberfläche beschichtet\n* Wohnungseingangstür weiß beschichtet mit Türspion\n* Haustüranlage mit Teilverglasung\n* Gegensprechanlage mit Videofunktion\n* Personenaufzug mit Zustieg auf den Wohnebenen, sowie der Kellerebene\n* Treppenhaus - und Fassadengestaltung erfolgt nach Farb- und Gestaltungskonzept\n* Tiefgarage mit elektrisch betriebenen Tor und Handsender\n* in allen Räumen sind Steckdosen, Deckenbrennstellen, Antennenansschlüsse und Telefonanschlüsse ausreichend vorhanden\n* gepflegter Garten am Haus\n* Medien: Kabel Deutschland und Telecom', 'Der Neubau befindet sich im Stadteil Zentrum Süd/Ost. Das Mehrfamilienhaus liegt in einer ruhigen Nebenstraße, öffentliche Verkehrsanbindungen erreicht man in wenigen Gehminuten. \nRestaurants, sowie Supermärkte sind fußläufig perfekt erreichbar. \nDas Ärtzehaus am Johannisplatz erreichen Sie in 5 Gehminuten.\nDie Wohnlage besticht durch seine zentrale Lage zur Innenstadt, Ihr Auto kann also  in der Tiefgarage stehen bleiben und Sie spazieren völlig stressfrei zu Ihren Unternehmungen.', 'Die Angaben zum Objekt wurden vom Eigentümer oder sonstigen Dritten übermittelt.\nWir bitten um Verständnis, dass wir keine Garantie für die Richtigkeit und Vollständigkeit übernehmen können.\n\nNehmen Sie mit uns Kontakt auf, anschauen lohnt sich! Wir zeigen Ihnen gern diese charmante Wohnung.'];showqualicontactform;profile0;false;true;standard;Sachsen;Leipzig;Deutschland;04103;51,33722788878322;12,385418497467032;false;n;y;n;1096;7;15321492;y;first_time_use;001.15269393;n;B;energy_required;district_heating;3;;y;2011;n;;central_heating;23;wohnung_miete;sophisticated;0,active;2018;y;84.31;4;y;;3;3;5;JO23-WE11;negotiable;https://pictures.immobilienscout24.de/listings/9b53ee08-bb5a-4576-ab61-720e5f38dbdc-1324332507.jpg/ORIG/resize/118x118%3E/extent/118x118/format/jpg/quality/80;12;4.89;16.45;4.89;Sachsen;Leipzig;Zentrum_Südost;113832577;194;Johannisgasse;Johannisgasse;50 MBit/s;true;;;50 MBit/s;true;MagentaZuhause M;web,email,bank,music,dl-ul,game,sd,mltstr,hd,fast-ul-dl;über VDSL;REGULAR;https://padlock.link/mm;https://padlock.link/iomm;telekom_layer_magenta_m;ONE_YEAR_FREE;10 MBit/s;65;1370;apartment;2019;9;04103
2020-01-02 00:54:05.437321;/expose/113858852;['Genießen Sie die Vorzüge eines Neubaus in einer hochwertig ausgestatteten 6-Zimmer-Wohnung zur Miete.\n\nDie Wohnung befindet sich im 4. Obergeschoss eines im Jahr 2016 neu erbauten Wohnhauses in beliebten Viertel Schleußig direkt an der Weißen Elster.\n\nGenießen Sie den Komfort des Erstbezuges und die\nsorgfältig ausgewählte Ausstattung. Durch die\nEinhaltung der Anforderungen an ein KfW 55\nEffizienzhaus profitieren Sie u.a. durch energetische\nEinsparpotentiale.\nDie Wohnanlage bietet ausgezeichneten Wohnkomfort mitten in der Großstadt. Bei der Gestaltung und Auswahl der verbauten Materialien wurde auf eine hochwertige Materialqualität und -verarbeitung Wert gelegt und diese stilvoll kombiniert.\n\nZusätzlich steht Ihnen ein eigenes Kellerabteil sowie ein Doppelparker-Stellplatz bzw. ein normaler Stellplatz in der Tiefgarage auf Anfrage und gegen Gebühr (60,00 € bzw. 75,00 € + 5,00 € Nebenkosten) zur Verfügung.', 'Einige Highlights der Wohnung auf einen Blick:\n\n-großzügig geschnittener Balkon\n-ein Aufzug bringt Sie in jede Etage und bis in den\nKeller\n-Raffstore-Anlagen zur Einhaltung des Wärmeschutzes und zur Abdunkelung sind vorhanden\n-Echtholzparkett und Fußbodenheizung in allen\nWohnräumen\n- modernes, gefliestes Bad mit Dusche und Wanne\n-Wandhandtuchheizkörper im Bad\n-Kellerabteil\n-Tiefgaragenstellplatz bei Bedarf (gegen Gebühr)', 'Die Wasserstadt Leipzig-Schleußig ist mit den vielen Wasserstraßen, den Park- und Gartenanlagen ideal für junge Familien. Ob Einkaufen, Spazieren, Eis essen auf der Könneritzstraße oder Ausflüge zu den grünen Erholungsoasen der Umgebung wie dem Clara-Zetkin-Park und dem Cospudener See - all das macht Schleußig sehr attraktiv.\n\nDas angrenzende Szeneviertel Plagwitz ergänzt das Angebot um Kultur, Industrie und Gewerbe.\n\nIm Erdgeschoss des Gebäudes finden Sie ein Restaurant, ein Bäcker sowie ein Friseur.', 'Sichern Sie sich stressfreies Wohnen mit einem Staffelmietvertrag.\n\nEin Staffelmietvertrag erspart Ihnen böse Überraschungen. Sie wissen immer genau, wie sich Ihre Miete entwickeln wird, denn Ihr Vermieter kann keine Erhöhungen außer der Reihe geltend machen. \nEs wird eine Mindestmietdauer von zwei Jahren vereinbart.\n\nFür die in diesem Exposé gemachten Angaben können wir leider keine Haftung übernehmen, da sie auf den Angaben der Eigentümer bzw. von Dritten beruhen.\n\n\n© Fotos Michael Moser Images, 2017'];showqualicontactform;profile0;false;true;standard;Sachsen;Leipzig;Deutschland;04229;51,3265173411661;12,339546703821785;false;n;y;y;1670;8;16800035;y;mint_condition;002.01007591794;y;B;energy_required;district_heating;4;disabled;n;;n;;floor_heating;39;wohnung_miete;sophisticated;0,active;;y;144.89;6;n;;6;5;4;4WE03;negotiable;https://pictures.immobilienscout24.de/listings/d4c0a83d-8b69-4438-91f1-271bb03b1882-1324701006.jpg/ORIG/resize/118x118%3E/extent/118x118/format/jpg/quality/80;16;4.46;15.67;4.46;Sachsen;Leipzig;Schleußig;113858852;360;"Industriestra&szlig;e";Industriestraße;100 MBit/s;true;;;100 MBit/s;true;MagentaZuhause L;web,email,bank,music,dl-ul,game,sd,mltstr,hd,fast-ul-dl;über VDSL;REGULAR;https://padlock.link/ml;https://padlock.link/ioml;telekom_layer_magenta_l;ONE_YEAR_FREE;40 MBit/s;64;2030;apartment;;;04229
2020-01-02 00:54:11.457650;/expose/113831951;['Bei dem Neubauobjekt handelt es sich um ein Mehrfamilienhaus, welches in einer Baulücke entstanden ist. Der Neubau ist sehr zentral zum Stadtzentrum gelegen, welches man in 10 Gehminuten erreicht. \nDas Haus verfügt über 5 Vollgeschosse, ein Maisonettegeschoss und eine Tiefgarage mit 12 Stellplätzen. \nDie beiden Erdgeschosswohnungen wurden mit 2 großen Terrassen, sowie einem Gartenanteil für die Wohnungen geplant.\nAlle Wohnungen verfügen über Balkon, Terrasse oder/und Loggia.', 'WE 6 - 2.Obergeschoss mit Balkon und Loogia\n- Tiefgarage\n- großes Wohn-/Esszimmer mit Zugang Loggia\n- Küche separat mit Zugang Balkon\n- Schlafzimmer \n- Kinderzimmer \n- Hauswirtschaftsraum mit WA Anschluss\n- Badezimmer mit Wanne und Dusche\n- Gäste-WC \n\nAusstattungsangaben zum Objekt:\n* hochwertige, anspruchsvolle Ausstattung\n* Fußbodenheizung mit Einzelthermostaten\n* Decken- und Wände glatt gespachtelt\n* Böden:\nendversiegeltes Fertigparkett & Fliesen (im modernen Design)\n* Badezimmer und Gäste WC:\n- hochwertige Sanitärkeramik, z.T. Einbauradio, Handtuchheizkörper, großer Spiegel, Deckenspots\n* Duschen: bodengleiche Elemente mit Echtglasabtrennung, Handtuchheizkörper\n* Balkone, Terrassen und Loggia:\nWPC Diele als Fußbodennutzschicht und vollflächige Verkleidung, 1 Außenleuchte, 1 Steckdose, Außenwasserhahn, blickdichte Verkleidung\n* Fenster: \n3-fach Verglasung mit ISO Wärmeschutzglas, Schallschutzklasse 3\n* motorgetriebene Rollläden\n* Türen: \n* Innentüren/Zargen mit glatter, weißer Oberfläche beschichtet\n* Wohnungseingangstür weiß beschichtet mit Türspion\n* Haustüranlage mit Teilverglasung\n* Gegensprechanlage mit Videofunktion\n* Personenaufzug mit Zustieg auf den Wohnebenen, sowie der Kellerebene\n* Treppenhaus - und Fassadengestaltung erfolgt nach Farb- und Gestaltungskonzept\n* Tiefgarage mit elektrisch betriebenen Tor und Handsender\n* in allen Räumen sind Steckdosen, Deckenbrennstellen, Antennenansschlüsse und Telefonanschlüsse ausreichend vorhanden\n* gepflegter Garten am Haus\n* Medien: Kabel Deutschland und Telecom', 'Der Neubau befindet sich im Stadteil Zentrum Süd/Ost. Das Mehrfamilienhaus liegt in einer ruhigen Nebenstraße, öffentliche Verkehrsanbindungen erreicht man in wenigen Gehminuten. \nRestaurants, sowie Supermärkte sind fußläufig perfekt erreichbar. \nDas Ärtzehaus am Johannisplatz erreichen Sie in 5 Gehminuten.\nDie Wohnlage besticht durch seine zentrale Lage zur Innenstadt, Ihr Auto kann also  in der Tiefgarage stehen bleiben und Sie spazieren völlig stressfrei zu Ihren Unternehmungen.', 'Die Angaben zum Objekt wurden vom Eigentümer oder sonstigen Dritten übermittelt.\nWir bitten um Verständnis, dass wir keine Garantie für die Richtigkeit und Vollständigkeit übernehmen können.\n\nNehmen Sie mit uns Kontakt auf, anschauen lohnt sich! Wir zeigen Ihnen gern diese charmante Wohnung.'];showqualicontactform;profile0;false;true;standard;Sachsen;Leipzig;Deutschland;04103;51,33722788878322;12,385418497467032;false;n;y;n;1161;7;15321492;y;first_time_use;001.15269393;n;B;energy_required;district_heating;2;;y;2011;n;;central_heating;23;wohnung_miete;sophisticated;0,active;2018;y;92.9;4;y;;3;3;5;JO23-WE6;negotiable;https://pictures.immobilienscout24.de/listings/2ade912d-7a26-424d-9ec3-34209fb919fc-1324320543.jpg/ORIG/resize/118x118%3E/extent/118x118/format/jpg/quality/80;12;4.89;16.45;4.89;Sachsen;Leipzig;Zentrum_Südost;113831951;214;Johannisgasse;Johannisgasse;50 MBit/s;true;;;50 MBit/s;true;MagentaZuhause M;web,email,bank,music,dl-ul,game,sd,mltstr,hd,fast-ul-dl;über VDSL;REGULAR;https://padlock.link/mm;https://padlock.link/iomm;telekom_layer_magenta_m;ONE_YEAR_FREE;10 MBit/s;65;1455;apartment;2019;9;04103
2020-01-02 00:54:12.575460;/expose/113831667;['Bei dem Neubauobjekt handelt es sich um ein Mehrfamilienhaus, welches in einer Baulücke entstanden ist. Der Neubau ist sehr zentral zum Stadtzentrum gelegen, welches man in 10 Gehminuten erreicht. \nDas Haus verfügt über 5 Vollgeschosse, ein Maisonettegeschoss und eine Tiefgarage mit 12 Stellplätzen. \nDie beiden Erdgeschosswohnungen wurden mit 2 großen Terrassen, sowie einem Gartenanteil für die Wohnungen geplant.\nAlle Wohnungen verfügen über Balkon, Terrasse oder/und Loggia.', 'WE 4 - 1.Obergeschoss mit Balkon und Loogia\n- Tiefgarage\n- großes Wohn-/Koch+Esszimmer mit Zugang Loggia + Balkon\n- Schlafzimmer \n- Kinderzimmer \n- Hauswirtschaftsraum mit WA Anschluss\n- Badezimmer mit Wanne und Dusche\n- Gäste-WC \n\nAusstattungsangaben zum Objekt:\n* hochwertige, anspruchsvolle Ausstattung\n* Fußbodenheizung mit Einzelthermostaten\n* Decken- und Wände glatt gespachtelt\n* Böden:\nendversiegeltes Fertigparkett & Fliesen (im modernen Design)\n* Badezimmer und Gäste WC:\n- hochwertige Sanitärkeramik, z.T. Einbauradio, Handtuchheizkörper, großer Spiegel, Deckenspots\n* Duschen: bodengleiche Elemente mit Echtglasabtrennung, Handtuchheizkörper\n* Balkone, Terrassen und Loggia:\nWPC Diele als Fußbodennutzschicht und vollflächige Verkleidung, 1 Außenleuchte, 1 Steckdose, Außenwasserhahn, blickdichte Verkleidung\n* Fenster: \n3-fach Verglasung mit ISO Wärmeschutzglas, Schallschutzklasse 3\n* motorgetriebene Rollläden\n* Türen: \n* Innentüren/Zargen mit glatter, weißer Oberfläche beschichtet\n* Wohnungseingangstür weiß beschichtet mit Türspion\n* Haustüranlage mit Teilverglasung\n* Gegensprechanlage mit Videofunktion\n* Personenaufzug mit Zustieg auf den Wohnebenen, sowie der Kellerebene\n* Treppenhaus - und Fassadengestaltung erfolgt nach Farb- und Gestaltungskonzept\n* Tiefgarage mit elektrisch betriebenen Tor und Handsender\n* in allen Räumen sind Steckdosen, Deckenbrennstellen, Antennenansschlüsse und Telefonanschlüsse ausreichend vorhanden\n* gepflegter Garten am Haus\n* Medien: Kabel Deutschland und Telecom', 'Der Neubau befindet sich im Stadteil Zentrum Süd/Ost. Das Mehrfamilienhaus liegt in einer ruhigen Nebenstraße, öffentliche Verkehrsanbindungen erreicht man in wenigen Gehminuten. \nRestaurants, sowie Supermärkte sind fußläufig perfekt erreichbar. \nDas Ärtzehaus am Johannisplatz erreichen Sie in 5 Gehminuten.\nDie Wohnlage besticht durch seine zentrale Lage zur Innenstadt, Ihr Auto kann also  in der Tiefgarage stehen bleiben und Sie spazieren völlig stressfrei zu Ihren Unternehmungen.', 'Die Angaben zum Objekt wurden vom Eigentümer oder sonstigen Dritten übermittelt.\nWir bitten um Verständnis, dass wir keine Garantie für die Richtigkeit und Vollständigkeit übernehmen können.\n\nNehmen Sie mit uns Kontakt auf, anschauen lohnt sich! Wir zeigen Ihnen gern diese charmante Wohnung.'];showqualicontactform;profile0;false;true;standard;Sachsen;Leipzig;Deutschland;04103;51,33722788878322;12,385418497467032;false;n;y;n;1012;7;15321492;y;first_time_use;001.15269393;n;B;energy_required;district_heating;1;;y;2011;n;;central_heating;23;wohnung_miete;sophisticated;0,active;2018;y;84.31;4;y;;3;3;5;JO23-WE5;negotiable;https://pictures.immobilienscout24.de/listings/d3b7e970-8dc8-4790-b07a-583333e96093-1340537208.jpg/ORIG/resize/118x118%3E/extent/118x118/format/jpg/quality/80;13;4.89;16.45;4.89;Sachsen;Leipzig;Zentrum_Südost;113831667;194;Johannisgasse;Johannisgasse;50 MBit/s;true;;;50 MBit/s;true;MagentaZuhause M;web,email,bank,music,dl-ul,game,sd,mltstr,hd,fast-ul-dl;über VDSL;REGULAR;https://padlock.link/mm;https://padlock.link/iomm;telekom_layer_magenta_m;ONE_YEAR_FREE;10 MBit/s;65;1286;apartment;2019;9;04103
