2020-01-02 00:59:33.408965;/expose/113684462;"['Willkommen im Neubau ""QUARTIER BONAPPARTE""\r\rEntdecken Sie eine erfrischende Mischung aus historischer Nachbarschaft und moderner Architektur. Vier moderne Stadtvillen mit einer anliegenden Tiefgarage und einer großzügigen Grünanlage faszinieren vom ersten Augenblick an.\r\r* Verteilt auf 4 Stadtvillen entstehen 31 hochwertige Wohnungen sowie 7 Penthäuser\r* 10 verschiedene Grundrisstypen mit viel Raum zum Entspannen und Spielen\r* Bezugsfertig zum 01.03.2020\r\r', 'moderne 3 Zimmer - Wohnung im EG | Balkon | Echtholz-Parkett | Fußbodenheizung | offene Küche | modernes Design-Badezimmer mit Badewanne und Dusche | Einbauradio im Badezimmer mit AUX-Anschluss | glatt gespachtelte Wände weiß | helle Räume durch bodentiefe Fenster mit 3fach Verglasung und elektr. Außenjalousien | HWR inkl. Waschmaschinenanschluss | LED-Deckenspots im Flur & Badezimmer | TV & Internet Anschluss in allen Wohnräumen | Videosprechanlage | Aufzug | Tiefgarage | Lüftungsanlagen mit Wärmerückgewinnung | Solarthermie | Vollwärmeschutz | KfW 55 | Hausmeisterservice | \n\r', '*Wohnen direkt am Völkerschlachtdenkmal* rund um das südlich der Messestadt gelegene Domizil in Leipzig - Stötteritz findet man alles, was für den täglichen Bedarf benötigt wird, z.B. Bäcker, Apotheke, Lebensmittelmarkt sowie viele andere Einzelhandels- und Dienstleistungsgeschäfte.\r\rDie vorhandene Infrastruktur und die hervorragende Verkehrsanbindung machen das Quartier Bonapparte besonders attraktiv.\r\rUmgeben von riesigen Grünanlagen bietet der Standort einen extrem hohen Freizeitwert mit Nähe zur Innenstadt. \rPrager Straße 181 - 187 \r04299 Leipzig\r\rVilla Franz - HAUS 1', 'Das Angebotene Objekt befindet sich derzeit noch im Bau. Wir bitten um Ihr Verständnis, dass es sich bei den gezeigten Bildern um Referenzbilder vergleichbarer Wohnungen oder Unverbindlicher Visualisierungen handelt. \n\r\n\rWir freuen uns auf eine Besichtigung mit Ihnen. Rufen Sie gleich an. \n\rIhr LEWO-Team\n\r\n\r']";showqualicontactform;profile0;false;true;standard;Sachsen;Leipzig;Deutschland;04299;51,31339643574522;12,413877215625718;false;n;y;y;777.42;5;524857;y;first_time_use;001.524857;n;;energy_required;solar_heating:gas;0;;y;;n;;floor_heating;181-187;wohnung_miete;sophisticated;0,active;2019;y;74.04;3;n;1;3;3;;P181WE02;no_information;https://pictures.immobilienscout24.de/listings/d3b34525-8ce8-40f7-bcc4-cd44fc196751-1339640545.jpg/ORIG/resize/118x118%3E/extent/118x118/format/jpg/quality/80;11;3.99;14.64;3.99;Sachsen;Leipzig;Stötteritz;113684462;218.42;Pragerstr.;Pragerstr.;;;;;;false;;;;;;;;;;;995.84;ground_floor;2018;9;04299
2020-01-02 00:59:34.499377;/expose/113663324;['Schönes, saniertes Altbauhaus in der Georg-Schumann-Straße in Möckern.', 'Die Wohnung liegt im 1.Obergeschoss des sanierten Altbauhauses. Sie verfügt über zwei Räume sowie Bad, Küche und Flur und ist ideal für junge Pärchen. \nDas Tageslichtbad ist gefliest und verfügt über eine Badewanne. Die Küche ist wandseitig gefliest und verfügt über ein Fenster. \nIm Wohn- und Schlafzimmer sowie im Flur wurde ein ansprechender Laminatboden verlegt.\n\nEin Keller kann, je nach Verfügbarkeit, genutzt werden.\n\nDie Beheizung der Wohnung erfolgt über eine Zentralheizung.', 'Unser Wohn-/Gewerbehaus Georg-Schumann-Straße 170 befindet sich im Stadtteil Möckern, nördlich des Stadtzentrums von Leipzig.\nDer Bezirk besticht durch eine Mischung aus überwiegend sanierten Gründerzeitbauten und Neubauwohnungen. Ebenso bietet Möckern eine gute Infrastruktur für seine Bewohner. \nAuf der Georg-Schumann-Straße, welche Schkeuditz und Leipzig verbindet, verkehren zwei Straßenbahnlinien. Die Linien 10 und 11 verkehren in nordwestlicher Richtung nach Wahren bzw. Schkeuditz und in Südlicher Richtung nach Lößning sowie Markkleeberg-Ost. Dabei verkehren sie auch durch die City. Somit haben Sie auch eine problemlose Anbindung an den Leipziger Hauptbahnhof. Zudem befindet sich nur wenige Minuten zu Fuß entfernt der  S- und Regionalbahnhof Leipzig-Möckern. Von hieraus erreichen Sie mit der S1 Leipzig (Miltitzer Allee) bzw. Wurzen sowie mit der Regionalbahn Weißenfels bzw. Erfurt.\nEinkaufsmöglichkeiten des täglichen Bedarfs finden sich in fußläufiger Umgebung. Für ausgiebige Shoppingtouren empfiehlt sich das Stadtzentrum.\nKindertagesstätten, Grundschulen und weiterführende Schulen befinden sich ebenfalls im Wohnumfeld. Des Weiteren ist Leipzig auch als Universitätsstandort über die Stadtgrenze hinaus sehr beliebt. Jährlich zieht es viele junge Abiturienten aus ganz Deutschland zum Studium in die einwohnerstärkste Stadt Sachsens.\nBeste Erholungsmöglichkeiten bietet der in wenigen Minuten erreichbare Leipziger Auwald. Dieser gehört zu den größten Auwaldbeständen in Mitteleuropa und bietet daher ideale Bedingungen für ausgedehnte Spaziergänge. Auch der Zoo Leipzig schließt sich diesem einzigartigen Waldgebiet an.', 'Vereinbaren Sie kurzfristig Besichtigungstermine mit uns. Nutzen Sie hierzu einfach das Kontaktformular des Immobilienportals oder setzen Sie sich mit Herrn Grönitz unter der Rufnummer 0151-18 110 110 in Verbindung.\n\nWir freuen uns auf Sie! '];showqualicontactform;profile0;false;true;standard;Sachsen;Leipzig;Deutschland;04159;51,3667912896039;12,347448554477495;false;n;n;n;405;3;17056679;n;well_kept;002.01007837224;y;;;gas;1;;n;2;n;60;central_heating;170;wohnung_miete;normal;0,active;;n;57.53;2;n;;2;2;5;GSCHUMANN170_VH1L (1/496);negotiable;https://pictures.immobilienscout24.de/listings/92fd1474-d73b-46e3-a3df-66fabbc0f941-1321944036.jpg/ORIG/resize/118x118%3E/extent/118x118/format/jpg/quality/80;10;3.8;14.48;3.8;Sachsen;Leipzig;Möckern;113663324;120;"Georg-Schumann-Stra&szlig;e";Georg-Schumann-Straße;100 MBit/s;true;;;100 MBit/s;true;MagentaZuhause L;web,email,bank,music,dl-ul,game,sd,mltstr,hd,fast-ul-dl;über VDSL;REGULAR;https://padlock.link/ml;https://padlock.link/ioml;telekom_layer_magenta_l;ONE_YEAR_FREE;40 MBit/s;;525;apartment;1900;1;04159
2020-01-02 00:59:41.697560;/expose/113642924;['Die Einheit befindet sich im Hinterhaus eines Wohn- und Geschäftshauses. Sie ist besonders geeignet zur Nutzung als Wohngemeinschaft. Neben den komplett möblierten Zimmern bietet ein großzügiger Gemeinschaftsraum mit Küche Raum für gemeinsames Kochen und angenehme Gespräche.', 'Alle 9 Zimmer sind voll möbliert. Auf der Etage befinden sich insgesamt 3 Bäder incl. Waschmaschine und Trockner.', 'Das Wohn- und Geschäftshaus befindet sich ca. 10 Minuten von der Leipziger Innenstadt / Universität entfernt. Das Objekt zeichnet sich besonders durch seine gute Infrastruktur aus. Zahlreiche Einkaufsmöglichkeiten, sowie ein unmittelbarer Zugang zu den ÖNVP prägen dieses Angebot. Das Wohn- und Geschäftshaus besteht aus einem Vorder- und einem Hinterhaus.', 'Sollte Sie dieses Objekt genauso begeistern wie uns, steht unser freundliches und engagiertes Team Ihnen jederzeit für alle Ihre Fragen gern zur Verfügung. Sollten wir einmal telefonisch nicht erreichbar sein, so können Sie uns Ihre Fragen jederzeit per E-Mail senden.\n\nAlle Angaben sind ohne Gewähr und basieren ausschließlich auf Informationen, die uns von unserem Auftraggeber zur Verfügung gestellt wurden. Wir, A.F.I.S. Annett Friedrich Immobilien-Service, übernehmen keine Gewähr für die Richtigkeit, Vollständigkeit und Aktualität der Angaben. Irrtum und Zwischenvermietung bleiben vorbehalten.'];showqualicontactform;profile0;false;true;standard;Sachsen;Leipzig;Deutschland;04315;51,339856954215;12,409417095471632;false;n;n;n;2781;9;15472388;n;well_kept;001.15415479;y;;;gas;1;;n;;y;;central_heating;4a;wohnung_miete;normal;0,active;;n;309;7;n;;9;5;3;113642924;no_information;https://pictures.immobilienscout24.de/listings/b76bf4d2-37cc-495a-a8c1-242082168bb8-1321685550.jpg/ORIG/resize/118x118%3E/extent/118x118/format/jpg/quality/80;7;4.6;16.5;4.6;Sachsen;Leipzig;Volkmarsdorf;113642924;772;Wiebelstr.;Wiebelstr.;100 MBit/s;true;;;100 MBit/s;true;MagentaZuhause L;web,email,bank,music,dl-ul,game,sd,mltstr,hd,fast-ul-dl;über VDSL;REGULAR;https://padlock.link/ml;https://padlock.link/ioml;telekom_layer_magenta_l;ONE_YEAR_FREE;40 MBit/s;;3553;apartment;;;04315
2020-01-02 00:59:47.664434;/expose/113654067;['Die Wohnanlage, welche sich auf dem Areal der ehemaligen Brauerei von Carl Wilhelm Naumann befindet, besteht aus 11 Neubau-Mehrfamilienhäusern mit 182 attraktiven Mietwohnungen, 4 Gewerbeeinheiten und zwei Tiefgaragen mit Pkw-Stellplätzen.\n\nDurchdachte Grundrisse, eine hochwertige Ausstattung, sonnige Balkone, Loggien und Terrassen sowie die attraktive Lage zentrumsnah und direkt am Stadtpark zeichnen diese Wohnungen aus.', 'Freuen Sie sich über eine exklusive Neubauwohnung!\n\nAusstattungs-Highlights:\n\n- Balkon mit Sichtschutz\n- Fußbodenheizung in sämtlichen Räumen\n- Vliestapete weiß gestrichen\n- Wohnräume mit Eiche-Parkett (geölt)\n- innere Fensterbänke aus Marmor Jura gelb\n- großformatige Feinsteinzeugfliesen in den Bädern, Küche und Abstellraum\n- moderne Badausstattung\n- Handtuchheizkörper\n- Waschmaschinenanschluss in der Wohnung\n- im Boden eingelassene Fußabstreifer vor der Wohnung\n- isolierverglaste, schallgeschützte Kunststofffenster und Balkontüren\n- teilweise elektrische Rollläden\n- Wohnungseingangstür mit 3-Punkt-Verriegelung und abdeckbarem Weitwinkelspion\n- Farbvideo-Gegensprechanlage\n- Hauptschlafzimmer mit separater Ankleide\n- TG-Stellplatz optional für 60€ monatlich je Stellplatz zubuchbar\n\nZu jeder Wohnung gehört ein Kellerraum, außerdem stehen der Wohngemeinschaft Fahrradräume zur Verfügung.', 'Das Wohnquartier „Naumannsche Brauerei“ liegt ca. 4 \u2009km vom Zentrum entfernt, auf dem Areal der ehemaligen Brauerei von Carl Wilhelm Naumann im Stadtteil Plagwitz, in der Zschocherschen Straße / Erich-Zeigner-Allee.!\n\nIn unmittelbarer Nähe finden Sie alle Einrichtungen des täglichen Bedarfs wie Supermärkte, Ärzte und Schulen. Die nächste Stadtbahn-Haltestelle liegt nur eine Gehminute vom Wohnpark entfernt und bietet eine gute Anbindung an den Hauptbahnhof, welchen Sie in ca. 15 Minuten erreichen. Der Stadtteilpark Plagwitz ist 5 Gehminuten entfernt und auch das Ufer der Weißen Elster ist fußläufig schnell erreichbar.\n\nEntfernungen:\n- Hauptbahnhof: ca. 4 km (15 Minuten mit der Stadtbahn)\n- Stadtteilpark Plagwitz: ca. 0,5 km (5 Fußminuten)\n- Ufer der Weißen Elster: ca. 0,3 km (3 Fußminuten)\n- Stadtbahn-Haltestelle: ca. 0,2 km (2 Fußminuten)\n- Supermarkt: ca. 0,1 km (eine Fußminuten)\n- Kindergarten: ca. 0,7 km (9 Fußminuten)\n\nDen Flughafen Leipzig / Halle Airport erreichen Sie mit dem Auto in ungefähr einer halben Stunde (ca. 20 km).', 'Dies ist nur ein Auszug aus unserem umfangreichen Wohnungsangebot im Wohnquartier „Naumann’sche Brauerei“ Leipzig. Wir können Ihnen eine große Auswahl an 1- bis 5-Zimmer-Wohnungen anbieten. Für Rückfragen zur aktuellen Verfügbarkeit rufen Sie uns bitte an oder senden Sie uns eine Anfrage.\n\nBesichtigen Sie unsere Musterwohnung! \n\nAnschrift: \nErich-Zeigner-Allee 60A, Haus 15, 1. OG links\n\nÖffnungszeiten (keine Voranmeldung notwendig): \nMittwoch und Freitag             16.00 – 18.00 Uhr \n\nGerne können Sie uns auch kontaktieren um einen individuellen Termin zu vereinbaren. \nNach Absprache sind individuelle Termine auch samstags möglich!'];;profile0;false;true;standard;Sachsen;Leipzig;Deutschland;04229;51,32585494438172;12,336555104913062;true;n;y;y;767;5;993280;y;first_time_use;001.993280;y;;;;3;;n;62;y;;floor_heating;62F;wohnung_miete;sophisticated;0,active;;y;66;3;n;1;2;2;5;113654067;no_information;https://pictures.immobilienscout24.de/listings/47f9af7c-d8aa-4db2-9c43-078585705669-1321813518.jpg/ORIG/resize/118x118%3E/extent/118x118/format/jpg/quality/80;11;4.58;15.1;4.58;Sachsen;Leipzig;Plagwitz;113654067;146;Erich-Zeigner-Allee;Erich-Zeigner-Allee;;;;;;false;;;;;;;;;;;913;apartment;2018;9;04229
2020-01-02 00:59:48.704745;/expose/113613833;['Die Wohnanlage, welche sich auf dem Areal der ehemaligen Brauerei von Carl Wilhelm Naumann befindet, besteht aus 11 Neubau-Mehrfamilienhäusern mit 182 attraktiven Mietwohnungen, 4 Gewerbeeinheiten und zwei Tiefgaragen mit Pkw-Stellplätzen.\n\nDurchdachte Grundrisse, eine hochwertige Ausstattung, sonnige Balkone, Loggien und Terrassen sowie die attraktive Lage zentrumsnah und direkt am Stadtpark zeichnen diese Wohnungen aus.', 'Freuen Sie sich über eine exklusive Neubauwohnung!\n\nAusstattungs-Highlights:\n\n- Balkon mit Sichtschutz\n- Fußbodenheizung in sämtlichen Räumen\n- Vliestapete weiß gestrichen\n- Wohnräume mit Eiche-Parkett (geölt)\n- innere Fensterbänke aus Marmor Jura gelb\n- großformatige Feinsteinzeugfliesen in den Bädern, Küche und Abstellraum\n- moderne Badausstattung\n- Handtuchheizkörper\n- Waschmaschinenanschluss in der Wohnung\n- im Boden eingelassene Fußabstreifer vor der Wohnung\n- isolierverglaste, schallgeschützte Kunststofffenster und Balkontüren\n- teilweise elektrische Rollläden\n- Wohnungseingangstür mit 3-Punkt-Verriegelung und abdeckbarem Weitwinkelspion\n- Farbvideo-Gegensprechanlage\n- Hauptschlafzimmer mit separater Ankleide\n- TG-Stellplatz optional für 60€ monatlich je Stellplatz zubuchbar\n\nZu jeder Wohnung gehört ein Kellerraum, außerdem stehen der Wohngemeinschaft Fahrradräume zur Verfügung.', 'Das Wohnquartier „Naumannsche Brauerei“ liegt ca. 4 \u2009km vom Zentrum entfernt, auf dem Areal der ehemaligen Brauerei von Carl Wilhelm Naumann im Stadtteil Plagwitz, in der Zschocherschen Straße / Erich-Zeigner-Allee.\n\nIn unmittelbarer Nähe finden Sie alle Einrichtungen des täglichen Bedarfs wie Supermärkte, Ärzte und Schulen. Die nächste Stadtbahn-Haltestelle liegt nur eine Gehminute vom Wohnpark entfernt und bietet eine gute Anbindung an den Hauptbahnhof, welchen Sie in ca. 15 Minuten erreichen. Der Stadtteilpark Plagwitz ist 5 Gehminuten entfernt und auch das Ufer der Weißen Elster ist fußläufig schnell erreichbar.\n\nEntfernungen:\n- Hauptbahnhof: ca. 4 km (15 Minuten mit der Stadtbahn)\n- Stadtteilpark Plagwitz: ca. 0,5 km (5 Fußminuten)\n- Ufer der Weißen Elster: ca. 0,3 km (3 Fußminuten)\n- Stadtbahn-Haltestelle: ca. 0,2 km (2 Fußminuten)\n- Supermarkt: ca. 0,1 km (eine Fußminuten)\n- Kindergarten: ca. 0,7 km (9 Fußminuten)\n\nDen Flughafen Leipzig / Halle Airport erreichen Sie mit dem Auto in ungefähr einer halben Stunde (ca. 20 km).', 'Dies ist nur ein Auszug aus unserem umfangreichen Wohnungsangebot im Wohnquartier „Naumann’sche Brauerei“ Leipzig. Wir können Ihnen eine große Auswahl an 1- bis 5-Zimmer-Wohnungen anbieten. Für Rückfragen zur aktuellen Verfügbarkeit rufen Sie uns bitte an oder senden Sie uns eine Anfrage.\n\nBesichtigen Sie unsere Musterwohnung! \n\nAnschrift: \nErich-Zeigner-Allee 60A, Haus 15, 1. OG links\n\nÖffnungszeiten (keine Voranmeldung notwendig): \nMittwoch und Freitag             16.00 – 18.00 Uhr \n\nGerne können Sie uns auch kontaktieren um einen individuellen Termin zu vereinbaren. \nNach Absprache sind individuelle Termine auch Samstags möglich!'];;profile0;false;true;standard;Sachsen;Leipzig;Deutschland;04229;51,32585494438172;12,336555104913062;true;n;y;y;1270;7;993280;y;first_time_use;001.993280;y;;;;2;;n;62;n;;floor_heating;62G;wohnung_miete;sophisticated;0,active;;y;133.65;6;n;1;4;4;3;279;no_information;https://pictures.immobilienscout24.de/listings/4843b8f8-a009-440f-884e-b2eb85190187-1321280458.jpg/ORIG/resize/118x118%3E/extent/118x118/format/jpg/quality/80;11;4.58;15.1;4.58;Sachsen;Leipzig;Plagwitz;113613833;294;Erich-Zeigner-Allee;Erich-Zeigner-Allee;;;;;;false;;;;;;;;;;;1564;apartment;2018;9;04229
2020-01-02 00:59:54.733150;/expose/113645310;['Schönes, saniertes Altbauhaus in der Schulze-Delitzsch-Straße/ Ecke Hermann-Liebmann-Straße nähe Stadteilpark Rabet.', 'Die schicke 2-Raumwohnung liegt im Erdgeschoss des stilvollen Altbauhauses. \nSie ist perfekt für junge Paare oder Wohngemeinschaften geeignet! \nBeim Betreten der Wohnung erwartet Sie ein großzügiger Eingangsbereich, welcher mit klassischen Laminat versehen worden ist. Dieses Laminat findet sich auch im Wohn- sowie Schlafzimmer wieder. \nAlle Räume der Wohnung sind perfekt geschnitten für optimale Stellmöglichkeiten und werden mit viel Licht durchflutet. \nDie Küche, mit Fenster, ist hellgrau gefliest und sie bietet auch ausreichend Platz für einen gemütlichen Essbereich. \nDas Tageslichtbad ist mit einer Badewanne mit Duschfunktion ausgestattet. \n\nEin Keller kann je nach Verfügbarkeit kostenlos genutzt werden. \n', 'Unser schöner Gründerzeitaltbau in der Schulze-Delitzsch-Straße 41/ Ecke Hermann-Liebmann-Straße liegt östlich des Stadtzentrums von Leipzig im Ortsteil Neustadt-Neuschönefeld. \nDieser Stadtteil bietet seinen Bewohnern, entlang der Eisenbahnstraße sowie der Dresdner Straße eine abwechslungsreiche Mischung aus kulturellen und kulinarischen Erlebnissen. Hier finden sich neben kleinen Läden des täglichen Bedarfs, auch einige ärztliche Versorgungspraxen sowie verschiedene Kunst- und Kulturvereine. \nKindertagesstätten, Grundschulen und weiterführende Schulen befinden sich in unmittelbarer Umgebung des Wohnumfeldes. Darüber hinaus ist Leipzig auch als Universitätsstandort über die Stadtgrenze hinaus sehr beliebt. Jährlich zieht es viele junge Abiturienten aus ganz Deutschland zum Studium in die einwohnerstärkste Stadt Sachsens.\nEine ideale Anbindung an das nahegelegene Stadtzentrum bietet die Nutzung der Straßenbahn. Die Linien 1 und 3 verkehren direkt über den Leipziger Hauptbahnhof, welcher sich nur wenige Stationen entfernt befindet. Auch verschiedene Buslinien (70, 72, 73 und 90) verkehren in kurzen Abständen.\nIm Stadtzentrum und um den Hauptbahnhof herum, haben Sie beste Möglichkeiten für Shoppingtouren bzw. Stadtbesichtigungen. Hier hat Leipzig einiges zu bieten. Ein Besuch des historischen Völkerschlachtdenkmals oder der Thomaskirche, Heimat des weltberühmten Thomanerchors, sind dabei unausweichlich.\nIdeale Bedingungen für ausgedehnte Spaziergänge nach einem stressigen Arbeitstag oder am Wochenende, bietet der wenige Gehminuten entfernte Stadtteilpark Rabet. Die „grüne Oase“ umfasst eine Fläche von ca. 96000m². Hier werden Sie sich wohl fühlen!', 'Vereinbaren Sie kurzfristig Besichtigungstermine mit uns. Nutzen Sie hierzu einfach das Kontaktformular des Immobilienportals oder setzen Sie sich mit Herrn Grönitz unter der Rufnummer 0151-18 110 110 in Verbindung.\n\nWir freuen uns auf Sie! '];showqualicontactform;profile0;false;true;standard;Sachsen;Leipzig;Deutschland;04315;51,34822962276397;12,405825975108915;false;n;n;n;380;2;17056679;y;well_kept;002.01007837224;y;;;no_information;0;;n;2;n;60;central_heating;41;wohnung_miete;sophisticated;0,active;;n;58.01;2;n;;2;2;5;SDELITZSCH41_VHEGL (1/492);negotiable;https://pictures.immobilienscout24.de/listings/c197f29d-679d-494a-8ed5-48365e128bcf-1321715827.jpg/ORIG/resize/118x118%3E/extent/118x118/format/jpg/quality/80;11;4.81;14.57;4.81;Sachsen;Leipzig;Neustadt_Neuschönefeld;113645310;120;"Schulze-Delitzsch-Stra&szlig;e";Schulze-Delitzsch-Straße;100 MBit/s;true;;;100 MBit/s;true;MagentaZuhause L;web,email,bank,music,dl-ul,game,sd,mltstr,hd,fast-ul-dl;über VDSL;REGULAR;https://padlock.link/ml;https://padlock.link/ioml;telekom_layer_magenta_l;ONE_YEAR_FREE;40 MBit/s;;500;raised_ground_floor;1900;1;04315
2020-01-02 00:59:55.716635;/expose/113649828;['Schöner Wohnen in Leipzig-Möckern!\nDie helle 3-Zimmerwohnung glänzt durch ihren praktischen Grundriss.  \nSie verfügt sie über ein Schlaf-, Wohn- und Kinderzimmer, ein Taglichtbad mit Wanne sowie eine großzügige Küche mit Zugang zum Balkon und Blick in den begrünten Innenhof.\nAlle Räumlichkeiten sind vom Flur begehbar. \n\n', '- 3-Zimmer\n- 2. Obergeschoss\n- Bodenbelag: Laminat / Fliesen\n- Bad mit Badewanne, Fenster und Waschmaschinenanschluss\n- Küche mit Fenster und Zugang zum Balkon\n- Gegensprechanlage\n- Kellerabteil\n- Hausreinigung erfolgt durch den Hausmeister\n\nDer Energieausweis liegt der Hausverwaltung vor und kann nach Rücksprache eingesehen werden.', 'Der Stadtteil Möckern liegt im Nordwesten Leipzigs. Er grenzt im Osten an den Stadtteil Gohlis, im Norden an Lindenthal und im Westen an Wahren. Im Süden liegt die Auenlandschaft der Weißen Elster und der Luppe. Der Auensee mit seiner Parkeisenbahn ist ein wunderschönes Ausflugsziel, fast direkt vorm Haus. Außerdem befindet sich dort das Haus Auensee, in dem regelmäßig Konzerthighlights nationaler und internationaler Künstler stattfinden.\nMit ca 13.500 Einwohnern gehört Möckern zu einem der gut bewohnten Stadtteile.\nEinkaufsmöglichkeiten, Ämter und Ärzte, Schulen und Kindergärten sind in der näheren Umgebung erreichbar. In Möckern sind eine Grund- und Mittelschule sowie ein Gymnasium ansässig.', 'Wir haben die Angaben in diesem Exposé nach bestem Wissen und Gewissen erstellt. Gleichwohl können fehlerhafte Angaben nicht vollkommen ausgeschlossen werden. Wir bitten daher um Verständnis, dass wir für unsere hier gemachten Angaben keinerlei Gewähr übernehmen können. Im Fall eines Vertragsabschlusses über das hier offerierte Objekt gilt ausschließlich der Inhalt des zwischen den Parteien vereinbarten Kauf- bzw. Mietvertrages.\n\nMöchten Sie eine Immobilie kaufen oder verkaufen, mieten oder vermieten ?\nÜber Ihre Kontaktaufnahme würden wir uns freuen.'];showqualicontactform;profile0;false;true;standard;Sachsen;Leipzig;Deutschland;04159;51,367988879713;12,348296600929386;false;n;y;n;492;3;12295689;y;no_information;001.12295689;n;;no_information;no_information;2;disabled;y;1;n;;central_heating;31;wohnung_miete;normal;0,active;;n;75.6;3;n;;3;3;4;VM-FA31-9;negotiable;https://pictures.immobilienscout24.de/listings/57cec2e1-33c7-4c48-9307-e868a8c6e378-1321766574.jpg/ORIG/resize/118x118%3E/extent/118x118/format/jpg/quality/80;11;3.8;14.48;3.8;Sachsen;Leipzig;Möckern;113649828;150;"Faradaystra&szlig;e";Faradaystraße;100 MBit/s;true;;;100 MBit/s;true;MagentaZuhause L;web,email,bank,music,dl-ul,game,sd,mltstr,hd,fast-ul-dl;über VDSL;REGULAR;https://padlock.link/ml;https://padlock.link/ioml;telekom_layer_magenta_l;ONE_YEAR_FREE;40 MBit/s;;642;apartment;1912;1;04159
2020-01-02 01:00:01.661782;/expose/113643513;['Die Wohnung befindet sich im Erdgeschoss des Mehrfamilienhauses. Sie verfügt über 102 m², die sich auf vier Zimmer, eine offene Küche, ein Badezimmer, ein Gäste-WC, einen Flur und einen Balkon verteilen. Sie betreten die Wohnung über den großen, lichtdurchfluteten Flur. An diesen angrenzend befindet sich die offene Küche mit Zugang zum Balkon. Die Küche ist weiß gefliest und bietet Platz für eine lange Küchenzeile und eine Essecke. Der Balkon ist in Richtung des kleinen Innenhofes gelegen. Alle Räume der Wohnung sind vom Flur begehbar. Die Zimmer sind mit Dielenboden ausgestattet und verfügen jeweils über ca. 10 m², 13 m², 16 m² und 18 m². Das Badezimmer verfügt über Wanne, Dusche, Waschmaschinenanschluss, Handtuchheizkörper und Fenster. Die Warmwasseraufbereitung erfolgt über einen Durchlauferhitzer. Zudem steht ein Gäste-WC zur Verfügung. \nIm Jahr 2016 wurde das komplette Haus saniert. Es wurde viel Wert darauf gelegt den Charakter und Altbaucharme des Hauses so weit wie möglich zu erhalten.', 'Der sanierte Altbau liegt im Leipziger Osten im Stadtteil Neustadt-Neuschönefeld. In direkter Nähe befinden sich auf der Dresdner Straße unzählige Geschäfte für das tägliche Leben, z. B. Kaufland, Rossmann, Apotheken, Banken, Bistros u.v.m. In etwa 160 m Entfernung befindet sich die Straßenbahnhaltestelle Köhlerstraße. Von hier aus gelangen Sie mit den Straßenbahnlinien 4 und 7 in ca. 5 Minuten in die Innenstadt sowie zur Universität. Auch der Hauptbahnhof ist nur 2 km entfernt und mit dem Fahrrad in ca. 8 Minuten zu erreichen. Neben der guten Anbindung an das Zentrum, sticht auch der kurze Weg zum nächstgelegen Park, dem Lene-Voigt-Park, hervor.', 'Sie finden alle unsere Angebote hier:\nhttps://tinyurl.com/zimmerzeitaufimmoscout24\n\nDie Warmwasseraufbereitung erfolgt über einen Durchlauferhitzer. \n\nWir weisen Sie darauf hin, dass die personenbezogenen Daten aus Ihrer Anfrage zum Zwecke der Objektanmietung gespeichert werden. Mit der Übermittlung Ihrer personenbezogenen Daten willigen Sie der Nutzung Ihrer Daten zu diesem Zwecke ein. Weitere Hinweise zur Verwendung Ihrer Daten finden Sie auf unserer Website https://zimmerzeit.de/datenschutzerklarung/.'];showqualicontactform;profile0;false;true;standard;Sachsen;Leipzig;Deutschland;04315;51,3397064030618;12,402426504888252;false;n;y;n;790.52;5;15970289;n;no_information;001.15819234;y;C;energy_required;no_information;0;;n;;n;81.79;central_heating;67;wohnung_miete;normal;0,active;;n;102.24;5;n;;4;4;5;LE0632;negotiable;https://pictures.immobilienscout24.de/listings/f8a841b6-a799-4d3c-825e-234524680900-1321743615.jpg/ORIG/resize/118x118%3E/extent/118x118/format/jpg/quality/80;30;4.81;14.57;4.81;Sachsen;Leipzig;Neustadt_Neuschönefeld;113643513;122.69;"Kohlgartenstra&szlig;e";Kohlgartenstraße;100 MBit/s;true;;;100 MBit/s;true;MagentaZuhause L;web,email,bank,music,dl-ul,game,sd,mltstr,hd,fast-ul-dl;über VDSL;REGULAR;https://padlock.link/ml;https://padlock.link/ioml;telekom_layer_magenta_l;ONE_YEAR_FREE;40 MBit/s;83.1;995;ground_floor;1900;1;04315
