2020-01-02 00:09:45.074989;/expose/114305916;['Die Stahmelner Straße 123 ist ein gepflegtes Haus mit 9 Wohneinheiten und einer Gewerbeeinheit. \nFür alle Mieter nutzbar ist der kleine Vorgarten vor dem Haus.', 'Es handelt sich hier um eine unrenovierte Mieteinheit mit ansprechendem Laminatfußboden. Die 2 vorhandenen Zimmer (Laminat) sind sehr gut geschnitten und bieten viel Platz. Die Küche ist schön geräumig und mit Fenster ausgestattet. \nDas Bad bietet eine Dusche (ohne Fenster).', 'Der Ortsteil Stahmeln liegt im Nordwesten der Stadt Leipzig. \nEs gibt sehr gute Verkehrsanbindungen in alle Richtungen. Diverse Einkaufsmöglichkeiten sind ganz in der Nähe. \nDer Auewald mit vielen Erholungsmöglichkeiten liegt in greifbarer Nähe.', 'Wir zeigen Ihnen gern diese Wohnung. Bitte vereinbaren Sie mit uns einen Besichtigungstermin. \n\nIhr freundliches NABERGO-Team!!!'];;profile0;false;true;standard;Sachsen;Leipzig;Deutschland;04159;51,3768196259317;12,30389550285847;false;n;n;n;345;2;4320989;y;no_information;001.4320989;y;D;energy_consumption;gas;2;;y;;n;;gas_heating;123;wohnung_miete;normal;0,active;;n;53.03;2;n;;2;2;3;114305916;negotiable;https://pictures.immobilienscout24.de/listings/7883ce07-94a1-4aee-a504-729a2d09b00a-1331335205.jpg/ORIG/resize/118x118%3E/extent/118x118/format/jpg/quality/80;6;2.38;13.77;2.38;Sachsen;Leipzig;Lützschena_Stahmeln;114305916;65;"Stahmelner Stra&szlig;e";Stahmelner_Straße;100 MBit/s;true;;;100 MBit/s;true;MagentaZuhause L;web,email,bank,music,dl-ul,game,sd,mltstr,hd,fast-ul-dl;über VDSL;REGULAR;https://padlock.link/ml;https://padlock.link/ioml;telekom_layer_magenta_l;ONE_YEAR_FREE;40 MBit/s;118.4;410;no_information;1933;1;04159
2020-01-02 00:09:51.193632;/expose/114303901;['Komplett sanierte 4-Raumwohnung im Stadtzentrum nahe Rosental / Jacobstr. direkt vom Eigentümer zu vermieten.\n\n+ Großer Wohnraum mit offener Küche und Balkon\n+ Dachterrasse, \n+ Bad mit Wanne und großer Dusche, Doppel-Waschtisch mit Unterschränken, komplett neu gefliest, Badausstattung neu\n+ Gäste-WC\n+ Aufzug\n+ TG-Stellplatz,\n+ neues Parkett in allen Wohnräumen\n+ Küchenfußboden und Theke Granit\n\nGröße 160 qm\nKaltmiete 1.600 €\nBK-Vorauszahlung 380 €\nKaution 2 Kaltmieten\n\nBei Fragen und Besichtigungswünschen wenden Sie sich bitte an die Hausverwaltung: Monika Harder, 0172 451 3791 oder 034386 / 44579', 'Sämtliche Angaben in den Exposés sind nach bestem Wissen und Gewissen durch die Firma Schröder & Busch Immobilien GmbH erstellt wurden, und beruhen auf Angaben des Verkäufers oder Vermieters. Bei den geschätzten Größen handelt es sich um ca. Angaben, eine Haftung durch die Firma Schröder & Busch Immobilien GmbH ist grundsätzlich ausgeschlossen. Irrtum, Zwischenverkauf und die Zwischenvermietung bleiben vorbehalten.'];showqualicontactform;profile0;false;true;standard;Sachsen;Leipzig;Deutschland;04105;51,3446614695281;12,368479023516436;false;n;y;y;1600;8;15435190;y;no_information;002.01000792952;y;;energy_consumption;no_information;5;;n;0;n;;central_heating;5;wohnung_miete;sophisticated;0,active;2019;y;160;7;n;;4;4;6;862;negotiable;https://pictures.immobilienscout24.de/listings/6f8d7b13-38ac-4bfe-939d-f91800ffaadf-1331289250.jpg/ORIG/resize/118x118%3E/extent/118x118/format/jpg/quality/80;10;4.3;15.29;4.3;Sachsen;Leipzig;Zentrum_Nordwest;114303901;380;"Jacobstra&szlig;e";Jacobstraße;100 MBit/s;true;;;100 MBit/s;true;MagentaZuhause L;web,email,bank,music,dl-ul,game,sd,mltstr,hd,fast-ul-dl;über VDSL;REGULAR;https://padlock.link/ml;https://padlock.link/ioml;telekom_layer_magenta_l;ONE_YEAR_FREE;40 MBit/s;;;roof_storey;1994;5;04105
2020-01-02 00:09:57.984002;/expose/114298628;['Das Objekt ist in Grünau zentral gelegen mit guter Anbindung an den öffentlichen Nahverkehr. Im Wohngebiet finden Sie Arztpraxen, Kindertagesstätten, Schulen und Einkaufsmöglichkeiten. Mit der Straßenbahn erreichen Sie schnell den Kulkwitzer See. Mieten Sie günstig eine klassische Neubauwohnung und entfalten Sie Ihre eigene Kreativität beim Vorrichten der Wohnung!', 'gute Verkehrsanbindung Bus, Bahn und S-Bahn,gute Einkaufsmöglichkeiten'];showqualicontactform;profile0;false;true;standard;Sachsen;Leipzig;Deutschland;04209;51,31508336449781;12,300436098608756;true;n;y;n;247.99;1;17773;n;no_information;001.17773;y;;;no_information;4;disabled;n;;n;77;central_heating;60;wohnung_miete;no_information;0,active;;y;53.74;2;n;;2;2;9;1000.00062802.00001056;negotiable;https://pictures.immobilienscout24.de/listings/f27d8dc1-369e-4344-9aca-da5dd1fbcd1f-1342911236.jpg/ORIG/resize/118x118%3E/extent/118x118/format/jpg/quality/80;8;3.28;10.05;3.28;Sachsen;Leipzig;Grünau_Mitte;114298628;75;Ringstr.;Ringstr.;16 MBit/s;true;50 MBit/s;10 MBit/s;50 MBit/s;true;MagentaZuhause M Hybrid (2);web,email,bank,music,dl-ul,game,sd,mltstr,hd;über Hybrid;WITH_HYBRID;https://padlock.link/mmhy2;https://padlock.link/mmh2sa;telekom_layer_magenta_m_hybrid2;ONE_YEAR_FREE;2,4 MBit/s;;399.99;no_information;1982;4;04209
2020-01-02 00:09:58.823166;/expose/114298624;['Unsere Wohnanlage liegt in der Leipziger Südvorstadt, in unmittelbarer Nähe zur\xa0HTWK. Der Stadtteil erstreckt sich unweit des Leipziger Zentrums bis nach Connewitz. Die öffentliche Verkehrsanbindung ist ausgezeichnet. Einkaufsmöglichkeiten, Schulen, Kindergärten und Arztpraxen sind im Stadtteil zahlreich vorhanden. Viel Natur gibt es mit dem Fockeberg, dem südlichen Auenwald mit dem Wildpark sowie kleineren Parks im Wohngebiet direkt vor Ihrer Haustür. Das Gebäude aus den 1950-er Jahren wurde in den letzten Monaten komplett saniert und modernisiert. Die\xa0Wohnungen sind ab November 2019 bezugsfertig. Kontakt: Sylvia Hinz, 0151-16120031', 'gute Verkehrsanbindung Bus, Bahn'];showqualicontactform;profile0;false;true;standard;Sachsen;Leipzig;Deutschland;04275;51,31509920610499;12,37564599412153;true;n;y;n;367.41;2;17773;n;no_information;001.17773;y;;;no_information;4;disabled;n;;n;92.97;central_heating;43;wohnung_miete;no_information;0,active;;n;64.71;3;n;;3;3;5;1000.00040803.00001030;negotiable;https://pictures.immobilienscout24.de/listings/5262e68c-8233-46ca-8214-4387494b0742-1342911121.jpg/ORIG/resize/118x118%3E/extent/118x118/format/jpg/quality/80;8;4.5;16.11;4.5;Sachsen;Leipzig;Südvorstadt;114298624;106.83;Richard-Lehmann-Str.;Richard-Lehmann-Str.;100 MBit/s;true;;;100 MBit/s;true;MagentaZuhause L;web,email,bank,music,dl-ul,game,sd,mltstr,hd,fast-ul-dl;über VDSL;REGULAR;https://padlock.link/ml;https://padlock.link/ioml;telekom_layer_magenta_l;ONE_YEAR_FREE;40 MBit/s;;567.21;no_information;1959;2;04275
2020-01-02 00:10:04.752298;/expose/114307247;['Die Wohnung befindet sich in einem 1997 saniertem Altbau, 1.Etage Mitte links', '- neu vorgerichtet\n- Böden Laminat\n- Bad Wandhoch gefliesst, innen liegend, Dusche\n- Küche Fliesenspiegel\n- zur Wohnung gehört ein Keller\n', 'Facettenreicher und idealer Standort zum Wohlfühlen - Die Umgebung des Objektes bietet Ihnen zahlreiche Möglichkeiten, um Ihre Geschäfte des täglichen Bedarfs (Post, Zeitschriftenladen, Bäcker, Apotheke, Einkaufsmarkt, etc.) zu erledigen. Die öffentlichen Verkehrsmittel (Bus und Straßenbahn) sind fußläufig zu erreichen. Die Nähe zu Parks, Restaurants und nicht zuletzt der zügigen Nahverkehrsanbindung in die Leipziger City macht diese Lage vielleicht zu Ihrer neuen Lebensumgebung.'];showqualicontactform;profile0;false;true;standard;Sachsen;Leipzig;Deutschland;04159;51,36170927662;12,368427332572603;false;n;n;n;290;1;16043090;y;modernized;002.01006064506;y;;energy_consumption;natural_gas_light;1;;n;;n;;central_heating;55/57;wohnung_miete;no_information;0,active;1998;n;29;1;n;;2;2;1;5440;negotiable;https://pictures.immobilienscout24.de/listings/e939c939-5d6d-4ec0-9260-3143f15ca9fd-1332914970.jpg/ORIG/resize/118x118%3E/extent/118x118/format/jpg/quality/80;5;4.02;14.2;4.02;Sachsen;Leipzig;Gohlis_Süd;114307247;65;"Georg-Schumann-Stra&szlig;e";Georg-Schumann-Straße;100 MBit/s;true;;;100 MBit/s;true;MagentaZuhause L;web,email,bank,music,dl-ul,game,sd,mltstr,hd,fast-ul-dl;über VDSL;REGULAR;https://padlock.link/ml;https://padlock.link/ioml;telekom_layer_magenta_l;ONE_YEAR_FREE;40 MBit/s;141;355;apartment;1915;1;04159
2020-01-02 00:10:05.661239;/expose/114307016;['Gelegen im Westen Leipzigs unweit der City - im Grünen.\nDie Wohnung 01 liegt im Hochparterre eines 1999 sanierten Gründerzeithauses in der Demmeringstraße 55. Der Innenhof ist geschlossen und begrünt, \nDas Holztreppenhaus blieb erhalten, ebenso die Wohnungseingangstüren und Haustür.\nFenster Straßenseitig Holzfenster mit Isolierverglasung und Sprossen. Fenster Hofseitig in Kunststoffausführung.\n', 'Die Wohnung hat einen praktischen Grundriss\n1 Zimmer, Bad innen liegend mit Wanne, Kellerabteil.\nFußbodenbeläge: Laminat, Küche- heller Wischbelag und Bad- helle Bodenfliesen.\nGegensprechanlage, elektrische Türöffner.\nNeue Innentüren mit Umfassungszarge in Esche furniert.\nWände weiß Raufasertapete.\nPlattenheizkörper\n', 'Altlindenau: Westlich vom Zentrum im Grünen\nIm Westen Leipzigs, jenseits des Elsterbeckens, befindet sich der Stadtteil Altlindenau. Das Viertel ist mit einem historischen Ortskern ausgestattet und liegt sowohl zentrumsnah wie auch mitten im Grünen.\nAuf direktem Weg ist das Viertel mit der Innenstadt verbunden: die Haltestelle Angerbrücke, die man über die Zeppelinbrücke erreicht, ist Anlaufpunkt für die Tramlinien 7, 8 und 15 sowie die Buslinien 130 und 131. Tramlinie 3 fährt ebenfalls über die Angerbrücke und verbindet das Viertel mit dem Leipziger Süden und seinem Nordosten.\nDas tägliche Leben in Altlindenau entfaltet sich rund um den Lindenauer Markt, wo sich Gastronomie und Handel, Kunst, Kultur und Freizeit treffen und ein lebendiges Straßenbild zeichnen. Nur wenige Fußminuten vom Markt entfernt laden die Musikalische Komödie (geboten werden hauptsächlich Operetten und Musicals), das Theater der Jungen Welt (von und mit Kindern und Jugendlichen) und das LOFFT (Zentrum für freie darstellende Kunst) zur Abendgestaltung ein. Links vom Markt befinden sich übrigens die um 1900 erbauten Meyerschen Häuser, die das gründerzeitliche Angesicht der Stadt Leipzig durchbrechen und mit barock anmutenden Ecktürmen überraschen.\nLindenau ist im Kommen, seine attraktive Lage mit Nähe zur Innenstadt und doch eigenem Charakter und Flair, seine unmittelbare Nachbarschaft zum Auensee sowie zum Auenwald machen ihn zu einem einzigartigen Leipziger Stadtteil, das seinen Anwohnern und Besuchern eine Menge zu bieten hat und noch viele Möglichkeiten verspricht.\n'];showqualicontactform;profile0;false;true;standard;Sachsen;Leipzig;Deutschland;04177;51,33592293628433;12,326477674907855;false;n;n;n;285;1;16043090;y;no_information;002.01006064506;y;;energy_consumption;gas;0;;y;;n;;central_heating;55;wohnung_miete;no_information;0,active;;n;38;1;n;;1;1;0;5439;negotiable;https://pictures.immobilienscout24.de/listings/3e4dd084-7316-40c5-83a8-f4909c37bce7-1332914828.jpg/ORIG/resize/118x118%3E/extent/118x118/format/jpg/quality/80;8;4.49;15.09;4.49;Sachsen;Leipzig;Altlindenau;114307016;85;"Demmeringstra&szlig;e";Demmeringstraße;100 MBit/s;true;;;100 MBit/s;true;MagentaZuhause L;web,email,bank,music,dl-ul,game,sd,mltstr,hd,fast-ul-dl;über VDSL;REGULAR;https://padlock.link/ml;https://padlock.link/ioml;telekom_layer_magenta_l;ONE_YEAR_FREE;40 MBit/s;114;370;raised_ground_floor;1914;1;04177
2020-01-02 00:10:11.901202;/expose/114305421;['Das luxuriös sanierte Gründerzeithaus befindet sich im sehr beliebten Stadtteil  Gohlis-Mitte. Die Wohnung verfügt über einen großen Wohnraum mit Erker, eine Einbauküche und Holzdielung. Ein großer liebevoll gepflegter Garten steht den Mietern zur Entspannung zur Verfügung. Durch die  optimale Lage der Wohnung ist man in wenigen Minuten in der Innenstadt, im Rosenthal und im Zoo. Einkaufsmöglichkeiten und die Anbindung an öffentlichen Nahverkehr sind hervorragend.\nDa die Wohnung derzeit bewohnt ist, handelt es sich hierbei um Referenzbilder.', 'Personenaufzug, Dielenboden, Zentralheizung, Einbauküche, derzeitige Nutzung - frei werdend, Dachgeschoss, Fliesen, Hausmeisterservice, Hausreinigung, Kelleranteil, Zustand Altbau, Zustand gehoben, Bad mit Dusche', 'WE 13, DG mitte', 'www.kks-leipzig.de'];showqualicontactform;profile0;false;true;standard;Sachsen;Leipzig;Deutschland;04157;51,36738212694774;12,368745084389449;false;n;n;n;345;2;2303;n;no_information;001.2303;n;;energy_consumption;gas;;;n;;y;;central_heating;82, DG mitte;wohnung_miete;no_information;0,active;;y;44.54;2;n;;1;1;;16219;no_information;https://pictures.immobilienscout24.de/listings/e740fac5-d0e8-4417-a1d5-03ca1c7fc394-1331310571.jpg/ORIG/resize/118x118%3E/extent/118x118/format/jpg/quality/80;8;4.07;14.7;4.07;Sachsen;Leipzig;Gohlis_Mitte;114305421;100;"Coppistra&szlig;e";Coppistraße;;;;;;;;;;;;;;;;136.8;445;no_information;1910;1;04157
2020-01-02 00:10:12.739486;/expose/114298637;['Vollsanierte, sehr ruhig gelegene 3-Raum-Wohnung im architektonisch einzigartigem Nibelungenring im grünen Süden Leipzigs. Auf kurzem Weg erreichen Sie aufgrund der guten Verkehrsanbindungen oder zu Fuß die Naherholungsgebiete Silbersee, agra und Wildpark. Schulen, Kindergärten und zahlreiche Einkaufsmöglichkeiten finden Sie außerdem im angrenzenden Wohngebiet.', 'gute Verkehrsanbindung Bus, Bahn und S-Bahn,gute Einkaufsmöglichkeiten'];showqualicontactform;profile0;false;true;standard;Sachsen;Leipzig;Deutschland;04279;51,29523858003389;12,394775996618327;true;n;y;n;458;3;17773;n;refurbished;001.17773;y;;;no_information;1;disabled;n;;n;70;central_heating;59;wohnung_miete;no_information;0,active;;n;62.83;3;n;;3;3;3;1000.00043609.00001039;negotiable;https://pictures.immobilienscout24.de/listings/c7ada53f-3870-476e-aa4b-916dfef141d3-1342911398.jpg/ORIG/resize/118x118%3E/extent/118x118/format/jpg/quality/80;2;2.5;9.06;2.5;Sachsen;Leipzig;Lößnig;114298637;86;Nibelungenring;Nibelungenring;100 MBit/s;true;;;100 MBit/s;true;MagentaZuhause L;web,email,bank,music,dl-ul,game,sd,mltstr,hd,fast-ul-dl;über VDSL;REGULAR;https://padlock.link/ml;https://padlock.link/ioml;telekom_layer_magenta_l;ONE_YEAR_FREE;40 MBit/s;;614;no_information;1930;1;04279
2020-01-02 00:10:18.638993;/expose/114299451;['- Tageslichtbad mit Dusche\n- WG geeignet\n- Garagenanmietung möglich\n- Design Boden\n- Wohnung wird komplett neu renoviert\n- Keller vorhanden\n', 'Stötteritz ist ein zentrumsnaher Stadtteil mit viel Grün und guten Verkehrsanbindungen. Sämtliche Bedürfnisse des täglichen Bedarfes kann man hier erfüllt bekommen. Schulen, Kindergärten, Straßenbahnhaltestellen - alles ist in wenigen Minuten zu Fuß erreicht. Das Stötteritzer Wäldchen mit Freibad lädt zum Joggen oder Hund ausführen ein.'];showqualicontactform;profile0;false;true;standard;Sachsen;Leipzig;Deutschland;04299;51,31883285031517;12,415499347654125;false;n;y;n;514;4;721207;y;no_information;001.721207;n;E;energy_consumption;gas;0;;n;;n;62;central_heating;45;wohnung_miete;no_information;0,active;;n;64;3;n;;3;3;;23017-1 (1/2008);no_information;https://pictures.immobilienscout24.de/listings/433d1ad7-5522-475b-8ea4-513831890b42-1331221522.jpg/ORIG/resize/118x118%3E/extent/118x118/format/jpg/quality/80;15;4.13;14.64;4.13;Sachsen;Leipzig;Stötteritz;114299451;62;"Breslauer Stra&szlig;e";Breslauer_Straße;100 MBit/s;true;;;100 MBit/s;true;MagentaZuhause L;web,email,bank,music,dl-ul,game,sd,mltstr,hd,fast-ul-dl;über VDSL;REGULAR;https://padlock.link/ml;https://padlock.link/ioml;telekom_layer_magenta_l;ONE_YEAR_FREE;40 MBit/s;142.03;638;ground_floor;1936;1;04299
2020-01-02 00:10:19.542334;/expose/114306525;['Die moderne 4-Zimmer-Wohnung im 1. Obergeschoss befindet sich in der GutsMuthsstr. 45 in Leipzig im Stadtteil Lindenau und ist über die Treppe oder den Personenaufzug zu erreichen.\nHier präsentiert sich eine funktional geschnittene Wohnung mit Parkett, Fußbodenheizung, Designbädern, einer großen Wohnküche und Balkon. Das Gäste-Bad ist innenliegend und mit einer Dusche ausgestattet. Das größere Bad ist ein Tageslichtbad, welches mit einer Badewanne und einem Doppelwaschtisch ausgestattet ist.\nDie 120 Quadratmeter der Wohnung bieten einige Möglichkeiten zur individuellen Gestaltung.\nIn der Wohnung befindet sich noch ein kleiner Abstellraum. Des Weiteren gibt es ein separates Kellerabteil, welches dem Mieter kostenfrei zur Nutzung zur Verfügung steht.', '- helle Zimmer\n- großzügig geschnittene Wohnküche mit Parkettboden\n- zwei moderne Bäder\n- Balkon zum Innenhof\n- Abstellkammer in Wohnung\n- Innenwände glatt gespachtelt und weiß gestrichen\n- Fenster mit Dreifachverglasung\n- Parkettfußboden mit Fußbodenheizung in den Wohnräumen und im Flur\n- separates Kellerabteil, welches dem Mieter kostenfrei zur Nutzung zur Verfügung gestellt wird', 'Lindenau befindet sich im Südwesten von Leipzig und ist eine bevorzugt grüne Wohnlage. Die GutsMuthsstraße befindet sich in der Nähe zum Henriettenpark. Die Lage ist optimal: verkehrsgünstig und dennoch in einer ruhigen Nebenstraße. Die Infrastruktur ist gut ausgebaut. Es gibt vielfältige Einkaufsmöglichkeiten, Gastronomie und Freizeitmöglichkeiten. Das Zentrum ist nur unweit entfernt und gut mit dem Auto oder Nahverkehr zu erreichen.\nBanken, Post, Apotheke, Ärzte, Kindergärten und Schulen sind fußläufig zu erreichen.', 'Die Wohnung ist derzeit noch bewohnt. Besichtigungen sind nach Absprache mit dem derzeitigene Mieter möglich.\n\nDie Bilder sind Beispielbilder aus dem 3. Obergeschoss des Hauses.\n\nAlle Angaben in diesem Exposé wurden nach bestem Wissen und Gewissen des Eigentümers gemacht. Die Hausverwaltung Regina Wenzel kann keine Gewährleistung für die Richtigkeit und Vollständigkeit der Angaben übernehmen. Fotos und Grafiken unterliegen dem Copyright der Hausverwaltung Regina Wenzel.'];showqualicontactform;profile0;false;true;standard;Sachsen;Leipzig;Deutschland;04177;51,3316997137417;12,331848995998287;false;n;y;n;1050;7;16569101;n;mint_condition;001.16165485;y;B;energy_required;gas;1;;n;;n;;central_heating;45;wohnung_miete;sophisticated;0,active;;y;120;5;n;;4;4;4;114306525;negotiable;https://pictures.immobilienscout24.de/listings/35910894-55c0-405d-ac2f-722dfc0000b4-1331829061.jpg/ORIG/resize/118x118%3E/extent/118x118/format/jpg/quality/80;18;5.13;14.16;5.13;Sachsen;Leipzig;Lindenau;114306525;240;GutsMuthsstr.;GutsMuthsstr.;100 MBit/s;true;;;100 MBit/s;true;MagentaZuhause L;web,email,bank,music,dl-ul,game,sd,mltstr,hd,fast-ul-dl;über VDSL;REGULAR;https://padlock.link/ml;https://padlock.link/ioml;telekom_layer_magenta_l;ONE_YEAR_FREE;40 MBit/s;68.1;1290;apartment;1895;1;04177
2020-01-02 00:10:26.227128;/expose/114298593;['In Paunsdorf ist alles ganz nah. Wohnen, Shopping, Erholung, Entspannung, Freizeit - all das findet man in wenigen hundert Metern Entfernung. So sorgen Paunsdorf-Center und Sachsen-Therme für den nötigen Shopping- und Freizeitspaß. An den Stadtteil grenzt der Grüne Bogen und das Paunsdorfer Wäldchen. Das Waldgebiet und der Landschaftspark werten den Stadtteil auf und machen das Wohnen hier besonders angenehm. Platz zum Spielen mit den Kindern oder zum Erholen garantieren Ihnen unsere großen, begrünten Innenhöfe zwischen den Quartieren. Zur B6, B87 und A14 ist es nur einen Katzensprung und Sie gelangen schnell ins schöne Umland.', 'gute Verkehrsanbindung Bahn,gute Einkaufsmöglichkeiten'];showqualicontactform;profile0;false;true;standard;Sachsen;Leipzig;Deutschland;04329;51,3524000299894;12,457676326946101;true;n;y;n;287.45;1;17773;n;no_information;001.17773;y;;;no_information;0;disabled;n;;n;74.99;central_heating;4;wohnung_miete;no_information;0,active;;n;62.49;3;n;;3;3;6;1000.00024202.00001013;negotiable;https://pictures.immobilienscout24.de/listings/c58f58f5-31ff-4924-b1e1-6d6e157cab5e-1342910454.jpg/ORIG/resize/118x118%3E/extent/118x118/format/jpg/quality/80;2;3.42;12.76;3.42;Sachsen;Leipzig;Paunsdorf;114298593;81.24;"G&uuml;nselstr.";Günselstr.;100 MBit/s;true;;;100 MBit/s;true;MagentaZuhause L;web,email,bank,music,dl-ul,game,sd,mltstr,hd,fast-ul-dl;über VDSL;REGULAR;https://padlock.link/ml;https://padlock.link/ioml;telekom_layer_magenta_l;ONE_YEAR_FREE;40 MBit/s;;443.68;ground_floor;1989;4;04329
2020-01-02 00:10:32.184124;/expose/114288398;['Alte Straße 53 WE 287\r\n\r\nDie Wohnung kann  nach Absprache mit dem Vormieter angemietet werden!\r\n\r\nDie sehr gepflegte Neubau-Wohnanlage verfügt über einen idyllischen Innenhof. Ein Trockenplatz sowie Abstellmöglichkeiten für die kleinen und großen Fahrräder sind im Gelände vorhanden. Ein Keller gehört zu jeder Wohnung. Die Wohnung befindet sich im 1. Obergeschoss.\r\nOptional kann ein Tiefgaragenstellplatz angemietet werden. Für die Treppenhausreinigung wird wöchentlich gesorgt.\r\nKabelanbieter ist Kabel Deutschland/Vodafone.', 'von Lewinski Immobilienvertriebs-GmbH\r\nReichsstraße 2 - 04109 Leipzig\r\nAnsprechpartnerin: Frau Simone Neidhold\r\ns.neidhold@von-lewinski.de\r\nTel. (0341) 30 38 30\r\n\r\nDie bisher als Büro genutzte gemütliche 2-Zimmerwohnung verfügt über Flur, Küche, Bad, Schlafzimmer sowie ein großes Wohnzimmer mit Essbereich. Die Wohnräume verfügen über bodentiefe Fenster und sind mit Laminat ausgestattet. Das peppig geschnittene Schlafzimmer bietet ausreichend Platz für Bett und Schrank. Die funktionale Küche verfügt über eine Einbauküche, die günstig vom Mieter übernommen werden kann. Das Tageslichtbadbad ist gefliest und mit einer Wanne ausgestattet. Hier befindet sich auch der Waschmaschinenanschluss.', 'Die Alte Straße liegt im Leipziger Westen zwischen Schleußig und Plagwitz. Sie ist eine ruhige Seitenstraße zwischen Erich-Zeigner Allee und Nonnenstraße und direkt am Karl-Heine Kanal gelegen. Direkte Radwege am Kanal bis zur Innenstadt machen diesen Stadtteil besonders attraktiv. Villenviertel, die großen Gründerzeithäuser und die Lage nahe der Innenstadt, umringt von Wald, machen diesen Stadtteil zu einer begehrenswerten Wohngegend. Durch die Nähe zum Stadtzentrum, das in etwa zehn Minuten zu Fuß durch den Clara-Zetkin-Park erreichbar ist, und das sich zunehmend entwickelnde kulturelle Leben, wird dieser Stadtteil besonders von Studenten und jungen Familien geschätzt. Kindergärten, Schulen, Einkaufsmöglichkeiten und öffentliche Verkehrsmittel ( Linien 14,1,2) sind in kurzer Zeit zu erreichen.', 'Besichtigungstermine müssen mit dem jetzigen Mieter abgestimmt werden!\r\n\r\nEs wird eine Mindestmietdauer von 12 Monaten vereinbart!\r\n\r\nEine Anmietung ist nur mit einer aktuellen SCHUFA Auskunft ohne negative Einträge möglich!\r\n\r\nWir bitten um Ihr Verständnis, dass wir nur Anfragen mit vollständiger Nennung des Namens, der Anschrift und der Telefonnummer beantworten können. Gern stehen wir Ihnen auch für eine persönliche Beratung zur Verfügung. Wir freuen uns auf Ihren Anruf! \r\n\r\n### Weitere Angebote finden Sie unter www.von-Lewinski.de oder rufen Sie uns einfach an 0341/303830 ###\r\n\r\nAlle Angaben beruhen auf Informationen Dritter und sind ohne unser Obligo.'];showqualicontactform;profile0;false;true;standard;Sachsen;Leipzig;Deutschland;04229;51,3281230791565;12,339146385230686;false;n;n;n;423;3;36926;y;well_kept;001.36926;y;;energy_consumption;district_heating;1;disabled;y;211;n;;central_heating;53;wohnung_miete;normal;0,active;;y;55.61;2;n;;2;2;4;34068;negotiable;https://pictures.immobilienscout24.de/listings/7ffdbf1a-2857-4c84-9f7b-de56e5456d21-1340142911.jpg/ORIG/resize/118x118%3E/extent/118x118/format/jpg/quality/80;16;4.56;15.1;4.56;Sachsen;Leipzig;Plagwitz;114288398;120;"Alte Stra&szlig;e";Alte_Straße;100 MBit/s;true;;;100 MBit/s;true;MagentaZuhause L;web,email,bank,music,dl-ul,game,sd,mltstr,hd,fast-ul-dl;über VDSL;REGULAR;https://padlock.link/ml;https://padlock.link/ioml;telekom_layer_magenta_l;ONE_YEAR_FREE;40 MBit/s;101;543;apartment;1996;5;04229
2020-01-02 00:10:33.058361;/expose/114298578;['Volkmarsdorf liegt östlich vom Stadtzentrum und ist ein Stadtteil mit viel internationalem Flair, kulturellen Treffpunkten, aktiven Bürgervereinen und weitläufigen Parkanlagen. Mit dem Elsa-Park, dem neu gestalteten Freizeitpark RABET bietet Volkmarsdorf viel Platz für Sport, Spiel und Erholung. Unser Wohnungsangebot in Volkmarsdorf ist vielfältig. Ob Single-Wohnung, WG oder Familiendomizil, hier\xa0werden Sie fündig.', 'gute Verkehrsanbindung Bus, Bahn,gute Einkaufsmöglichkeiten'];showqualicontactform;profile0;false;true;standard;Sachsen;Leipzig;Deutschland;04315;51,3443787485281;12,409315660543983;true;n;n;n;331.2;2;17773;n;no_information;001.17773;y;;;no_information;2;disabled;n;;n;86.98;central_heating;60;wohnung_miete;no_information;0,active;;n;66.91;3;n;;3;3;6;1000.00021402.00001003;negotiable;https://pictures.immobilienscout24.de/listings/3d177402-4eef-4d1a-add3-5138b8782277-1342910372.jpg/ORIG/resize/118x118%3E/extent/118x118/format/jpg/quality/80;8;4.6;16.5;4.6;Sachsen;Leipzig;Volkmarsdorf;114298578;66.91;Konradstr.;Konradstr.;100 MBit/s;true;;;100 MBit/s;true;MagentaZuhause L;web,email,bank,music,dl-ul,game,sd,mltstr,hd,fast-ul-dl;über VDSL;REGULAR;https://padlock.link/ml;https://padlock.link/ioml;telekom_layer_magenta_l;ONE_YEAR_FREE;40 MBit/s;;485.09;no_information;1990;4;04315
