2020-01-01 22:02:06.008643;/expose/112535686;"[""Diese attraktive, vollständig renovierte Wohnung geht über zwei Etagen im DG und kann ab sofort bezogen werden. Das Objekt verfügt über ein Atrium mit ca. 5 m Deckenhöhe - hier genießen Sie echtes Raumgefühl!\n\nDa hier drei Zimmer komplett abgeschlossen sind, ist das Objekt für eine 3er WG gut geeignet. Größere WG's oder Familien mit mit mehr als 2 Kindern müssten sich ansonsten arrangieren, denn die großzügigen Atrium- und Galeriebereiche sind offen gestaltet. Für eine 3er-WG, ein Paar oder eine Familie mit bis zu 2 Kindern perfekt geeignet!\n\nDurch die erst kürzlich abgeschlossene Modernisierung (2019) wurde der Wohnwert dieses Individual-Objekts zusätzlich gesteigert. \n\nZur Verfügung steht Ihnen eine komplette Einbauküche inkl. Geschirrspüler und Mikrowelle. Das freundliche und moderne Bad ist weiß gefliest, die Wohnräume sowie alle Verbindungsräume sind mit hellem Laminatboden und neuen, herrlichen stilvoll hohen weißen Altbau-Sockelleisten ausgestattet. Alle Wände und die hohen Decken in frischem Weiß neu gestrichen, auch die wunderschönen Holztüren sind aufwändig restauriert. Zu Ihrer Sicherheit trägt eine neue Video-Türanlage bei."", 'Schön helle 5 Zimmer Wohnung mit Atrium und Galerie, Blick ins Grüne, separate Küche, EBK inklusive, Bad mit Fenster, Abstellkammer, alles pikobello renoviert, Erstbezug!\n\nGenießen Sie echtes Raumgefühl in diesem ""Haus im Haus"" über zwei Etagen mit innen liegender, eigener Treppe. Die riesigen Fensterflächen lassen das Atrium im Licht erstrahlen und bieten einen herrlichen Blick ins Grüne. Hier werden Sie sich täglich erholen und entspannen! Eine große, gemütliche Sitzecke mit speziell angefertigten Massivholzmöbeln ist bereits installiert und kann von Ihnen genutzt werden. Selbst die moderne Grundausleuchtung ist mittels Einbaustrahlern und installierten Lampen bereits gegeben.\n\nIn den Schlafbereichen stehen ebenfalls auf Maß gefertigte Schrank- und Regalflächen unter den Schrägen zur Verfügung, um die Flächen optimal als Stauraum ausnutzen zu können.\n\nHier werden Sie sich wohl fühlen, die Wohnung ist fertig zum Einzug, hier müssen nur noch Möbel mitgebracht werden, aber selbst diese sind ja teilweise schon vorhanden. Herzlich willkommen!', 'Die Wohnung liegt in der Bautzmannstr. 1 in Leipzig Sellerhausen Stünz, also nur 5 min von der City entfernt. Trotzdem genießen Sie nach hinten\nheraus einen herrlichen Blick ins Grüne. Direkt gegenüber gibt es einen schön angelegten Park mit gastronomischem Angebot für die Freizeitgestaltung direkt vor der Haustür.\n\nMit den Straßenbahnlinien 7 und 8 erreichen Sie schnell die Innenstadt. Die Linien 8, 13 sowie die S-Bahn sind ebenfalls um die Ecke. Der Zoo liegt nur 10 Minuten entfernt, das Völkerschlachtdenkmal sowie die Alte Messe 5 Minuten, Hauptbahnhof, Innenstadt und Universität 8 Minuten, zur Neuen Messe 15 Minuten und das Zentralstadion / Arena erreichen Sie in 10 Minuten. \nSehr gute Einkaufsmöglichkeiten gibt es in der Straße gegenüber, auch die Innenstadt sowie das nahe gelegenen Paunsdorf Center (überdachtes Einkaufscenter mit kostenlosen Parkplätzen) sind schnell zu erreichen. Dort nebenan ist auch die Sachsentherme und ein Sportpark. Bis zur Autobahn A14 sind es nur 15 Minuten.', 'Bitte nehmen Sie zunächst eine Außenbesichtigung der Lage vor und entscheiden, ob der Standort für Sie geeignet ist.  Wir bitten Sie, dann  nur den Kontaktbogen auszufüllen, wir melden uns danach\nkurzfristig bei Ihnen, um mit Ihnen einen Besichtigungstermin abzustimmen. Vielen Dank für Ihre Bemühungen!\n\n(Hundehaltung ist in dem Haus leider nicht möglich.)  ']";showqualicontactform;profile0;false;;true;top;Sachsen;Leipzig;Deutschland;04315;51,3437131910627;12,416906146581141;false;n;n;n;890;6;17441101;n;first_time_use_after_refurbishment;009.70e5d916-eebe-4ac0-904b-a83d20b2478b;y;;;gas;5;;n;;y;;gas_heating;1;wohnung_miete;sophisticated;0,active;2019;n;105;5;n;;5;5;5;2fa993cc-4f9a-4c3d-b181-20c982f00af5;negotiable;https://pictures.immobilienscout24.de/listings/6ac9e1ff-fb9a-4ba2-a87a-a7a71fe63cda-1307342941.jpg/ORIG/resize/118x118%3E/extent/118x118/format/jpg/quality/80;25;4.6;16.5;4.6;Sachsen;Leipzig;Volkmarsdorf;112535686;210;Bautzmannstr.;Bautzmannstr.;100 MBit/s;true;;;100 MBit/s;true;MagentaZuhause L;web,email,bank,music,dl-ul,game,sd,mltstr,hd,fast-ul-dl;über VDSL;REGULAR;https://padlock.link/ml;https://padlock.link/ioml;telekom_layer_magenta_l;ONE_YEAR_FREE;40 MBit/s;;1100;roof_storey;1890;1;04315
2020-01-01 22:02:06.916904;/expose/113144588;['Ab Januar/Februar kann diese freundliche Erdgeschosswohnung bezogen werden. Es handelt sich hierbei um einen Erstbezug nach Sanierung. \nDabei wurden unter anderem alle Wände mit Rauputz versehen, heller Laminatboden verlegt sowie eine moderne, flache dusche eingebaut.\nZu dem Objekt zählen zwei schöne Zimmer. Ein aktueller Energieausweis liegt vor. Beachten Sie außerdem, dass es sich hierbei um ein barrierefreies Objekt handelt. Besonders hervorzuheben, dass es eine Terasse gibt. Zur Verfügung steht Ihnen außerdem ein Stellplatz in der Tiefgarage.\n\n\nP.S Auf der Bilder sind Möbel zu sehen, die aus Karton besteht. Die Wohnung wird LEER vermietet!!!', 'heller Laminatboden'];showqualicontactform;profile0;false;;true;top;Sachsen;Leipzig;Deutschland;04207;51,3011281910159;12,261208469544496;false;n;y;y;398;2;18427540;y;first_time_use_after_refurbishment;009.57d2e9be-1f12-4009-98be-8cd6256d8ce5;y;;;no_information;0;;y;;n;;;23;wohnung_miete;normal;0,active;;n;51;2;n;1;2;2;3;e7f2072f-5a2b-4ee3-b2a1-ac548f0b1f26;negotiable;https://pictures.immobilienscout24.de/listings/993dee9f-6014-48d1-8bbe-1b72c1f61584-1314587314.jpg/ORIG/resize/118x118%3E/extent/118x118/format/jpg/quality/80;5;4.06;13.29;4.06;Sachsen;Leipzig;Lausen_Grünau;113144588;95;"Lausener Stra&szlig;e";Lausener_Straße;100 MBit/s;true;;;100 MBit/s;true;MagentaZuhause L;web,email,bank,music,dl-ul,game,sd,mltstr,hd,fast-ul-dl;über VDSL;REGULAR;https://padlock.link/ml;https://padlock.link/ioml;telekom_layer_magenta_l;ONE_YEAR_FREE;40 MBit/s;;493;ground_floor;;;04207
2020-01-01 22:02:12.889672;/expose/110952665;['Wohnen über den Dächern Leipzigs: Großzügige Maisonettewohnung auf zwei Etagen (5. und 6. OG), verbunden durch eine Wendeltreppe. Mit sonniger Dachterrasse, Balkon und größtem Komfort.', 'Gehobene Ausstattung inkl. Parkettboden, im Bad Fußbodenheizung. Videosprechanlage. Tiefgaragenstellplatz vorhanden, Anmietung möglich', 'Das Grundstück Klostergasse 7–9 liegt in einem verkehrsberuhigten, für den allgemeinen Straßenverkehr gesperrten Bereich. In der Klostergasse wie auch der unmittelbaren Umgebung befindet sich eine Vielzahl von Restaurants, die im Sommer auch zum Draußensitzen einladen.\r\nMitten im Zentrum Leipzigs gelegen, in unmittelbarer Nähe der berühmten Thomaskirche und unweit des Museums der bildenden Künste und der Universität am Augustusplatz, ist das Objekt fußläufig erreichbar von der S-Bahn Leipzig (2 min) oder direkt vom Hauptbahnhof (15 min). Das Parkhaus im Innenhof zwischen Klostergasse 7/9, Dittrichring 14 und Dittrichring 16 bietet 40 Stellplätze, weitere Parkplätze finden sich im Parkhaus „Marktgalerie“, direkt vor der Haustür (2 min Fußweg). Die Fußgängerzone in der Leipziger Innenstadt mit ihren zahlreichen Einkaufsmöglichkeiten ist nur einen Steinwurf entfernt.', 'So individuell und besonders alle Objekte der Trifugium Immobilien sind, zwei Dinge sind ihnen allen gemein: ihre erstklassige Lage und die stets gehobene und überdurchschnittliche Ausstattung.\r\n\r\nDie Objekte der Trifugium Immobilien werden verwaltet und betreut von:\r\n\r\nHAUSVERWALTUNG BOROWITZA\r\nTel. 0341-9003650\r\nmail@trifugium-immobilien.de\r\n\r\nSchreiben Sie uns oder rufen Sie an, wenn Sie Fragen zum Objekt haben oder einen Besichtigungstermin wünschen.'];showqualicontactform;profile0;false;;true;top;Sachsen;Leipzig;Deutschland;04109;51,34064654207407;12,372925264473619;false;n;y;n;1971;8;16584487;y;no_information;001.16176162;y;;energy_consumption;district_heating;5;;n;1;n;;district_heating;7-9;wohnung_miete;sophisticated;0,active;2009;y;219;7;n;1;6;5;6;WE 15;no_information;https://pictures.immobilienscout24.de/listings/7bcf5f0c-da25-4fa7-977e-9392ce1976bd-1287925131.jpg/ORIG/resize/118x118%3E/extent/118x118/format/jpg/quality/80;41;5.69;16.75;5.69;Sachsen;Leipzig;Zentrum;110952665;701;Klostergasse;Klostergasse;;;;;;false;;;;;;;;;;94.7;2672;maisonette;2009;7;04109
2020-01-01 22:02:13.817677;/expose/114838635;['In dieser hübschen 3-Zimmer Wohnung mit knapp 73qm in bester Wohnlage werden Sie sich sofort wohl fühlen, egal ob als Single, Paar oder kleine Familie.\n\nGohlis gilt als besonders lebenswerter und exklusiver Wohnstandort im Leipziger Norden, geprägt von herausragend sanierten Altbauten und modernen Neubaukonzepten, eingefasst in grüne Parks und eine gute Infrastruktur.\n\n\nDie Wohnung bietet Ihnen zwei nahezu gleich große Haupträume und ein praktisch geschnittenes Schlafzimmer. Das helle Parkett und die angenehme Raumhöhe von etwa 3,25m (in den großen Räumen mit dezentem Stuck versehen) erhöhen den Wohnkomfort, eine Einbauküche mit Kühlschrank, Geschirrspüler, Herd + Cerankochfeld und Blanco Granitspüle steht Ihnen bereits zur Verfügung. Im Badezimmer lädt eine große Eckbadewanne zum Entspannen ein.\n\nDer große Balkon mit Holzboden lädt ein zum Verweilen, der Blick schweift in den grünen Garten, der in den sonnigeren Monaten gern von der sehr freundlichen Hausgemeinschaft genutzt wird. Ein trockener, ausreichend großer Keller gehört ebenfalls zur Wohnung dazu.\n\n\nDirekt in unmittelbarer Nähe finden sich verschiedenste Einkaufsmöglichkeiten (Konsum, Kaufland, Rewe, ein kleiner Bio-Kaufmannsladen).\nGenießen Sie die ruhige Lage trotz perfekter Anbindung an Straßenbahn (Linien 4, 10, 11, 12) und Zugverkehr (in 3 Minuten zum Hauptbahnhof).\n\nSchnell erreichen Sie den beliebten Leipziger Zoo, das Rosental, den Arthur-Brettschneider-Park, das Gohliser Schlösschen, beliebte Restaurants, Gastwirtschaften und den Leipziger Flughafen über die Autobahn A14.\n\nUnweit der Wohnung befinden sich mehrere Kindertagesstätten, Grundschulen sowie weiterführende Schulen.\n\n\nFür die Vereinbarung eines Besichtigungstermins oder zur Klärung weiterer Details stehen wir Ihnen gern auch telefonisch zur Verfügung.', 'Echtholzparkett, Einbauküche, Eckbadewanne, Stuck, Keller, Gemeinschaftsgarten.', 'Ruhige Seitenstraße, Nähe S-Bahnhof Gohlis und Coppiplatz.'];showqualicontactform;profile0;false;;true;top;Sachsen;Leipzig;Deutschland;04157;51,3654788041393;12,373986629170108;false;n;y;n;700;5;18528041;y;well_kept;009.4f8720d3-9b5e-4189-9545-ea10c1052a5f;y;;;district_heating;1;;y;;y;;district_heating;9a;wohnung_miete;sophisticated;0,active;2009;y;72.9;3;n;;3;3;4;cb46b2fd-7b94-4389-89fd-2a78d2e36b97;negotiable;https://pictures.immobilienscout24.de/listings/60399fdf-fb4f-4ac1-bee0-c4d3cf997dad-1339183619.jpg/ORIG/resize/118x118%3E/extent/118x118/format/jpg/quality/80;22;4.07;14.7;4.07;Sachsen;Leipzig;Gohlis_Mitte;114838635;181;"Etkar-Andr&eacute;-Stra&szlig;e";Etkar-André-Straße;;;;;;;;;;;;;;;;;881;raised_ground_floor;;;04157
2020-01-01 22:02:19.704850;/expose/115077922;"['Wir suchen nette Mieter für eine der schönsten Dachgeschoßwohnungen im Leipziger Norden, mit ca. 115 qm und 4 Räumen. Die Wohnung ist fast fertig und noch in Sanierung, kann ab Juni oder Juli bezogen werden und befindet sich im DG eines wunderschönen Mehrfamilienhaus, nahe des  Auenwaldes, mit Garten und Blick über das Naturschutzgebiet Auenwald. In der Wohnung verbinden sich alte und neue Wohnkultur mit Charm, Geschmack und Stil. Es wurden nur die hochwertigsten Materialien verbaut! Im Haus gibt es nur 3 Wohnungen,  pro Etage gibt es eine Wohnung! Nutzen Sie die sich hier bietende Chance und sehen Sie sich das Haus und die wundervolle Wohnung schnellstens an. Lange wird sie nicht im Angebot sein. Die Wohnung ist bestens ausgestattet: \n\n1. ca. 50 qm Wohnzimmer/Küche zur Südseite mit Auenwaldblick, offener Küche, Kamninofenanschluß und toller Lodiga + Gartenmitnutzung und ohne Stolperschwelle/n!\n2. Großzügiges ca. 12qm Tageslicht-Bad mit italienischen Fliesen, ebenerdiger Dusche und separater Wanne; in edler Ausstattung\n3. Neues Eichenparkett-Fußboden in den 4 Wohnräumen, edle italienische Fliesen in Flur und Bad\n4. Fußbodenheizung in allen Räumen\n5. Neue schicke geschlossene Türen und neue Ganzglastüren für Licht und Ambiente \n6. Telefon, Kabelanschluss und Rauchmelder in jedem Zimmer ....\n7. Niedrige Nebenkosten durch Warmwasser und Heizungunterstützung durch vollständige Dämmung des Hauses\n8. Rauchmelder, Telefon und Fernsehen in jedem Raum!\n\nDie Wohnung bzw. das Haus wird mit einer effizienten Gasheizung beheizt und jede Wohnung verfügt über einen Kaminofenanschluß. Solide gebaut und energetisch kaum zu toppen...im Vergleich mit anderen alten Mahrfamilienhäusern. ', 'Eichchenparkett, Fußbodenheizung, Kaminofenanschluß, Waschhaus, Bad mit begehbarer Dusche und Fenster, Downlights in Bad und Küche, kleiner extra Abstellraum in der Wohnung für Lebensmittel oder Stabusauger etc..., Lodgiatür ist eine Schiebetür (kein Platzverlust), 3 fach verglaste Fenster, eigener Keller/Fahrradschuppen .... ', 'Das Haus verfügt über einen großen, liebevoll gestalteten und gepflegten Hof und Garten. Der Blick südseitig aus dem Wohnzimmer/Balkon geht über den Auenwald. Das Haus selber wurde von 2014 bis 2020 komplett, liebevoll restauriert und hochwertig saniert. Trotz der idyllischen Lage ist das Haus nur ca. 20 Min. von der Innenstadt entfernt. Einkaufsmöglichkeiten, Straßenbahn etc., Bioladen, Schulen und Kindergärten sind in unmittelbarer Näher. \n\nWir werden einen großen Garten gestalten ... ohne Parkplätze im Hof. Viel Platz zum erholen, Kinder etc.. Des weiteren gibt es ein Waschhaus für alle Mieter, mit Waschmaschinenanschluß pro Mieter und je einen Abstellschuppen pro Mieter im Hof. In den Wohnungen gibt es auch Waschmaschinenanschlüsse in den Bädern, aber der Platz kann sicherlich besser genutzt werden, als für eine Waschmaschine :-) Für die Wäsche und das Waschen bzw. Trocknen haben wir ein sepparates Waschhaus gebaut.  ', 'ACHTUNG: Im übrigen haben wir im selben Grundetück 3 weitere herrliche 4 Raum Wohnungen zu vermieten. Eine Wohnung geht über 3 Etagen mit ca. 135 qm und 4,5 Räumen. Sie ist im direkten Nachbarhaus (erkennbar in der Hinteransicht rechts...Grundriss fehlt, da über 3 Etagen schlecht darstellbar ... so siehts aus: \nEG: Wozi mit Küche und Flur, 1.OG 2 Bäder und 2 Zimmer, 2.OG: 2 Zimmer). Die Wohnung bzw. das Haus wird mit einer effizienten Gasheizung beheizt und jede Wohnung verfügt über einen Kaminofenanschluß. Solide gebaut und energetisch kaum zu toppen...im Vergleich mit anderen alten Mahrfamilienhäusern. \n\n2 weitere Wohnungen befinden sich in der neu gebauten Villa mit jeweils ca. 125 qm Wohnfläche und 4 Räumen. (Grundriss siehe Bilder) Dort gibt es ein EG mit Garten und Terasse und ein 1.OG mit Lodgia (siehe Ausblick auf die Villa) Gern senden wir Ihnen dazu auch Infos oder zeigen Ihnen die Wohnungen vor Ort. Die Wohnung in der Villa werden mit einer effizienten Erdwärmeheizung beheizt. Die Mauern sind 42 cm stark, aus Gasbeton. Das Haus ist annhähernd ein Passivhaus und braucht wenig Energie. Der Kaltmietpreis liegt etwas höher, die Energiekosten sind sehr nachhaltig und sparsam. \n\nDas Haus befindet sich in Leipziger privaten Händen :-) und wird dementsprechend gepflegt. Durch die Nutzung eines Kaminofens entsteht wohlige Wärme und Nebenkosten können gespart werden.. \n\nDie Bilder sind natürlich nur ein kleiner Ausblick auf das Projekt, um ein Gefühl für Räume und Ort zu vermitteln. Denn das Haus wird noch saniert. Die Parkettböden fehlen noch und auch andere Restarbeiten sind noch in vollem Gange. ABER...Sie haben dadurch die Chance, sich rechtzeitig auf Ihr neues Zuhause einzustellen und stellenweise mitzuerleben, wie es täglich schöner wird. Wir erklären Ihnen zudem gern alles vor Ort.  \n\nBei Interesse senden Sie uns bitte eine Mail an danielkaube@hotmail.com und hinterlassen Sie bitte auch Ihre Telefonnummer. Wir rufen Sie dann umgehend zurück.']";showqualicontactform;profile0;false;;true;top;Sachsen;Leipzig;Deutschland;04159;51,37800537504721;12,300657026170986;false;n;y;n;1035;7;18540105;y;first_time_use_after_refurbishment;009.7c95a311-cb80-414e-8ad7-6bbaf5e23b16;y;;;gas;2;;y;;n;;central_heating;162;wohnung_miete;luxury;0,active;2020;n;115;5;n;;4;4;2;063aa08e-3f98-40cf-86af-1e5aa2341599;no_information;https://pictures.immobilienscout24.de/listings/565e96b1-9d7a-4271-82a2-ccb980415527-1342551182.jpg/ORIG/resize/118x118%3E/extent/118x118/format/jpg/quality/80;13;2.38;13.77;2.38;Sachsen;Leipzig;Lützschena_Stahmeln;115077922;230;"Stahmelner Stra&szlig;e";Stahmelner_Straße;100 MBit/s;true;;;100 MBit/s;true;MagentaZuhause L;web,email,bank,music,dl-ul,game,sd,mltstr,hd,fast-ul-dl;über VDSL;REGULAR;https://padlock.link/ml;https://padlock.link/ioml;telekom_layer_magenta_l;ONE_YEAR_FREE;40 MBit/s;;1265;roof_storey;1910;1;04159
2020-01-01 22:02:20.614597;/expose/115062873;['Frisch saniertes Gründerzeithaus aus dem Jahr 1891. Schöne, helle 3-Raum-Wohnung mit optimaler Raumaufteilung. ', 'Große Fenster, weiße verputzte Wände mit Stuck, Parkettfußboden zum Wohlfühlen. Großes Badezimmer mit Fenster zum Hof mit Dusche / Badewanne. Geräumige Küche mit Balkon zum Hinterhof mitten in der Krone eines großen Baums. Aufzug direkt vor der Wohnungstür. Fahrradunterstellmöglichkeit im Hof. ', 'Lage in der Erich-Zeigner-Allee zwischen Zschocherscher Str. und Nonnenstraße, zwischen Karl-Heine-Kanal und Weißer Elster in einem jungem und lebendigem Stadtteil. \nFußläufig zu erreichen sind Einkausmöglichkeiten (Supermärkte, Drogerie), Freibad und Sportbad, Kindergarten und Grundschule sowie Kneipen und Restaurants auf der Karl-Heine-Straße. Mit dem Fahrrad in 5 min in den Auwald, in 10 min über die Sachsenbrücke in die Innenstadt. Oder mit der Straßenbahn in wenigen Minuten in die Innenstadt und zum Hauptbahnhof.'];showqualicontactform;profile0;false;;true;top;Sachsen;Leipzig;Deutschland;04229;51,3260221861116;12,33733586833241;false;n;y;n;874;6;17325608;y;modernized;009.bfcaaf2c-c986-461a-a59a-5afa062c9d2a;y;D;energy_required;gas;2;;n;;n;;central_heating;58;wohnung_miete;sophisticated;0,active;2019;y;92;4;n;;3;3;4;cdcd1206-3dbd-4152-9d2d-75e38498e195;no_information;https://pictures.immobilienscout24.de/listings/a57a202a-6653-4eb3-a596-9a54be74f488-1342402853.jpg/ORIG/resize/118x118%3E/extent/118x118/format/jpg/quality/80;10;4.56;15.1;4.56;Sachsen;Leipzig;Plagwitz;115062873;160;Erich-Zeigner-Allee;Erich-Zeigner-Allee;100 MBit/s;true;;;100 MBit/s;true;MagentaZuhause L;web,email,bank,music,dl-ul,game,sd,mltstr,hd,fast-ul-dl;über VDSL;REGULAR;https://padlock.link/ml;https://padlock.link/ioml;telekom_layer_magenta_l;ONE_YEAR_FREE;40 MBit/s;114.5;1034;apartment;1891;1;04229
2020-01-01 22:02:26.906340;/expose/109825749;['Bei dem Angebot handelt es sich um eine sehr schöne helle 2 Raum-Wohnung, welche neu saniert und mit hochwertigem Laminat versehen ist.   \n\nBesichtigungen können auch abends sowie an Wochenenden durchgeführt werden.\n\nDie Wohnung befindet sich in einem sehr schön saniert und gepflegten Altbau aus der Gründerzeit. Die Fassade ist teilweise mit historischem Bossenputz sowie mit einer Klinkerverblendung versehen. An die Hoffassade wurde ein Wärmedämmverbundsystem angebracht.', 'Die Wohnung ist bezugsfertig vorgerichtet. Die einzelnen Wohnräume sind mit Laminatbelag ausgestattet.  Das Badezimmer ist mit Dusche, Wand-WC und Waschtisch versehen. Weiterhin sind stilvolle Innentüren (weiß) sowie Holz-Thermofenster montiert.\nDas Wohnzimmer ist mit einer schönen originalen Stuckdecke versehen. ', 'Die Schiebestraße liegt im Stadtteil Eutritzsch, welcher unmittelbar an den Stadtteil Gohlis grenzt. Es handelt sich hierbei um eine ruhige Nebenstraße, welche durch eine sehr gut ausgeprägte Infrastruktur zentral gelegen ist. Die öffentlichen Verkehrsmittel (Bus und Straßenbahn) sind fußläufig (3 Minuten) erreichbar. Damit oder mit dem Auto erreicht man in ca. 8 Minuten die City. Weiterhin hat man eine direkte Anbindung zur B2 und B6 sowie zur A14 und A38. Das Leipziger neue Messegelände, das BMW- und Porschewerk sowie den Airport Leipzig erreicht man in 15 Minuten.\nIn unmittelbarer Nähe befindet sich das Eutritzschcenter mit verschiedenen Einkaufsmöglichkeiten und Dienstleistungsangeboten. Sport- und Freizeitangebote sind vielfältig vorhanden.'];showqualicontactform;profile0;false;;true;top;Sachsen;Leipzig;Deutschland;04129;51,3629931712525;12,387307276313349;false;n;n;n;330;2;12608103;y;refurbished;001.12608103;y;;;gas;2;;n;;n;;central_heating;26;wohnung_miete;normal;0,active;2016;n;60.31;2;n;;2;2;4;25d6cb37-9180-4d9b-930a-1d8ad3eba2bc;no;https://pictures.immobilienscout24.de/listings/b77d67d7-f1b1-46dd-8b0c-3112e71dde2d-1293829772.jpg/ORIG/resize/118x118%3E/extent/118x118/format/jpg/quality/80;10;4.04;13.92;4.04;Sachsen;Leipzig;Eutritzsch;109825749;150;"Schiebestra&szlig;e";Schiebestraße;100 MBit/s;true;;;100 MBit/s;true;MagentaZuhause L;web,email,bank,music,dl-ul,game,sd,mltstr,hd,fast-ul-dl;über VDSL;REGULAR;https://padlock.link/ml;https://padlock.link/ioml;telekom_layer_magenta_l;ONE_YEAR_FREE;40 MBit/s;;480;apartment;1900;1;04129
2020-01-01 22:02:27.896965;/expose/87164221;"['Gepflegter Neubau inmitten der Südvorstadt.', 'Die Wohnung lieg ruhig auf der Südseite mit Balkon, großer Aufzug; Parkett und helle Keramikfliesenböden, Fußbodenheizung, elektrische Rolläden, komfortable EBK mit Granit Arbeitsfläche und Essplatz ; DSL, Münzwaschmaschinen und Anschluss für eigene Waschmaschine im Maschinenraum, evtl. Stellplatz gegenüber dem Haus (65,00 €) zum anmieten möglich.', 'Das MFH befindet sich am Eingang zum Clara-Zetkin-Park, direkt an der Pleiße gelegen. Einkaufsmöglichkeiten, Straßenbahn, Schule und Kita befinden sich in unmittelbarer Nähe.', 'Gesamtmiete: 740,00 € evt. mit ST\n\nzzgl.         540,00 € Nettomiete\nzzgl.           55,00 € Einbauküche\nzzgl.           80,00 € Nebenkostenvorausz.\nzzgl.           65,00 € Warmmiete ST, keine Abr.\n                              (Miete 60,00 € + 5,00 € NK)\n                              evtl. zur Anmietung möglich\nKontaktaufnahme:\n- Eigentümer\n  karlpneumann@web.de']";showqualicontactform;profile0;false;;true;top;Sachsen;Leipzig;Deutschland;04107;51,3259534233229;12,36844629980115;false;n;y;n;540;4;16203141;y;mint_condition;001.15921818;y;NO_INFORMATION;energy_consumption;gas;4;;n;;y;;central_heating;2;wohnung_miete;sophisticated;0,active;;y;54;2;n;1;2;2;5;87164221;no;https://pictures.immobilienscout24.de/listings/294138c4-d34e-44db-abaa-715cde4dd9ec-1005810960.jpg/ORIG/resize/118x118%3E/extent/118x118/format/jpg/quality/80;6;6.41;;;Sachsen;Leipzig;Zentrum_Süd;87164221;80;Niederkirchner Str.;Niederkirchner_Str.;50 MBit/s;true;;;50 MBit/s;true;MagentaZuhause M;web,email,bank,music,dl-ul,game,sd,mltstr,hd,fast-ul-dl;über VDSL;REGULAR;https://padlock.link/mm;https://padlock.link/iomm;telekom_layer_magenta_m;ONE_YEAR_FREE;10 MBit/s;;740;apartment;1997;5;04107
