2020-01-02 00:15:06.137612;/expose/114183936;['Das um 1906 erbaute und einer aufwändigen & denkmalschutzgerechten Komplettsanierung unterzogene Mehrfamilienhaus wartet mit wundervollen Altbau-Details auf, welche erhalten und wieder aufbereitet wurden. Ein umfassendes energetisches Sanierungskonzept, funktionale Grundrisse und eine exklusive Ausstattung bieten ein modernes Wohnumfeld zum Wohlfühlen.', 'Es wird ein Mietvertrag mit 12 Monaten Kündigungsausschluss vereinbart.\nWohnräume: In allen Wohnräumen befinden sich Anschlüsse für Netzwerk und Fernsehen. Als Bodenbelag wurde ein dunkles Parkett ausgewählt. In der gesamten Wohnung sorgt eine Fußbodenheizung für wohlige Wärme, eine indirekte LED-Beleuchtung in allen Räumen schafft ein tolles Ambiente.  \r\n\r\nBadezimmer: Besonderes Augenmerk verdient das modern designte Bad mit dunklen Wandfliesen sowie großformatigen, hellen Bodenfliesen. Es verfügt über eine Badewanne und eine separate bodentiefe Dusche. Über dem modernen, in den Unterschrank eingelassenen Waschbecken ist bereits ein beleuchteter Spiegel integriert, von der Decke strahlen zusätzliche LED-Downlights. Highlight ist der im Spiegel integrierte TV-Bildschirm. Entspannt in der Wanne liegen und einen Film schauen? Kein Problem! Alles in allem wurde ein Badezimmer geschaffen, in dem Sie sich durch und durch wohlfühlen werden. Ein zusätzliches Gäste-WC vermeidet morgendliche Hektik.\r\n\r\nKüche: Der Fliesenspiegel der offenen Küche besteht aus großformatigen Fliesen in modernem Design.\r\n\r\nBalkon: Vom Wohn- und Küchenbereich gelangt man auf den großzügigen Balkon mit fast 10 m² Fläche. Der Boden ist mit einem Bangkiraiholz-Belag versehen. Hier ist viel Platz für Ihre Sitzmöbel. Durch die Südost-Lage ist ein Frühstück in der Sonne kein Wunschtraum mehr. Hier können Sie aber auch so manchen Abend, ob allein oder mit Freunden, dank des ruhigen, grünen Innenhofs gemütlich ausklingen lassen.', 'Das Objekt befindet sich in Schleußig, einem der beliebtesten Leipziger Stadtteile. Durch die erstklassige Verkehrsanbindung erreichen Sie das Stadtzentrum mit der Straßenbahn oder auch dem Fahrrad bzw. Auto in 5-10 Minuten. Über den Schleußiger Weg und die B2 ist die Autobahn A38 im Süden nur wenige Fahrminuten entfernt.\r\n\r\nAber auch wenn Sie Entspannung suchen, könnte es kaum bessere Voraussetzungen geben. Ob ein Spaziergang durch den Auenwald, eine Bootstour auf der Weißen Elster oder ein Sprung ins Wasser im Sommerbad Kleinzschocher, alles liegt maximal 5 Minuten Fußweg entfernt. Die großen Seen im Leipziger Süden sind bequem in 15 Minuten mit dem Fahrrad zu erreichen.\r\n\r\nVielfältige Einkaufsmöglichkeiten, Ärztehaus, Kindergarten, Schule etc. finden sich in unmittelbarer Nähe.'];showqualicontactform;profile0;false;true;standard;Sachsen;Leipzig;Deutschland;04229;51,3190687278597;12,341300178297432;false;n;y;n;930;6;3916561;y;first_time_use;001.3916561;y;;;no_information;3;;n;;n;;central_heating;101;wohnung_miete;luxury;0,active;2019;n;96.39;4;n;;4;4;5;Könneritz101 WE04;no_information;https://pictures.immobilienscout24.de/listings/ffb31ef3-b646-4e21-842b-c0c03d51a523-1329408410.jpg/ORIG/resize/118x118%3E/extent/118x118/format/jpg/quality/80;13;4.47;15.67;4.47;Sachsen;Leipzig;Schleußig;114183936;220;"K&ouml;nneritzstra&szlig;e";Könneritzstraße;100 MBit/s;true;;;100 MBit/s;true;MagentaZuhause L;web,email,bank,music,dl-ul,game,sd,mltstr,hd,fast-ul-dl;über VDSL;REGULAR;https://padlock.link/ml;https://padlock.link/ioml;telekom_layer_magenta_l;ONE_YEAR_FREE;40 MBit/s;;1150;apartment;1906;1;04229
2020-01-02 00:15:12.116448;/expose/114182729;['* sanierter denkmalgeschützter Altbau\n* Keller\n* Abstellraum auf halber Treppe\n* grüner Innenhof', '* Wohnung mit Laminat (Bilder noch mit Teppichboden)\n* offenes Wohnzimmer mit kleinem Süd-Balkon\n* geflieste offene Küche\n* innenliegendes Bad mit Wanne und WM-Anschluss\n* kein Flur\n* Zentralheizung', '* Friedrich-Bosse-Straße zwischen Am Pfefferbrückchen und Agnestraße\n* ruhige Lage\n* Straßenbahnhalt und Einkaufsmöglichkeiten in der Nähe'];showqualicontactform;profile0;false;true;standard;Sachsen;Leipzig;Deutschland;04159;51,37172498973223;12,329185819911329;false;n;y;n;429;3;655128;y;no_information;001.655128;n;;;natural_gas_heavy;3;;n;1;n;;central_heating;59;wohnung_miete;no_information;0,active;;n;66;3;n;;3;3;4;9916;negotiable;https://pictures.immobilienscout24.de/listings/9cecb38f-6bb2-4c30-9561-84513e9d73c0-1329390826.jpg/ORIG/resize/118x118%3E/extent/118x118/format/jpg/quality/80;16;3.8;14.48;3.8;Sachsen;Leipzig;Möckern;114182729;158;"Friedrich-Bosse-Stra&szlig;e";Friedrich-Bosse-Straße;100 MBit/s;true;;;100 MBit/s;true;MagentaZuhause L;web,email,bank,music,dl-ul,game,sd,mltstr,hd,fast-ul-dl;über VDSL;REGULAR;https://padlock.link/ml;https://padlock.link/ioml;telekom_layer_magenta_l;ONE_YEAR_FREE;40 MBit/s;;587;apartment;;;04159
2020-01-02 00:15:25.727496;/expose/114182201;['Das Wohnhaus im Süden von Leipzig bietet mehr als nur eine schöne Aussicht: Arzt und Physiotherapie sind direkt vor Ort. Mit dieser Wohnung finden Senioren den besonderen Wohnkomfort. Ergänzende Serviceleistungen mit der Caritas ServiceCard wie Hausnotruf, Essen auf Rädern oder Pflegeangebote erleichtern hilfsbedürftigen Menschen den Alltag. Die Veranstaltungen in der Begegnungsstätte sorgen für Gesellschaft und Unterhaltung und tragen so zum geselligen Miteinander bei. Unsere barrierearmen und seniorenfreundlichen 1- bis 3-Raum-Wohnungen, welche überwiegend mit bodengleichen Duschen ausgestattet sind, bieten für jeden Geldbeutel das passende Wohnangebot. Das Objekt ist mit zwei Aufzügen ausgestattet, sodass auch die oberen Etagen bequem erreichbar sind.', '- bezugsfertig \r\n- Wände und Decken Raufaser weiß\r\n- Bodenbelag in Laminatoptik\r\n- seniorenfreundliches Bad mit bodengleicher Dusche \r\n- Abstellbox', 'Im Süden Leipzigs gelegen ist die grüne Gartenvorstadt Marienbrunn ein sehr beliebter Stadtteil Leipzigs. Von Parks und Grünflächen umrahmt und nahe des Erholungsgebietes am Silbersee, ist Marienbrunn ideal für ausgiebige Spaziergänge im Naherholungsgebiet. Für sportlich interessierte befinden sich eine Schwimmhalle und eine Bowlingbahn in unmittelbarer Nähe. Marienbrunn verfügt über eine sehr gut ausgebaute Infrastruktur. Einkaufsmöglichkeiten, Schulen, Kindergärten, Ärzte und Banken sowie öffentliche Verkehrsmittel sind bequem fußläufig erreichbar.', 'Der Erwerb einer Caritas Servicecard ist in diesem Objekt obligatorisch. Für mehr Informationen sprechen Sie uns einfach an.'];showqualicontactform;profile0;false;true;standard;Sachsen;Leipzig;Deutschland;04277;51,309399159748;12,395299484338418;false;n;n;n;179.59;1;32969;n;modernized;001.32969;y;;energy_consumption;district_heating;2;disabled;n;;n;65;central_heating;46;wohnung_miete;no_information;0,active;;y;32.07;1;n;;1;1;16;5/1/22__187--193;negotiable;https://pictures.immobilienscout24.de/listings/11b8734e-3178-4686-bdd7-f1a519e9b368-1329384618.jpg/ORIG/resize/118x118%3E/extent/118x118/format/jpg/quality/80;9;2.65;11.57;2.65;Sachsen;Leipzig;Marienbrunn;114182201;64;Arno-Nitzsche-Str.;Arno-Nitzsche-Str.;100 MBit/s;true;;;100 MBit/s;true;MagentaZuhause L;web,email,bank,music,dl-ul,game,sd,mltstr,hd,fast-ul-dl;über VDSL;REGULAR;https://padlock.link/ml;https://padlock.link/ioml;telekom_layer_magenta_l;ONE_YEAR_FREE;40 MBit/s;98;;apartment;1974;3;04277
2020-01-02 00:15:32.911607;/expose/114180259;['Bei unserem Wohnobjekt handelt es sich um einen gepflegten Altbau. ', 'Die 2-Raumwohnung befindet sich im 3. Obergeschoss des denkmalgeschützten Altbauhauses. \rSie wird aktuell renoviert und ist perfekt für Wohngemeinschaften oder Paare geeignet! \rBeim Betreten der Wohnung erwartet Sie ein großzügiger Eingangsbereich. Auch das Wohn- und Schlafzimmer bietet viel Platz und ist optimal geschnitten für perfekte Stellmöglichkeiten. \rZudem ist die gesamte Wohnung mit viel Licht durchflutet. \rIm Küchenbereich wurde eine klassische Küchenzeile eingebaut. Von hier aus haben Sie den direkten Zugang zum sonnigen Balkon! \rDas Tageslichtbad ist mit gepflegten Sanitäreinrichtungen und einer Badewanne mit Duschfunktion ausgestattet. \r\rEin Keller kann je nach Verfügbarkeit kostenlos genutzt werde. \r\r', 'Unser schönes, saniertes Altbauhaus Palmstraße 5 liegt im Stadtteil Reudnitz, östlich des Leipziger Stadtzentrums.\r\rDas Objekt liegt in einer ruhigen Wohngebietsstraße.\rKleinere Geschäfte des täglichen Bedarfs finden sich nur wenige Gehminuten entfernt an der Riebeckstraße. Die nächsten Supermärkte bzw. Discounter sind in kurzer Zeit zu erreichen. Hierfür können Sie auch den öffentlichen Nahverkehr nutzen. \rEine ideale Anbindung an das nahegelegene Stadtzentrum bzw. um den täglichen Einkauf zu erledigen, bietet die Nutzung der S-Bahn oder der Straßenbahn. Die Haltestelle Riebeck-/Oststraße bringt Sie in wenigen Minuten zum Leipziger Hauptbahnhof. Mit der S-Bahnlinie S1, welche ebenfalls den Hauptbahnhof anfährt, kommen Sie bis nach Wurzen bzw. an den westlichen Stadtrand Leipzigs.\rIm Stadtzentrum und um den Hauptbahnhof herum, haben Sie beste Möglichkeiten für Shoppingtouren bzw. Stadtbesichtigungen. Hier hat Leipzig einiges zu bieten. Ein Besuch des historischen Völkerschlachtdenkmals oder der Thomaskirche, Heimat des weltberühmten Thomanerchors, sind dabei unausweichlich.\r\rAuch Kindergärten und Schulen finden sich in der näheren Umgebung des Wohnumfeldes.\rDarüber hinaus ist Leipzig auch als Universitätsstandort über die Stadtgrenze hinaus sehr beliebt. Jährlich zieht es viele junge Abiturienten aus ganz Deutschland zum Studium in die einwohnerstärkste Stadt Sachsens.\r\rIdeale Bedingungen für ausgedehnte Spaziergänge nach einem stressigen Arbeitstag oder am Wochenende, bietet der wenige Gehminuten entfernte Friedenspark oder der Lene-Voigt-Park. Hier können Sie abschalten und sich wohl fühlen oder auch sportlichen Betätigungen nachgehen! ', 'Vereinbaren Sie kurzfristig Besichtigungstermine mit uns. Nutzen Sie hierzu einfach das Kontaktformular des Immobilienportals oder setzen Sie sich mit Herrn Grönitz unter der Rufnummer 0151-18 110 110 in Verbindung.\r\r\rWir freuen uns auf Sie! '];showqualicontactform;profile0;false;true;standard;Sachsen;Leipzig;Deutschland;04317;51,3294555306428;12,411735896043169;false;n;y;n;465;3;17056679;n;well_kept;002.01007837224;y;;;gas;3;;n;2;y;85;central_heating;5;wohnung_miete;normal;0,active;;n;67;3;n;;2;2;5;PALMSTR5_VH3OGli (1/510);negotiable;https://pictures.immobilienscout24.de/listings/b8d1a5dd-cafa-4bc4-9d74-69dd25668501-1329358614.jpg/ORIG/resize/118x118%3E/extent/118x118/format/jpg/quality/80;9;4.38;16.31;4.38;Sachsen;Leipzig;Reudnitz_Thonberg;114180259;170;"Palmstra&szlig;e";Palmstraße;100 MBit/s;true;;;100 MBit/s;true;MagentaZuhause L;web,email,bank,music,dl-ul,game,sd,mltstr,hd,fast-ul-dl;über VDSL;REGULAR;https://padlock.link/ml;https://padlock.link/ioml;telekom_layer_magenta_l;ONE_YEAR_FREE;40 MBit/s;;635;apartment;1915;1;04317
2020-01-02 00:15:33.828397;/expose/114182206;"['Die grünen Innenhöfe geben dem 1977 erbauten Wohngebiet einen besonders kinderfreundlichen Charakter. Die 1- bis 4-Raum-Wohnungen sind ansprechend geschnitten und verfügen größtenteils über einen Balkon. Bei den zwischen 26 m² und 87 m² großen Wohnungen finden sowohl Singles und Paare als auch Familien das Richtige.', '- bezugsfertig \r\n- Wände und Decken Raufaser weiß\r\n- Bodenbelag in Laminatoptik \r\n- Bad mit Wanne und Fenster\r\n- Küche mit Fenster\r\n- Keller', ""Unsere Objekte nördlich des Bahnhofs Thekla liegen im Herzen des Stadtteils. Egal, ob Sie schnell in die Innenstadt oder als Pendler zur Messe, zu BMW, Porsche oder in den Wurzener Raum wollen - dank der guten Anbindung mit öffentlichen Verkehrsmitteln, der Bundesstraße B 2 und der Autobahn A 14 sind Sie schnell an Ihrem Ziel. Der 'Bagger' und die Parthe befinden sich in unmittelbarer Umgebung. Hier können Sie wunderbar entspannen.""]";showqualicontactform;profile0;false;true;standard;Sachsen;Leipzig;Deutschland;04349;51,37636706814013;12,432899298316634;false;n;n;n;293.6;1;32969;y;well_kept;001.32969;y;;energy_consumption;district_heating;2;disabled;n;;n;70;central_heating;28;wohnung_miete;no_information;0,active;;n;58.72;2;n;;3;3;5;130/4/35__4603--193;negotiable;https://pictures.immobilienscout24.de/listings/3b7d1fb3-2fef-4f1f-b713-2aaa3a833d63-1329384775.png/ORIG/resize/118x118%3E/extent/118x118/format/jpg/quality/80;10;3;10.23;3;Sachsen;Leipzig;Thekla;114182206;80;Freiberger Str.;Freiberger_Str.;100 MBit/s;true;;;100 MBit/s;true;MagentaZuhause L;web,email,bank,music,dl-ul,game,sd,mltstr,hd,fast-ul-dl;über VDSL;REGULAR;https://padlock.link/ml;https://padlock.link/ioml;telekom_layer_magenta_l;ONE_YEAR_FREE;40 MBit/s;119;;apartment;1977;3;04349
2020-01-02 00:15:46.704403;/expose/114171555;['Im Zentrum Leipzigs befinden sich einige einzelne Wohnanlagen der Genossenschaft.    Zum Beispiel bietet die Wohnanlage Philipp-Rosenthal-Straße direkt am Universitätsgelände anspruchsvollen Wohnraum im sanierten Altbau.    In unmittelbarer Nachbarschaft zum Bayerischen Bahnhof befinden sich die sanierten Wohnungen in der Paul-Gruner-Straße mit großen Balkonen.   Die im Zentrum Nord befindlichen Wohnanlagen bieten eine optimale Anbindung an die Innenstadt, die auch über die zahlreichen Radwege gut erreichbr sind.', 'Bad mit Dusche\n Bad mit Fenster\n Tapete: Wand & Decke\n Fussboden: PVC', 'Das Leipziger Zentrum besticht mit seiner unmittelbaren Nähe zu zahlreichen Kultur- und Freizeitmöglichkeiten, einer hervorragenden Infrastruktur und idealer Verkehrsanbindung, u.a. mit der Nähe zum Leipziger Hauptbahnhof.    Es bietet optimalen Lebenskomfort und vielfältige Möglichkeiten für individuelles Wohnen.    Auch zur Innenstadt mit Oper, Gewand- haus, Moritzbastei, und Auerbachs Keller ist es nicht weit. Viele Shoppingcenter und die Passagen der Innenstadt laden zum Flanieren ein. Der Leipziger Zoo und das weitläufige grüne Rosental bieten Erholung pur.'];showqualicontactform;profile0;false;true;standard;Sachsen;Leipzig;Deutschland;04105;51,3566894848031;12,375186446374073;false;n;y;n;392;2;605967;n;no_information;001.605967;n;;energy_consumption;district_heating;1;disabled;n;;n;60;district_heating;33;wohnung_miete;normal;0,active;;n;60.3;2;n;;3;3;;6902.013;no_information;https://pictures.immobilienscout24.de/listings/8397f07b-200d-4623-a96e-a25bdb8f944a-1329248589.jpg/ORIG/resize/118x118%3E/extent/118x118/format/jpg/quality/80;3;4.42;14.02;4.42;Sachsen;Leipzig;Zentrum_Nord;114171555;120;"Springerstra&szlig;e";Springerstraße;100 MBit/s;true;;;100 MBit/s;true;MagentaZuhause L;web,email,bank,music,dl-ul,game,sd,mltstr,hd,fast-ul-dl;über VDSL;REGULAR;https://padlock.link/ml;https://padlock.link/ioml;telekom_layer_magenta_l;ONE_YEAR_FREE;40 MBit/s;84.1;512;apartment;1960;2;04105
2020-01-02 00:15:54.294201;/expose/114156031;['Bei dem Gebäude handelt es sich um ein 5-geschossiges Mehrfamilienhaus mit ausgebautem Dachgeschoss aus der Gründerzeit.', 'Insbesondere die Ausstattung der Wohnräume mit Echtholzparkett und Downlights in den Bädern und Fluren sowie die Ausstattung der hochwertigen Bäder mit Dusche und Badewanne gestalten das Ambiente besonders wohnenswert. \nDie Fußbodenheizung sorgt in den kalten Jahreszeiten für wohlige Wärme.\nEs ist eine Wohnung, in der man sich ab dem ersten Moment Zuhause fühlt. Die Loggia bietet Ihnen die Möglichkeit sich entspannt zurückzulehnen. \nZudem bietet, der in der Wohnung liegende, Hauswirtschaftsraum zusätzlichen Stauraum.\nDie Wohnung verfügt über eine Einbauküche. Der Mietpreis für die Einbauküche beträgt monatlich 75,-€.', 'Die Lage des Objektes lässt sich nicht nur durch die Nähe des Karl-Heine-Kanals auszeichnen. \nFußläufig erreichen Sie die Karl-Heine-Straße, mit seinen zahlreichen Restaurants und Geschäften. Entlang dem Karl-Heine-Kanal, auf dem gegenüberliegenden Ufer, führt Sie ein stadträumlicher und sehr reizvoller Rad- und Fußweg in die nahe Innenstadt.\nAuch die Anbindung durch Bus und Straßenbahnen, in 10 min erreichen Sie mit den ÖPNV die Innenstadt, ist hervorragend. Zum Zentrum sind es ca. 3,5 km.', 'Hinweis: Dieses Wohnungsangebot erfolgt freibleibend. Der Abschluss eines Mietvertrages erfordert die Zustimmung des Eigentümers, welche pauschal nicht zugesichert werden kann. Die Aussagen in diesem Exposé basieren auf Angaben des Eigentümers. Für die Richtigkeit wird keine Haftung übernommen.'];showqualicontactform;profile0;false;true;standard;Sachsen;Leipzig;Deutschland;04177;51,3311232787315;12,326325480952528;false;n;y;n;1000;6;15776469;y;first_time_use_after_refurbishment;001.15668676;y;;;;4;;n;100;n;;central_heating;3;wohnung_miete;luxury;0,active;2019;y;100.7;4;n;;2;2;4;114156031;negotiable;https://pictures.immobilienscout24.de/listings/b888cdaa-a6db-46ab-bb54-129c8874030b-1329058706.jpg/ORIG/resize/118x118%3E/extent/118x118/format/jpg/quality/80;13;5.13;14.16;5.13;Sachsen;Leipzig;Lindenau;114156031;270;"Gie&szlig;erstra&szlig;e";Gießerstraße;100 MBit/s;true;;;100 MBit/s;true;MagentaZuhause L;web,email,bank,music,dl-ul,game,sd,mltstr,hd,fast-ul-dl;über VDSL;REGULAR;https://padlock.link/ml;https://padlock.link/ioml;telekom_layer_magenta_l;ONE_YEAR_FREE;40 MBit/s;;1270;other;;;04177
2020-01-02 00:16:00.250473;/expose/114180787;['Das Objekt liegt im Stadtteil Großzschocher in äußerst ruhiger und grüner Lage. ', 'Laminat, Bad mit Dusche, Bad mit Wanne, Wintergarten, Zustand Altbau, Hausmeisterservice, Hausreinigung', 'WE 07, 3.OG links', 'www.kks-leipzig.de'];showqualicontactform;profile0;false;true;standard;Sachsen;Leipzig;Deutschland;04249;51,30218884527974;12,323046544904326;false;n;n;n;440;3;2303;n;no_information;001.2303;n;;;no_information;;;n;;n;;;26;wohnung_miete;no_information;0,active;;n;74;3;n;;2;2;;16242;no_information;https://pictures.immobilienscout24.de/listings/fddbcb7c-f8f8-41e1-8342-dac546130366-1329368383.jpg/ORIG/resize/118x118%3E/extent/118x118/format/jpg/quality/80;11;3;12.66;3;Sachsen;Leipzig;Großzschocher;114180787;150;"Giordano-Bruno-Stra&szlig;e";Giordano-Bruno-Straße;100 MBit/s;true;;;100 MBit/s;true;MagentaZuhause L;web,email,bank,music,dl-ul,game,sd,mltstr,hd,fast-ul-dl;über Glasfaser;REGULAR;https://padlock.link/ml;https://padlock.link/ioml;telekom_layer_magenta_l;ONE_YEAR_FREE;40 MBit/s;;590;no_information;1900;1;04249
2020-01-02 00:16:01.161893;/expose/114172961;['Diese 6-Raum-Wohnung ist ein Zusammenschluss aus zwei nebeneinanderliegenden Wohnungen und erhält somit eine Wohnfläche von 148 qm.\n\nDurch den Haupteingang Sie in den Flur, der Sie linkerhand zu einem Schlafzimmer sowie zu einem der zwei Bäder führt. In diesem finden Sie neben einer Badewanne auch eine Dusche und einen Waschmaschinenanschluss.\n\nFortführend reihen sich neben dem Wohnzimmer weitere Zimmer an, die als Kinder- Schlaf- oder Arebitszimmer genutzt werden können.\n\nDie Küche - am rechten Ende der Wohnung - erhielt einen offenen Charakter. Die Wände zum Flur hin wurden entfernt. Von diesem Raum aus gelangen Sie zudem auf einen Balkon.\nNeben der Küche - zum Hof zeigend, befindet sich ein weiteres Badezimmer, welches mit einer Dusche ausgestattet ist.\n\nLaminat stellt den vorwiegenden Bodenbelag in der gesamten Wohneinheit da. Die Bäder sind gefliest.\n\nZur Wohnung gehören zwei Parzellen im Keller. Ein Stellplatz kann für monatlich 50 EUR angemietet werden. \n\nDas Haus verfügt über einen Fahrstuhl und einen Hausmeister, der die Reinigung durchführt und sich um die Bereitstellung der Tonnen sorgt.', '- 6-Raum-Wohnung im 2.OG\n- 148 qm Wohnfläche\n- Zusammenschluss aus zwei Wohnungen\n- 2 Bäder (Dusche, Badewanne, Fenster, Waschmaschinenanschluss)\n- Balkon\n- Keller\n- Stellplatz möglich\n- überwiegend Laminat\n- Hausmeister', 'Das Mehrfamilienhaus befindet sich in der Oststraße, somit im Stadtgebiet Reudnitz und dem Uniklinikum nahe gelegen.', 'Zur Mietvertragsprüfung werden folgende Unterlagen benötigt:\n\n- Mieterselbstauskunft (Erhalt nach erfolgter Besichtigung und Zusage)\n- Einkommensnachweise der letzten 3 Monate\n- Mietschuldenfreiheitsbestätigung des aktuellen Vermieters\n- bei Studenten - Bürgschaft der erwerbstätigen Eltern\n- Datenschutzerklärung'];showqualicontactform;profile0;false;true;standard;Sachsen;Leipzig;Deutschland;04317;51,33239882970262;12,398507854529186;false;n;y;n;1225;7;16553970;y;well_kept;002.01002749632;y;;;natural_gas_light;2;;n;;n;;combined_heat_and_power_plant;17;wohnung_miete;no_information;0,active;2013;y;148.29;6;n;1;6;5;4;114172961;negotiable;https://pictures.immobilienscout24.de/listings/104031c3-fe89-4f08-bdf1-280947d4332b-1329307250.jpg/ORIG/resize/118x118%3E/extent/118x118/format/jpg/quality/80;9;4.38;16.31;4.38;Sachsen;Leipzig;Reudnitz_Thonberg;114172961;300;"Oststra&szlig;e";Oststraße;100 MBit/s;true;;;100 MBit/s;true;MagentaZuhause L;web,email,bank,music,dl-ul,game,sd,mltstr,hd,fast-ul-dl;über VDSL;REGULAR;https://padlock.link/ml;https://padlock.link/ioml;telekom_layer_magenta_l;ONE_YEAR_FREE;40 MBit/s;;;no_information;2013;8;04317
2020-01-02 00:16:08.047928;/expose/114155471;['Bei dem Gebäude handelt es sich um ein 5-geschossiges Mehrfamilienhaus mit ausgebautem Dachgeschoss aus der Gründerzeit.', 'Insbesondere die Ausstattung der Wohnräume mit Echtholzparkett und Downlights in den Bädern und Fluren sowie die Ausstattung der hochwertigen Bäder mit Dusche und Badewanne gestalten das Ambiente besonders wohnenswert. \nDie Fußbodenheizung sorgt in den kalten Jahreszeiten für wohlige Wärme.\nEs ist eine Wohnung, in der man sich ab dem ersten Moment Zuhause fühlt. Vom Balkon aus kann man wunderbar die Sonne und den Blick in den begrünten Innenhof genießen.\nZudem bietet, der in der Wohnung liegende, Hauswirtschaftsraum zusätzlichen Stauraum.', 'Die Lage des Objektes lässt sich nicht nur durch die Nähe des Karl-Heine-Kanals auszeichnen. \nFußläufig erreichen Sie die Karl-Heine-Straße, mit seinen zahlreichen Restaurants und Geschäften. Entlang dem Karl-Heine-Kanal, auf dem gegenüberliegenden Ufer, führt Sie ein stadträumlicher und sehr reizvoller Rad- und Fußweg in die nahe Innenstadt.\nAuch die Anbindung durch Bus und Straßenbahnen, in 10 min erreichen Sie mit den ÖPNV die Innenstadt, ist hervorragend. Zum Zentrum sind es ca. 3,5 km.', 'Hinweis: Dieses Wohnungsangebot erfolgt freibleibend. Der Abschluss eines Mietvertrages erfordert die Zustimmung des Eigentümers, welche pauschal nicht zugesichert werden kann. Die Aussagen in diesem Exposé basieren auf Angaben des Eigentümers. Für die Richtigkeit wird keine Haftung übernommen.'];showqualicontactform;profile0;false;true;standard;Sachsen;Leipzig;Deutschland;04177;51,3311232787315;12,326325480952528;false;n;y;n;1295;7;15776469;y;first_time_use_after_refurbishment;001.15668676;y;;;;1;;n;100;n;;central_heating;3;wohnung_miete;luxury;0,active;2019;y;136.2;6;n;;4;4;4;114155471;negotiable;https://pictures.immobilienscout24.de/listings/025452e4-3c20-4f13-b9dd-38be2eadf7f7-1329051615.jpg/ORIG/resize/118x118%3E/extent/118x118/format/jpg/quality/80;13;5.13;14.16;5.13;Sachsen;Leipzig;Lindenau;114155471;370;"Gie&szlig;erstra&szlig;e";Gießerstraße;100 MBit/s;true;;;100 MBit/s;true;MagentaZuhause L;web,email,bank,music,dl-ul,game,sd,mltstr,hd,fast-ul-dl;über VDSL;REGULAR;https://padlock.link/ml;https://padlock.link/ioml;telekom_layer_magenta_l;ONE_YEAR_FREE;40 MBit/s;;1665;other;;;04177
2020-01-02 00:16:14.112638;/expose/114155516;['Bei dem Gebäude handelt es sich um ein 5-geschossiges Mehrfamilienhaus mit ausgebautem Dachgeschoss aus der Gründerzeit.', 'Insbesondere die Ausstattung der Wohnräume mit Echtholzparkett und Downlights in den Bädern und Fluren sowie die Ausstattung der hochwertigen Bäder mit Dusche und Badewanne gestalten das Ambiente besonders wohnenswert. \nDie Fußbodenheizung sorgt in den kalten Jahreszeiten für wohlige Wärme.\nEs ist eine Wohnung, in der man sich ab dem ersten Moment Zuhause fühlt. Vom Balkon aus kann man wunderbar die Sonne und den Blick in den begrünten Innenhof genießen.\nZudem bietet, der in der Wohnung liegende, Hauswirtschaftsraum zusätzlichen Stauraum.', 'Die Lage des Objektes lässt sich nicht nur durch die Nähe des Karl-Heine-Kanals auszeichnen. \nFußläufig erreichen Sie die Karl-Heine-Straße, mit seinen zahlreichen Restaurants und Geschäften. Entlang dem Karl-Heine-Kanal, auf dem gegenüberliegenden Ufer, führt Sie ein stadträumlicher und sehr reizvoller Rad- und Fußweg in die nahe Innenstadt.\nAuch die Anbindung durch Bus und Straßenbahnen, in 10 min erreichen Sie mit den ÖPNV die Innenstadt, ist hervorragend. Zum Zentrum sind es ca. 3,5 km.', 'Hinweis: Dieses Wohnungsangebot erfolgt freibleibend. Der Abschluss eines Mietvertrages erfordert die Zustimmung des Eigentümers, welche pauschal nicht zugesichert werden kann. Die Aussagen in diesem Exposé basieren auf Angaben des Eigentümers. Für die Richtigkeit wird keine Haftung übernommen.'];showqualicontactform;profile0;false;true;standard;Sachsen;Leipzig;Deutschland;04177;51,3311232787315;12,326325480952528;false;n;y;n;1420;7;15776469;y;first_time_use_after_refurbishment;001.15668676;y;;;;3;;n;100;n;;central_heating;3;wohnung_miete;luxury;0,active;2019;y;142.6;6;n;;4;4;4;114155516;negotiable;https://pictures.immobilienscout24.de/listings/b2c2e61a-6854-4bd0-8652-d60d1d2a0ee9-1329053078.jpg/ORIG/resize/118x118%3E/extent/118x118/format/jpg/quality/80;13;5.13;14.16;5.13;Sachsen;Leipzig;Lindenau;114155516;385;"Gie&szlig;erstra&szlig;e";Gießerstraße;100 MBit/s;true;;;100 MBit/s;true;MagentaZuhause L;web,email,bank,music,dl-ul,game,sd,mltstr,hd,fast-ul-dl;über VDSL;REGULAR;https://padlock.link/ml;https://padlock.link/ioml;telekom_layer_magenta_l;ONE_YEAR_FREE;40 MBit/s;;1805;other;;;04177
