2020-01-01 21:56:20.325099;/expose/112543519;['\r\n\r\nAusstattungsmerkmale: \r\n-Parkettboden\r\n-Innenliegendes Bad (ohne Fenster)\r\n-Badewanne/Dusche/WC\r\n-Gäste WC\r\n-exklusives Bad\r\n-Aufzug\r\n-Keller\r\n-Balkon\r\n-Erstbezug\r\n-Einbauküche\r\n-Küche mit Fenster\r\n-offene Küche\r\n-Fußbodenheizung', 'Zentrum-West ist ein vielfältiges Stadtviertel - hier entdeckt man die unterschiedlichen Gesichter der Stadt. Das Bachviertel liegt direkt neben dem Elsterflutbecken, weist prächtige alte Villen auf und knüpft über den Johannapark hinweg an das Musikerviertel an. Im Übergangsbereich zwischen dem Zentrum-West und der Innenstadt befindet sich das Kolonnadenviertel - ein farbenfrohes und lebendiges und für Leipziger Verhältnisse junges Viertel. Durch die zentrale Lage besteht eine hervorragende Anbindung zu Nah- und Fernverkehr. Alle zentralen Punkte der Leipziger City sowie der Hauptbahnhof sind in wenigen Minuten erreichbar. Im Zentrum West befindet sich zudem ein Teil der Gottschedstraße. Der andere Teil führt - über die Käthe-Kollwitz-Straße hinaus - direkt in die City. Die Gottschedstraße ist eine der beliebtesten Kneipenmeilen Leipzigs und lädt mit einem reichhaltigen Angebot an Cafés und Restaurants zum Verweilen ein.', 'Folgende Unterlagen werden angefordert/benötigt:\r\n- Selbstauskunft\r\n- Schufaeinwilligung    \r\n- Vorvermieterbescheinigung \r\n- Kopie Personalausweis\r\n- Einkommensnachweise\r\n- Nachweis einer Haftpflichtversicherung\r\n\r\nDie Formulare finden Sie unter www.kuenne-immobilien.de/vermietung.\r\n\r\nDer Mietvertrag wird mit einer Mindestlaufzeit von zwei Jahren und nach der Mindestmietzeit mit einer Staffelmiete abgeschlossen.'];showqualicontactform;profile0;false;;true;top;Sachsen;Leipzig;Deutschland;04105;51,343325149194;12,35808932871466;false;n;y;n;1150;7;5367601;n;first_time_use_after_refurbishment;001.5367601;y;;;no_information;4;;n;;n;;;13;wohnung_miete;no_information;0,active;2019;y;99.97;4;n;;3;3;4;581466;no_information;https://pictures.immobilienscout24.de/listings/43f78b68-f996-4346-af68-b58c81a5d153-1341262294.jpg/ORIG/resize/118x118%3E/extent/118x118/format/jpg/quality/80;10;4.3;15.29;4.3;Sachsen;Leipzig;Zentrum_Nordwest;112543519;243;"Waldstra&szlig;e";Waldstraße;100 MBit/s;true;;;100 MBit/s;true;MagentaZuhause L;web,email,bank,music,dl-ul,game,sd,mltstr,hd,fast-ul-dl;über VDSL;REGULAR;https://padlock.link/ml;https://padlock.link/ioml;telekom_layer_magenta_l;ONE_YEAR_FREE;40 MBit/s;;;roof_storey;;;04105
2020-01-01 21:56:27.395781;/expose/112543534;['Ausstattungsmerkmale: \r\n-Parkettboden\r\n-Innenliegendes Bad (ohne Fenster)\r\n-Bad mit Wanne\r\n-Gäste WC\r\n-exklusives Bad\r\n-Aufzug\r\n-Keller\r\n-Balkon\r\n-Erstbezug\r\n-Einbauküche\r\n-Küche mit Fenster\r\n-offene Küche\r\n-Fußbodenheizung', 'Zentrum-West ist ein vielfältiges Stadtviertel - hier entdeckt man die unterschiedlichen Gesichter der Stadt. Das Bachviertel liegt direkt neben dem Elsterflutbecken, weist prächtige alte Villen auf und knüpft über den Johannapark hinweg an das Musikerviertel an. Im Übergangsbereich zwischen dem Zentrum-West und der Innenstadt befindet sich das Kolonnadenviertel - ein farbenfrohes und lebendiges und für Leipziger Verhältnisse junges Viertel. Durch die zentrale Lage besteht eine hervorragende Anbindung zu Nah- und Fernverkehr. Alle zentralen Punkte der Leipziger City sowie der Hauptbahnhof sind in wenigen Minuten erreichbar. Im Zentrum West befindet sich zudem ein Teil der Gottschedstraße. Der andere Teil führt - über die Käthe-Kollwitz-Straße hinaus - direkt in die City. Die Gottschedstraße ist eine der beliebtesten Kneipenmeilen Leipzigs und lädt mit einem reichhaltigen Angebot an Cafés und Restaurants zum Verweilen ein.', 'Folgende Unterlagen werden angefordert/benötigt:\r\n- Selbstauskunft\r\n- Schufaeinwilligung    \r\n- Vorvermieterbescheinigung \r\n- Kopie Personalausweis\r\n- Einkommensnachweise\r\n- Nachweis einer Haftpflichtversicherung\r\n\r\nDie Formulare finden Sie unter www.kuenne-immobilien.de/vermietung.\r\n\r\nDer Mietvertrag wird mit einer Mindestlaufzeit von zwei Jahren und nach der Mindestmietzeit mit einer Staffelmiete abgeschlossen.'];showqualicontactform;profile0;false;;true;top;Sachsen;Leipzig;Deutschland;04105;51,343325149194;12,35808932871466;false;n;y;n;1130;7;5367601;n;first_time_use_after_refurbishment;001.5367601;y;;;no_information;4;;n;;n;;;13;wohnung_miete;no_information;0,active;2019;y;98.03;4;n;;3;3;4;581459;no_information;https://pictures.immobilienscout24.de/listings/c4745dcd-ca44-4e74-ad3c-73607d0779a4-1341262359.jpg/ORIG/resize/118x118%3E/extent/118x118/format/jpg/quality/80;9;4.3;15.29;4.3;Sachsen;Leipzig;Zentrum_Nordwest;112543534;264.85;"Waldstra&szlig;e";Waldstraße;100 MBit/s;true;;;100 MBit/s;true;MagentaZuhause L;web,email,bank,music,dl-ul,game,sd,mltstr,hd,fast-ul-dl;über VDSL;REGULAR;https://padlock.link/ml;https://padlock.link/ioml;telekom_layer_magenta_l;ONE_YEAR_FREE;40 MBit/s;;;roof_storey;;;04105
2020-01-01 21:56:29.218999;/expose/112543537;['\r\n\r\nAusstattungsmerkmale: \r\n-Parkettboden\r\n-Innenliegendes Bad (ohne Fenster)\r\n-Bad mit Wanne\r\n-Gäste WC\r\n-exklusives Bad\r\n-Aufzug\r\n-Keller\r\n-Abstellraum\r\n-Loggia\r\n-Erstbezug\r\n-Einbauküche\r\n-Küche mit Fenster\r\n-offene Küche\r\n-Fußbodenheizung', 'Zentrum-West ist ein vielfältiges Stadtviertel - hier entdeckt man die unterschiedlichen Gesichter der Stadt. Das Bachviertel liegt direkt neben dem Elsterflutbecken, weist prächtige alte Villen auf und knüpft über den Johannapark hinweg an das Musikerviertel an. Im Übergangsbereich zwischen dem Zentrum-West und der Innenstadt befindet sich das Kolonnadenviertel - ein farbenfrohes und lebendiges und für Leipziger Verhältnisse junges Viertel. Durch die zentrale Lage besteht eine hervorragende Anbindung zu Nah- und Fernverkehr. Alle zentralen Punkte der Leipziger City sowie der Hauptbahnhof sind in wenigen Minuten erreichbar. Im Zentrum West befindet sich zudem ein Teil der Gottschedstraße. Der andere Teil führt - über die Käthe-Kollwitz-Straße hinaus - direkt in die City. Die Gottschedstraße ist eine der beliebtesten Kneipenmeilen Leipzigs und lädt mit einem reichhaltigen Angebot an Cafés und Restaurants zum Verweilen ein.', 'Folgende Unterlagen werden angefordert/benötigt:\r\n- Selbstauskunft\r\n- Schufaeinwilligung    \r\n- Vorvermieterbescheinigung \r\n- Kopie Personalausweis\r\n- Einkommensnachweise\r\n- Nachweis einer Haftpflichtversicherung\r\n\r\nDie Formulare finden Sie unter www.kuenne-immobilien.de/vermietung.\r\n\r\nDer Mietvertrag wird mit einer Mindestlaufzeit von zwei Jahren und nach der Mindestmietzeit mit einer Staffelmiete abgeschlossen.'];showqualicontactform;profile0;false;;true;top;Sachsen;Leipzig;Deutschland;04105;51,343325149194;12,35808932871466;false;n;y;n;1240;7;5367601;n;first_time_use_after_refurbishment;001.5367601;y;;;no_information;4;;n;;n;;;13;wohnung_miete;no_information;0,active;2019;y;107.73;5;n;;3;3;4;581452;no_information;https://pictures.immobilienscout24.de/listings/98ac2ba2-d673-4424-bda6-cc6418989d0a-1341262551.jpg/ORIG/resize/118x118%3E/extent/118x118/format/jpg/quality/80;10;4.3;15.29;4.3;Sachsen;Leipzig;Zentrum_Nordwest;112543537;264.85;"Waldstra&szlig;e";Waldstraße;100 MBit/s;true;;;100 MBit/s;true;MagentaZuhause L;web,email,bank,music,dl-ul,game,sd,mltstr,hd,fast-ul-dl;über VDSL;REGULAR;https://padlock.link/ml;https://padlock.link/ioml;telekom_layer_magenta_l;ONE_YEAR_FREE;40 MBit/s;;;maisonette;;;04105
2020-01-01 21:56:36.060962;/expose/112862488;['Auf einen Blick:\n\n- Balkon\n- Tageslichtbad mit Eckbadewanne\n- Halogenspots im Bad & Küche\n- in sämtlichen Räumen Medienanschlüsse vorhanden\n- Abstellkammer im Treppenhaus\n- Keller\n- großzügiger & begrünter Hinterhof\n- Nebenstraße', 'Gohlis-Mitte\n\nGohlis-Mitte ist ein Teilgebiet des Stadtteils Gohlis, welcher direkt an das nördliche Stadtzentrum grenzt und zu einem der beliebtesten Wohngebiete in Leipzig zählt. Das ehemalige so genannte Französische Viertel ist Nachbar des alten Gohlis und als ruhiges Wohngebiet äußerst begehrt. Eine herrliche und überwiegend geschlossene Gründerzeitbebauung prägen das Bild dieses Stadtteils. Zum Teil ist Gohlis-Mitte auch mit Villen aus dem 19. Jahrhundert und sehr gut erhaltenen Gebäuden des Jugendstils bebaut. Der in unmittelbarer Nähe gelegene Arthur-Brettschneider-Park im Zentrum des Wohngebietes bietet viel Freiraum für Freizeit und Erholung. Auch das unweit gelegene Rosental, eine herrliche Parklandschaft im Zentrum der Stadt, sowie der Zoologische Garten sind ebenfalls nur einen Katzensprung entfernt. Mit den Straßenbahnlinien 4 und 12, sowie den Buslinien 85 und 90 und der S-Bahn ist das ca. 4 km entfernt liegende Zentrum Leipzigs sehr gut zu erreichen.', 'Entspricht diese Wohnung Ihren Vorstellungen? Dann vereinbaren Sie mit uns einen Besichtigungstermin.'];showqualicontactform;profile0;false;;true;top;Sachsen;Leipzig;Deutschland;04157;51,3675935731115;12,373248449750198;false;n;y;n;539.91;4;16540007;y;refurbished;002.01007377242;y;;energy_consumption;gas;1;;y;1200;n;;central_heating;27;wohnung_miete;no_information;0,active;;n;77.13;3;n;;3;3;;3498;negotiable;https://pictures.immobilienscout24.de/listings/c0c563bf-bd07-4b1c-8728-1377dcffc141-1311109380.jpg/ORIG/resize/118x118%3E/extent/118x118/format/jpg/quality/80;20;4.07;14.7;4.07;Sachsen;Leipzig;Gohlis_Mitte;112862488;192.83;Michael-Kazmierczak-Str.;Michael-Kazmierczak-Str.;100 MBit/s;true;;;100 MBit/s;true;MagentaZuhause L;web,email,bank,music,dl-ul,game,sd,mltstr,hd,fast-ul-dl;über VDSL;REGULAR;https://padlock.link/ml;https://padlock.link/ioml;telekom_layer_magenta_l;ONE_YEAR_FREE;40 MBit/s;125;732.74;apartment;1930;1;04157
2020-01-01 21:56:41.962939;/expose/112543540;['\r\n\r\nAusstattungsmerkmale: \r\n-Abstellraum\r\n-Gäste Bad\r\n-Parkettboden\r\n-Badewanne/Dusche/WC\r\n-exklusives Bad\r\n-Aufzug\r\n-Keller\r\n-Balkon\r\n-Erstbezug\r\n-Einbauküche\r\n-Küche mit Fenster\r\n-Fußbodenheizung\r\n-Bad mit Fenster', 'Zentrum-West ist ein vielfältiges Stadtviertel - hier entdeckt man die unterschiedlichen Gesichter der Stadt. Das Bachviertel liegt direkt neben dem Elsterflutbecken, weist prächtige alte Villen auf und knüpft über den Johannapark hinweg an das Musikerviertel an. Im Übergangsbereich zwischen dem Zentrum-West und der Innenstadt befindet sich das Kolonnadenviertel - ein farbenfrohes und lebendiges und für Leipziger Verhältnisse junges Viertel. Durch die zentrale Lage besteht eine hervorragende Anbindung zu Nah- und Fernverkehr. Alle zentralen Punkte der Leipziger City sowie der Hauptbahnhof sind in wenigen Minuten erreichbar. Im Zentrum West befindet sich zudem ein Teil der Gottschedstraße. Der andere Teil führt - über die Käthe-Kollwitz-Straße hinaus - direkt in die City. Die Gottschedstraße ist eine der beliebtesten Kneipenmeilen Leipzigs und lädt mit einem reichhaltigen Angebot an Cafés und Restaurants zum Verweilen ein.', 'Folgende Unterlagen werden angefordert/benötigt:\r\n- Selbstauskunft\r\n- Schufaeinwilligung    \r\n- Vorvermieterbescheinigung \r\n- Kopie Personalausweis\r\n- Einkommensnachweise\r\n- Nachweis einer Haftpflichtversicherung\r\n\r\nDie Formulare finden Sie unter www.kuenne-immobilien.de/vermietung.\r\n\r\nDer Mietvertrag wird mit einer Mindestlaufzeit von zwei Jahren und nach der Mindestmietzeit mit einer Staffelmiete abgeschlossen.'];showqualicontactform;profile0;false;;true;top;Sachsen;Leipzig;Deutschland;04105;51,343325149194;12,35808932871466;false;n;y;n;1480;7;5367601;n;first_time_use_after_refurbishment;001.5367601;y;;;no_information;2;;n;;n;;;13;wohnung_miete;no_information;0,active;2019;y;147.73;6;n;;4;4;4;581478;no_information;https://pictures.immobilienscout24.de/listings/dd76a0d3-c948-4807-94e6-ed8ce7b70299-1341262067.jpg/ORIG/resize/118x118%3E/extent/118x118/format/jpg/quality/80;13;4.3;15.29;4.3;Sachsen;Leipzig;Zentrum_Nordwest;112543540;340;"Waldstra&szlig;e";Waldstraße;100 MBit/s;true;;;100 MBit/s;true;MagentaZuhause L;web,email,bank,music,dl-ul,game,sd,mltstr,hd,fast-ul-dl;über VDSL;REGULAR;https://padlock.link/ml;https://padlock.link/ioml;telekom_layer_magenta_l;ONE_YEAR_FREE;40 MBit/s;;;apartment;;;04105
2020-01-01 21:56:42.988701;/expose/112580289;['Die Wohnung liegt im Dachgeschoss eines sanierten Altbaus in der Ploßstraße 43. Auf ca. 49,25 m² bietet sie einen großzügigen Wohn- und Schlafbereich, ein Tageslichtbad mit Wanne, eine separate Küche mit Zugang zum Balkon, Abstellraum in der Wohnung, Flur und Keller. Im Wohn- und Schlafbereich ist Laminat verlegt, in der Küche und im Flur PVC-Boden. Das Bad ist gefliest. Das Haus verfügt über eine Zentralheizung, die mit Fernwärme betrieben wird.', '* großzügiger Wohn- und Schlafbereich * Laminat- / PVC- und Fliesenböden * Tageslichtbad mit Wanne * Waschmaschinenanschluss im Bad * Balkon * separate Küche mit Fenster / Zugang zum Balkon * Abstellraum * Zentralheizung * Keller * Fernwärme *', 'Dieser nordöstlich vom Stadtzentrum gelegene Stadtbezirk gilt wegen seiner Zentrumsnähe als beliebter Wohnstandort. Alle Einrichtungen des täglichen Bedarfes, Schulen, Kindergärten und Ärzte sind fußläufig erreichbar. Um nach Schönefeld-Abtnaundorf zu gelangen, nimmt man die Tramlinie 1, Busse Nr. 70 und 90 befahren das langgezogene Viertel ebenfalls. Das Erhohlungspotenzial zeigt sich besonders deutlich in den grünen Landschaften des Viertels. Der Mariannenpark zieht sich in Richtung Norden durch Schönefeld und zieht sich an der Parthe entlang in den Abtnaundorfer Park über. Die Parthenaue übrigens, die den Fluss begleitet, bietet genügend Raum für sportliche Betätigung: Wandern, Radfahren und Reiten oder man geht buchstäblich baden - das beliebte Sommerbad Schönefeld und die Schwimmhalle Nordost befinden sich ebenfalls im Park. Möchte man lieber stilvoll lustwandeln, so empfiehlt sich der Weg zum Abtnaundorfer Schloss. Hier kann man im Wald nämlich einen klassizistischen Pavillon entdecken, der auf einer Insel im Wasser schwimmt. Im Übrigen gibt es vor Ort einige Lebensmittelläden.', 'Alle Angaben und Darstellungen beruhen auf Informationen unserer Auftraggeber. Eine Haftung für die Richtigkeit und Vollständigkeit der Informationen kann von KOWO Immobilien GmbH deswegen nicht übernommen werden. Grundrisse sind nur schematisch und nicht maßstabsgerecht. Die Möblierung ist, wenn nicht anders angegeben, kein Bestandteil des Angebotes und dient nur als Einrichtungsbeispiel. Es gelten unsere AGB, die Sie unter www.kowo-immobilien.de oder in unseren Geschäftsräumen einsehen können. Sollte das vorgestellte Angebot nicht Ihren Anforderungen entsprechen, schauen Sie doch auf unserer Internetseite vorbei oder rufen uns an. Bei der KOWO Immobilien GmbH sind Sie in den besten Händen!\n'];showqualicontactform;profile0;false;;true;top;Sachsen;Leipzig;Deutschland;04347;51,3517645014802;12,410266420621156;true;n;y;n;320;2;895104;y;well_kept;001.895104;y;;energy_consumption;district_heating;4;;n;1;n;;;43;wohnung_miete;no_information;0,active;;n;49.25;2;n;;1;1;4;2258;no_information;https://pictures.immobilienscout24.de/listings/1e78ebdc-d092-4050-bb1a-810a68f07f63-1325342685.jpg/ORIG/resize/118x118%3E/extent/118x118/format/jpg/quality/80;20;3.52;14.9;3.52;Sachsen;Leipzig;Schönefeld_Abtnaundorf;112580289;100;"Plo&szlig;stra&szlig;e";Ploßstraße;100 MBit/s;true;;;100 MBit/s;true;MagentaZuhause L;web,email,bank,music,dl-ul,game,sd,mltstr,hd,fast-ul-dl;über VDSL;REGULAR;https://padlock.link/ml;https://padlock.link/ioml;telekom_layer_magenta_l;ONE_YEAR_FREE;40 MBit/s;93;;roof_storey;1900;1;04347
2020-01-01 21:56:56.289527;/expose/110669919;"['Die helle und große Maisonettewohnung besteht aus 4-Zimmern, 2 Bädern mit Dusche und Badewanne, einem großen Wohnzimmer mit offener Küche und zwei Balkonen, sowie einer sonnigen Dachterrasse.\nDie Immobilie ist frisch renoviert und hat einen hübschen neuen Designerboden in Holzoptik. Diese charmante Wohnung bietet sich super für Familien an.', '-Design Laminat \n-Maisonettewohnung\n-zwei Bäder mit Badewanne und Dusche + Fenster\n-zwei Balkone\n-Sonnenterasse\n\n-Außenstellplatz für 35€ monatlich\n-Tiefgaragenstellplatz für 45€ monatlich', 'Mölkau ist ein sehr entspanntes - und entspannendes - Stadtviertel im Leipziger Osten. Hier schließt man Bekanntschaft mit ländlicher Gelassenheit und findet ganz nebenbei noch ein paar besondere Schmuckstücke: Ob Sie nun im Stadtgut Mölkau den Westernreitsport probieren oder einen neugierigen Blick in die Geschichte der Fotografie werfen möchten - in Mölkau werden Sie fündig!\n\n \n\nUm mit den öffentlichen Verkehrsmitteln nach ""Mölge"" und ""Zweerns"" (wie der sächsische Volksmund so schön sagt) zu gelangen, nimmt man die Busse 72 und 73, 74, 79 oder 172. Die Tramlinie 4 hält im westlich angrenzenden Stötteritz und ermöglicht so einen fußnahen Zugang. Einen S-Bahnhof hat das Stadtviertel ebenfalls.']";showqualicontactform;profile0;false;;true;top;Sachsen;Leipzig;Deutschland;04136;51,3313030526379;12,44284794830264;false;n;y;n;1011;7;17433171;n;no_information;009.a9ca28de-7928-4b38-bda5-bf5c0b645d04;n;;;;4;;n;;n;;no_information;98;wohnung_miete;no_information;0,active;;n;157.95;7;n;;4;4;;110669919;negotiable;https://pictures.immobilienscout24.de/listings/e00de004-e21f-4df6-b604-1274b06397d9-1311706641.jpg/ORIG/resize/118x118%3E/extent/118x118/format/jpg/quality/80;12;2.6;11.84;2.6;Sachsen;Leipzig;Mölkau;110669919;347.39;"Engelsdorfer Stra&szlig;e";Engelsdorfer_Straße;100 MBit/s;true;;;100 MBit/s;true;MagentaZuhause L;web,email,bank,music,dl-ul,game,sd,mltstr,hd,fast-ul-dl;über VDSL;REGULAR;https://padlock.link/ml;https://padlock.link/ioml;telekom_layer_magenta_l;ONE_YEAR_FREE;40 MBit/s;;1358.39;maisonette;;;04136
2020-01-01 21:56:57.224053;/expose/110243091;['Die schöne 2-Raumwohnung wurde diesen Dezember saniert. Sie verfügt 2 geräumige Zimmer mit neuem Designboden in Holzoptik, ein Tageslichtbad mit Badewanne, sowie eine helle Küche mit Balkonzugang.', '-Desigboden in Holzoptik\n-Fliesen\n-Tageslichtbad\n-Wanne\n-WM-Anschluss im Bad\n-Geräumige Küche mit Balkonzugang\n-Balkon', 'Connewitz liegt etwa drei Kilometer südlich des Leipziger Stadtzentrums.\n\nDie Grenzen des Ortsteils bilden im Norden der Schleußiger Weg, die Wundtstraße und die Richard-Lehmann-Straße. Ost- und Südostgrenze ist die Bahntrasse Bayerischer Bahnhof-Markkleeberg. Im Süden ist das bebaute Gebiet von Markkleeberg die Grenze. Hier gehören aber noch einige kurze Straßenzüge am sogenannten Wolfswinkel in isolierter Lage zu Connewitz. Nach Westen folgen die Bahnlinie Plagwitz-Markkleeberg sowie der Westdamm des Hochflutbettes der Elster und das West-Ufer des Elsterflutbettes.'];showqualicontactform;profile0;false;;true;top;Sachsen;Leipzig;Deutschland;04277;51,30752322358548;12,380985016649579;false;n;y;n;496;3;17433171;n;no_information;009.a9ca28de-7928-4b38-bda5-bf5c0b645d04;n;;;;1;;n;;n;;no_information;24;wohnung_miete;no_information;0,active;2019;n;62;3;n;;2;2;;110243091;negotiable;https://pictures.immobilienscout24.de/listings/1122e9e8-0c15-4362-bf42-271de8e18dc6-1277860966.jpg/ORIG/resize/118x118%3E/extent/118x118/format/jpg/quality/80;5;5.11;19.21;5.11;Sachsen;Leipzig;Connewitz;110243091;155;"Zwenkauer Stra&szlig;e";Zwenkauer_Straße;100 MBit/s;true;;;100 MBit/s;true;MagentaZuhause L;web,email,bank,music,dl-ul,game,sd,mltstr,hd,fast-ul-dl;über VDSL;REGULAR;https://padlock.link/ml;https://padlock.link/ioml;telekom_layer_magenta_l;ONE_YEAR_FREE;40 MBit/s;;651;no_information;;;04277
2020-01-01 21:57:03.155605;/expose/112086767;['Unser vollständiges Wohnungsangebot in Leipzig und Umgebung finden Sie unter www.pisa-management.de und \rweitere News unter https://www.facebook.com/PISA.IMMOBILIEN \r\rFür Rückfragen und Terminvereinbarungen stehen Ihnen die Makler der PISA IMMOBILIENMANAGEMENT GmbH - Co. KG gern zur Verfügung.\r', '++ 4-RW im Neubau ++\r\r- edles Echtholzparkett\r\r- Fußbodenheizung\r\r- 2 Balkone\r\r- exklusive Badausstattung \r\r- Wanne und ebenerdige Dusche\r\r- Gäste-WC\r\r- Handtuchheizkörper \r\r- Außenjalousien\r\r- Stellplatz vorhanden', 'Das Graphische Viertel ist eines der beliebtesten Stadtgebiete in Leipzig. Eine Vielzahl der hier stehenden Gebäude sind bedeutende Baudenkmäler. \r\rWichtigstes Merkmal dieser beliebten Wohnlage ist die unmittelbare Nähe zur Innenstadt, die sowohl fußläufig als auch mit dem großen Angebot des öffentlichen Nahverkehrs oder mit dem PKW in kürzester Zeit erreichbar ist.\r\rDamit ist das umfangreiche kulturelle und infrastrukturelle Angebot des Leipziger Zentrums für die Anwohner bestens nutzbar.\r In der Nähe befindlich: Grundschule, Realschule, Hauptschule, Gymnasium, Universität, Fachhochschule, Kindertagesstätte, Nahverkehrsanbindung, Einkaufsmöglichkeit\r', ' BODENBELAG:\rParkett\rBAD:\rInnenliegendes Bad (kein Fenster), Bad mit Wanne und Dusche, sehr exklusives Bad, Boden: Fliesen/Stein, Gäste WC, Boden: Fliesen/Stein\rKÜCHE:\roffene Küche, Küche mit Fenster, Anschluss für Elektroherd, Anschluß für Geschirrspüler, Boden: Parkett/Dielen\rWASCHEN:\rAnschluss im Bad\rWEITERES:\r2 Balkone, Fussbodenheizung\rkein Kellerraum vorhanden\rBitte haben Sie dafür Verständnis, dass alle Angaben und Preise sowie Reservierungen unverbindlich sind und immer nur vorbehaltlich der Zustimmung des Eigentümers gelten. Ein Rechtsanspruch auf ein Kauf- oder Mietvertrag kommt erst durch Gegenzeichnung des selbigen durch den Eigentümer zustande.'];showqualicontactform;profile0;false;;true;top;Sachsen;Leipzig;Deutschland;04103;51,34329714553453;12,393718531369005;true;n;y;y;1290;7;5436764;n;no_information;001.5436764;n;;energy_required;no_information;2;disabled;n;;n;;no_information;34;wohnung_miete;normal;0,active;;y;117.9;5;y;1;4;4;;140530-M-01/4285/06;no_information;https://pictures.immobilienscout24.de/listings/ed3cae4f-1f6e-435c-90dc-81d786bd296d-1339947315.jpg/ORIG/resize/118x118%3E/extent/118x118/format/jpg/quality/80;19;4.66;15.98;4.66;Sachsen;Leipzig;Zentrum_Ost;112086767;236;"Langestra&szlig;e";Langestraße;100 MBit/s;true;;;100 MBit/s;true;MagentaZuhause L;web,email,bank,music,dl-ul,game,sd,mltstr,hd,fast-ul-dl;über VDSL;REGULAR;https://padlock.link/ml;https://padlock.link/ioml;telekom_layer_magenta_l;ONE_YEAR_FREE;40 MBit/s;52.6;1526;no_information;2019;9;04103
2020-01-01 21:57:09.842341;/expose/111652561;['Diese 3-Zimmer-Wohnung in Leutzsch bietet Ihnen:\r\n- Wohnzimmer, Schlafzimmer und Kinderzimmer\r\n- eine Küche mit einer hochwertigen und exclusiven Einbauküche mit viel Stauraum, Geschirrspülmaschine, Induktionskochfeld, Backofen, Kühlschrank mit großem separaten Gefrierfach, Echtholzarbeitsplatte \r\n- Parkettfußboden\r\n- Badezimmer mit Badewanne und einer Waschmaschine mit integriertem Trockner\r\n- Balkonanbau geplant ca. 6 m²', '\r\n\r\nAusstattungsmerkmale: \r\n-WMA im Bad\r\n-Fliesen-Bodenbelag\r\n-Innenliegendes Bad (ohne Fenster)\r\n-Dusche/WC\r\n-Einbauküche\r\n-Küche mit Fenster', 'Der Stadtteil Leutzsch liegt im Leipziger Westen.\r\nIn unmittelbarer Nähe befindet sich der Leipziger Auwald mit Auensee\r\nder zum spazieren, Fahrrad fahren und entspannen einlädt.\r\nEs besteht eine gute Anbindung zum ÖPNV (Tram 7, Bus 80, S- Bahn)\r\nund vielfältige Einkaufsmöglichkeiten und Dienstleistungen sind zu Fuß zu erreichen', 'Folgende Unterlagen werden angefordert/benötigt:\r\n- Selbstauskunft\r\n- Schufaeinwilligung\r\n- Vorvermieterbescheinigung \r\n- Kopie Personalausweis\r\n- Einkommensnachweise\r\n- Nachweis einer Haftpflichtversicherung\r\n\r\nDer Mietvertrag wird mit einer Mindestlaufzeit von einem Jahr und einer Staffelmiete abgeschlossen.\r\n\r\nDie Formulare finden Sie unter www.kuenne-immobilien.de/vermietung.'];showqualicontactform;profile0;false;;true;top;Sachsen;Leipzig;Deutschland;04179;51,347665053529;12,311026346440308;false;n;n;n;562.5;4;5367601;n;fully_renovated;001.5367601;y;;;no_information;3;;n;;n;;;16;wohnung_miete;no_information;0,active;;n;74;3;n;;3;3;4;581220;no_information;https://pictures.immobilienscout24.de/listings/8c9194d6-694d-4837-9653-fa112c29bdfa-1332134212.jpg/ORIG/resize/118x118%3E/extent/118x118/format/jpg/quality/80;9;3.51;13.6;3.51;Sachsen;Leipzig;Leutzsch;111652561;160;"R&uuml;ckmarsdorfer Stra&szlig;e";Rückmarsdorfer_Straße;100 MBit/s;true;;;100 MBit/s;true;MagentaZuhause L;web,email,bank,music,dl-ul,game,sd,mltstr,hd,fast-ul-dl;über VDSL;REGULAR;https://padlock.link/ml;https://padlock.link/ioml;telekom_layer_magenta_l;ONE_YEAR_FREE;40 MBit/s;;;apartment;1900;1;04179
