2020-01-01 21:59:16.670564;/expose/85564535;['Die Wohnung verfügt über eine Gasetagenheizung. Bitte beachten Sie, dass die Heizkosten nicht in der Warmmiete enthalten sind. Die Heizkosten müssen durch Sie separat mit einem Gasanbieter abgerechnet werden.', '\r\n\r\nAusstattungsmerkmale: \r\n-Gas-Etagenheizung\r\n-Bad mit Wanne\r\n-Gäste WC\r\n-WMA im Bad\r\n-Aufzug\r\n-Keller\r\n-Laminatboden\r\n-Fliesen-Bodenbelag', 'Das Objekt befindet sich im Zentrum-Nord, einem der beliebtesten und verkehrsgünstigsten Lagen von Leipzig. Zahlreiche Einkaufsmöglichkeiten, Dienstleistungsunternehmen (z. B. Bäcker, Drogerie usw.) befinden sich in unmittelbarer Nähe. Der öffentliche Personen-Nah-Verkehr ist fußläufig zu erreichen.', 'Folgende Unterlagen werden angefordert/benötigt:\r\n- Selbstauskunft\r\n- Schufaeinwilligung    \r\n- Vorvermieterbescheinigung \r\n- Kopie Personalausweis\r\n- Einkommensnachweise\r\n- Nachweis einer Haftpflichtversicherung\r\n\r\nDie Formulare finden Sie unter www.kuenne-immobilien.de/vermietung.\r\n\r\nDer Mietvertrag wird mit einer Mindestlaufzeit von einem Jahr abgeschlossen.'];showqualicontactform;profile0;false;;true;top;Sachsen;Leipzig;Deutschland;04105;51,3587258760504;12,378367463942206;false;n;n;n;1100;7;5367601;y;refurbished;001.5367601;y;;;no_information;1;;n;;n;;;7d;wohnung_miete;no_information;0,active;;y;163;7;n;;5;5;5;551421;no_information;https://pictures.immobilienscout24.de/listings/7df21b8c-308e-4a2c-a403-2529fa6c474b-1332119169.jpg/ORIG/resize/118x118%3E/extent/118x118/format/jpg/quality/80;15;4.35;;;Sachsen;Leipzig;Zentrum_Nord;85564535;240;"Delitzscher Stra&szlig;e";Delitzscher_Straße;100 MBit/s;true;;;100 MBit/s;true;MagentaZuhause L;web,email,bank,music,dl-ul,game,sd,mltstr,hd,fast-ul-dl;über VDSL;REGULAR;https://padlock.link/ml;https://padlock.link/ioml;telekom_layer_magenta_l;ONE_YEAR_FREE;40 MBit/s;;;apartment;;;04105
2020-01-01 21:59:23.982108;/expose/77571051;['\r\n\r\nAusstattungsmerkmale: \r\n-Dusche/WC\r\n-Laminatboden\r\n-Fliesen-Bodenbelag\r\n-Einbauküche\r\n-Innenliegendes Bad (ohne Fenster)\r\n-Balkon', 'Wahren ist ein Stadtteil im Nordwesten der Stadt Leipzig. \r\nIm Stadtteil Leipzig-Wahren liegt der Auensee.\r\nWahren grenzt im Osten an Möckern, im Norden an Lindenthal und im Westen an Stahmeln. \r\nSüdlich der Ortslage erstreckt sich ein Teil des Leipziger Auewaldes. Auf 4,6 km² leben in Wahren etwa 6200 Leipziger Bürger.\r\nDer Stadtteil hat einen Bahnhof, der an der Strecke Leipzig-Halle liegt.', 'Folgende Unterlagen werden angefordert/benötigt:\r\n- Selbstauskunft\r\n- Schufaeinwilligung    \r\n- Vorvermieterbescheinigung \r\n- Kopie Personalausweis\r\n- Einkommensnachweise\r\n- Nachweis einer Haftpflichtversicherung\r\n\r\nDie Formulare finden Sie unter www.kuenne-immobilien.de/vermietung.\r\n\r\nDer Mietvertrag wird mit einer Mindestlaufzeit von einem Jahr abgeschlossen.'];showqualicontactform;profile0;false;;true;top;Sachsen;Leipzig;Deutschland;04159;51,37675296502586;12,322799419715535;false;n;y;n;425;3;5367601;n;refurbished;001.5367601;y;;no_information;no_information;2;;y;;y;;central_heating;41;wohnung_miete;no_information;0,active;;n;64.89;3;n;;3;3;3;545687;negotiable;https://pictures.immobilienscout24.de/listings/ba2798ce-4b57-419c-a469-f6cda5d43a1a-1341267805.jpg/ORIG/resize/118x118%3E/extent/118x118/format/jpg/quality/80;14;3.39;;;Sachsen;Leipzig;Wahren;77571051;160;"Linkelstra&szlig;e";Linkelstraße;100 MBit/s;true;;;100 MBit/s;true;MagentaZuhause L;web,email,bank,music,dl-ul,game,sd,mltstr,hd,fast-ul-dl;über VDSL;REGULAR;https://padlock.link/ml;https://padlock.link/ioml;telekom_layer_magenta_l;ONE_YEAR_FREE;40 MBit/s;;;apartment;1900;1;04159
2020-01-01 21:59:30.442467;/expose/87707789;"['\r\n\r\nAusstattungsmerkmale: \r\n-Bad mit Fenster\r\n-WMA im Bad\r\n-offene Küche\r\n-Laminatboden\r\n-Fliesen-Bodenbelag\r\n-Bad mit Wanne\r\n-Küche mit Fenster', ""Südlich von Rödel- und Antonienstraße gelegen, finden Sie hier den Leipziger Volkspark mit Freibad und Stadion, der den 'Eingang zum Auwald bildet und so eine 'grüne Passage' bis ins Zentrum, die Südvorstadt, Connewitz und sogar bis nach Markkleeberg an den Cospudener See ermöglicht. \r\nDas Zentrum Kleinzschochers ist der 'Adler', die Kreuzung von Antonien- und Zschocherscher Straße, in deren Umfeld sich verschiedene Ladengeschäfte und gastronomische Einrichtungen angesiedelt haben. Hier finden Sie auch Schulen und Anbindung an den öffentlichen Nahverkehr.  Kulturelles Highlight des Viertels bildet die wiedereröffnete Schauburg mit anspruchsvollem Programmkino.\r\nMit der Straßenbahnlinie 4 erreichen Sie in kurzer Zeit den Bahnhof und das Stadtzentrum. In der Nähe des Objektes in der Gießerstr. 75 entwickelt sich ein Atelierhaus mit Werkstätten- und Kunsträumen. Das Stück für Stück wieder nutzbar gemachte Gebäude bietet jungen Künstlern einen Ort zum Arbeiten und zur Entfaltung der eigenen Kreativität."", 'Folgende Unterlagen werden angefordert/benötigt:\r\n- Selbstauskunft    \r\n- Schufaeinwilligung    \r\n- Vorvermieterbescheinigung \r\n- Kopie Personalausweis\r\n- Einkommensnachweise\r\n- Nachweis einer Haftpflichtversicherung\r\n\r\nDie Formulare finden Sie unter www.kuenne-immobilien.de/vermietung.\r\n\r\nDer Mietvertrag wird mit einer Mindestlaufzeit von einem Jahr abgeschlossen.\r\n']";showqualicontactform;profile0;false;;true;top;Sachsen;Leipzig;Deutschland;04229;51,31454841226554;12,321345959367981;false;n;n;n;445;3;5367601;n;refurbished;001.5367601;y;;;no_information;4;;n;;n;;central_heating;24;wohnung_miete;no_information;0,active;;n;73.74;3;n;;3;3;4;560049;negotiable;https://pictures.immobilienscout24.de/listings/af4dee3d-efdb-45bd-99f6-bb164a879e10-1332118415.jpg/ORIG/resize/118x118%3E/extent/118x118/format/jpg/quality/80;9;3.39;;;Sachsen;Leipzig;Kleinzschocher;87707789;165;"Eythraer Stra&szlig;e";Eythraer_Straße;100 MBit/s;true;;;100 MBit/s;true;MagentaZuhause L;web,email,bank,music,dl-ul,game,sd,mltstr,hd,fast-ul-dl;über VDSL;REGULAR;https://padlock.link/ml;https://padlock.link/ioml;telekom_layer_magenta_l;ONE_YEAR_FREE;40 MBit/s;;;roof_storey;;;04229
2020-01-01 21:59:31.867592;/expose/86340615;['Auf einen Blick:\n\n- Anmietung PKW-Stellplatz möglich\n- Einbauküche mit Geschirrspüler\n- Parkettboden\n- Bad mit Dusche\n- Abstellraum\n- separater Fahrradkeller\n- großzügiger und begrünter Hinterhof', 'Südvorstadt\n\nDie Südvorstadt ist wegen ihrer Nähe zum Zentrum (ca. 2 km) aber auch zu größeren Grünbereichen ein beliebtes Wohngebiet mit Altbausubstanz. Dass sie insbesondere von jungen Leuten bevorzugt wird, liegt nicht zuletzt an der entlang der Karl-Liebknecht-Straße entwickelten Kneipen-, Kleinkunst- und Alternativszene. Die landschaftlich schön gelegene traditionsreiche Galopprennbahn Scheibenholz bildet den Übergang zu Park und Auenwald. Der ebenfalls zur Südvorstadt gehörende Fockeberg, der aus Kriegstrümmern der Stadt aufgeschüttet wurde, aber inzwischen bewaldet ist, bietet einen schönen Blick über die gesamte Stadt und ist ein beliebter Erholungsort. Durch die Südvorstadt verkehren die Straßenbahnlinien 9, 10 und 11 sowie die Buslinien 60, 70 und 89.', 'Entspricht diese Wohnung Ihren Vorstellungen? Dann vereinbaren Sie mit uns einen Besichtigungstermin.'];showqualicontactform;profile0;false;;true;top;Sachsen;Leipzig;Deutschland;04275;51,3203039757338;12,380647077834226;false;n;n;n;300;1;16540007;y;refurbished;002.01007377242;y;;energy_consumption;district_heating;3;;y;1100;y;;district_heating;94;wohnung_miete;sophisticated;0,active;;n;33.88;1;n;1;1;1;;3190;negotiable;https://pictures.immobilienscout24.de/listings/334751d3-289d-458d-bbdf-8509ea9a27e4-995474461.jpg/ORIG/resize/118x118%3E/extent/118x118/format/jpg/quality/80;14;4.11;;;Sachsen;Leipzig;Südvorstadt;86340615;90;Kurt-Eisner-Str.;Kurt-Eisner-Str.;100 MBit/s;true;;;100 MBit/s;true;MagentaZuhause L;web,email,bank,music,dl-ul,game,sd,mltstr,hd,fast-ul-dl;über VDSL;REGULAR;https://padlock.link/ml;https://padlock.link/ioml;telekom_layer_magenta_l;ONE_YEAR_FREE;40 MBit/s;157;390;apartment;1900;1;04275
2020-01-01 21:59:37.784402;/expose/92688778;['\r\n\r\nAusstattungsmerkmale: \r\n-Bad mit Wanne\r\n-WMA im Bad\r\n-Einbauküche\r\n-Laminatboden\r\n-Fliesen-Bodenbelag\r\n-Bad mit Fenster\r\n-Küche mit Fenster', 'Im nordöstlichen Teil Leipzigs gelegen, ist Schönefeld nur wenige Minuten vom Stadtzentrum entfernt und liegt trotzdem im Grünen. Schnell zu erreichen sind etwa der wunderschöne Mariannenpark und das Sommerbad Schönefeld. Es besteht eine gute Nahverkehrsanbindung mit Straßenbahn und Bus. Auf der Gorkistraße mit vielseitigen kulturellen Einrichtungen, Einkaufsmöglichkeiten und Gaststätten, finden Sie alle Dinge des täglichen Bedarfs. Außerdem ist diese Wohnlage verkehrsgünstig zur Autobahn 14 und den Bundesstraßen 2 (Messegelände und BMW) und 6 gelegen.', 'Folgende Unterlagen werden angefordert/benötigt:\r\n- Selbstauskunft\r\n- Schufaeinwilligung    \r\n- Vorvermieterbescheinigung \r\n- Kopie Personalausweis\r\n- Einkommensnachweise\r\n- Nachweis einer Haftpflichtversicherung\r\n\r\nDie Formulare finden Sie unter www.kuenne-immobilien.de/vermietung.\r\n\r\nDer Mietvertrag wird mit einer Mindestlaufzeit von einem Jahr abgeschlossen.'];showqualicontactform;profile0;false;;true;top;Sachsen;Leipzig;Deutschland;04347;51,3607913504037;12,416727908847886;false;n;n;n;230;1;5367601;n;no_information;001.5367601;y;;;no_information;3;;n;;n;;;7;wohnung_miete;no_information;0,active;;n;26;1;n;;1;1;3;570403;no_information;https://pictures.immobilienscout24.de/listings/6cec9981-3766-49df-8f8f-630963b37255-1341264179.jpg/ORIG/resize/118x118%3E/extent/118x118/format/jpg/quality/80;13;3.45;;;Sachsen;Leipzig;Schönefeld_Abtnaundorf;92688778;70;"Lazarusstra&szlig;e";Lazarusstraße;50 MBit/s;true;;;50 MBit/s;true;MagentaZuhause M;web,email,bank,music,dl-ul,game,sd,mltstr,hd,fast-ul-dl;über VDSL;REGULAR;https://padlock.link/mm;https://padlock.link/iomm;telekom_layer_magenta_m;ONE_YEAR_FREE;10 MBit/s;;;roof_storey;;;04347
2020-01-01 21:59:38.677045;/expose/103045863;['Diese 2-Zimmer-Wohnung in Leutzsch bietet Ihnen:\r\n- Wohnzimmer \r\n- Schlafzimmer mit Enbauschrank\r\n- eine Küche mit einer hochwertigen und exclusiven Einbauküche mit viel Stauraum, Geschirrspülmaschine, Induktionskochfeld, Backofen, Kühlschrank mit großem separaten Gefrierfach, Echtholzarbeitsplatte \r\n- Parkettfußboden\r\n- Badezimmer mit Badewanne und einer Waschmaschine mit integriertem Trockner\r\n- Balkonanbau geplant ca. 13 m²', '\r\n\r\nAusstattungsmerkmale: \r\n-Kunststoffbelag\r\n-Fliesen-Bodenbelag\r\n-Bad mit Fenster\r\n-Bad mit Wanne\r\n-WMA im Bad\r\n-Einbauküche\r\n-Küche mit Fenster', 'Der Stadtteil Leutzsch liegt im Leipziger Westen.\r\nIn unmittelbarer Nähe befindet sich der Leipziger Auwald mit Auensee\r\nder zum spazieren, Fahrrad fahren und entspannen einlädt.\r\nEs besteht eine gute Anbindung zum ÖPNV (Tram 7, Bus 80, S- Bahn)\r\nund vielfältige Einkaufsmöglichkeiten und Dienstleistungen sind zu Fuß zu erreichen', 'Folgende Unterlagen werden angefordert/benötigt:\r\n- Selbstauskunft\r\n- Schufaeinwilligung\r\n- Vorvermieterbescheinigung \r\n- Kopie Personalausweis\r\n- Einkommensnachweise\r\n- Nachweis einer Haftpflichtversicherung\r\n\r\nDer Mietvertrag wird mit einer Mindestlaufzeit von einem Jahr und einer Staffelmiete abgeschlossen.\r\n\r\nDie Formulare finden Sie unter www.kuenne-immobilien.de/vermietung.'];showqualicontactform;profile0;false;;true;top;Sachsen;Leipzig;Deutschland;04179;51,347665053529;12,311026346440308;false;n;n;n;469;3;5367601;n;fully_renovated;001.5367601;y;;;no_information;2;;n;;n;;;16;wohnung_miete;no_information;0,active;;n;59.46;2;n;;2;2;4;572881;no_information;https://pictures.immobilienscout24.de/listings/08e70e0b-cfaf-4dc1-a686-d3f40a67ae00-1332152746.jpg/ORIG/resize/118x118%3E/extent/118x118/format/jpg/quality/80;6;3.51;13.6;3.51;Sachsen;Leipzig;Leutzsch;103045863;117;"R&uuml;ckmarsdorfer Stra&szlig;e";Rückmarsdorfer_Straße;100 MBit/s;true;;;100 MBit/s;true;MagentaZuhause L;web,email,bank,music,dl-ul,game,sd,mltstr,hd,fast-ul-dl;über VDSL;REGULAR;https://padlock.link/ml;https://padlock.link/ioml;telekom_layer_magenta_l;ONE_YEAR_FREE;40 MBit/s;;;apartment;1900;1;04179
2020-01-01 21:59:44.605069;/expose/100332298;"['Diese traumhafte Altbau-DG-Wohnung kann ab sofort von Ihnen angemietet werden.\r\nDie Wohnung bietet Ihnen:\r\n- eine Küche mit einer hochwertigen und exclusiven Einbauküche mit viel Stauraum, Geschirrspülmaschine, Induktionskochfeld, Backofen, Kühlschrank mit großem separaten Gefrierfach, Echtholzarbeitsplatte\r\n- Laminatfußboden\r\n- Badezimmer mit Dusche und Waschmaschine mit integriertem Trockner\r\n', '\r\n\r\nAusstattungsmerkmale: \r\n-Fliesen-Bodenbelag\r\n-Gas-Zentralheizung\r\n-Dusche/WC\r\n-Innenliegendes Bad (ohne Fenster)\r\n-WMA im Bad\r\n-Laminatboden\r\n-vollständig renoviert\r\n-Einbauküche', 'Der Stadtteil Gohlis - Süd liegt nördlich vom Stadtzentrum Leipzig.\r\nGanz in der Nähe liegt das Rosental und der Leipziger Auwald. Auch der Auensee, der zum Entspannen und Erholen einlädt, ist schnell erreicht. Außerdem bietet Gohlis sehr viel Kultur; unter anderem das Schillerhaus und das Gohliser Schlösschen.\r\nAlle wichtigen Geschäfte und Dienstleister wie eine Apotheke, eine Bäckerei, ein Geldinstitut, Ärzte oder ein Supermarkt sind in wenigen Gehminuten zu erreichen. Ganz in der Nähe befindet sich der Zoo und der Auwald und sind bequem zu Fuß zu erreichen.\r\nWeil das denkmalgeschützte Wohngebäude an einer Nebenstraße liegt, können die Bewohner ihre Freizeit in Ruhe zu Hause genießen.\r\nWer gerne schnell ins Grüne möchte, findet genügend Parks, die nur wenige Minuten vom Wohnhaus entfernt liegen.\r\nNatürlich kann das reichhaltige Kulturangebot und Nachtleben der Stadt aufgrund der Nähe zur Innenstadt gut genutzt werden. Das ist sicher ein entscheidender Vorteil für das Wohnen in einem attraktiven Stadtteil wie Gohlis in einer Großstadt wie Leipzig.', 'Folgende Unterlagen werden angefordert/benötigt:\r\n- Selbstauskunft\r\n- Schufaeinwilligung\r\n- Vorvermieterbescheinigung \r\n- Kopie Personalausweis\r\n- Einkommensnachweise\r\n- Nachweis einer Haftpflichtversicherung\r\n\r\nDer Mietvertrag wird mit einer Mindestlaufzeit von einem Jahr und einer Staffelmiete abgeschlossen.\r\n\r\nDie Formulare finden Sie unter www.kuenne-immobilien.de/vermietung.']";showqualicontactform;profile0;false;;true;top;Sachsen;Leipzig;Deutschland;04157;51,3664686525642;12,374255891134643;false;n;n;n;430;3;5367601;n;fully_renovated;001.5367601;y;;;no_information;4;;n;;n;;;17;wohnung_miete;no_information;0,active;;n;55;2;n;;2;2;4;572366;no;https://pictures.immobilienscout24.de/listings/999ea525-a1c6-4a70-91dd-27a2f45b3dea-1341264801.jpg/ORIG/resize/118x118%3E/extent/118x118/format/jpg/quality/80;7;4.35;;;Sachsen;Leipzig;Gohlis_Mitte;100332298;125;"Etkar-Andre-Stra&szlig;e";Etkar-Andre-Straße;100 MBit/s;true;;;100 MBit/s;true;MagentaZuhause L;web,email,bank,music,dl-ul,game,sd,mltstr,hd,fast-ul-dl;über VDSL;REGULAR;https://padlock.link/ml;https://padlock.link/ioml;telekom_layer_magenta_l;ONE_YEAR_FREE;40 MBit/s;;;roof_storey;;;04157
2020-01-01 21:59:45.571249;/expose/102633299;['Saniertes Leipziger-Stadthaus', 'Küche mit Fenster\nKüche und Bad mit Bodenfliesen\nBad mit Wanne und Fenster\nsonst. Parkett', 'ruhige Stadtlage\ndie Straßenbahn ist in ca. 5 Min. zu Fuß zuerreichen'];showqualicontactform;profile0;false;;true;top;Sachsen;Leipzig;Deutschland;04129;51,36321276204555;12,385466225726027;false;n;n;n;420;3;293495;y;refurbished;001.293495;n;;no_information;no_information;4;;y;4;y;;central_heating;21;wohnung_miete;normal;0,active;1999;n;70;3;n;;2;2;4;1128;negotiable;https://pictures.immobilienscout24.de/listings/98530424-37d9-4f35-9e54-398727bfad0f-1190255205.jpg/ORIG/resize/118x118%3E/extent/118x118/format/jpg/quality/80;10;4.55;;;Sachsen;Leipzig;Eutritzsch;102633299;120;"Schiebestra&szlig;e";Schiebestraße;100 MBit/s;true;;;100 MBit/s;true;MagentaZuhause L;web,email,bank,music,dl-ul,game,sd,mltstr,hd,fast-ul-dl;über VDSL;REGULAR;https://padlock.link/ml;https://padlock.link/ioml;telekom_layer_magenta_l;ONE_YEAR_FREE;40 MBit/s;;540;maisonette;1900;1;04129
2020-01-01 21:59:51.474919;/expose/102848903;"['Diese traumhafte 2-Zimmer-Wohnung kann ab sofort von Ihnen angemietet werden.\r\nDie Wohnung bietet Ihnen eine offene Küche mit einer hochwertigen und exclusiven Einbauküche im skandinavischen Design mit viel Stauraum, Geschirrspülmaschine, Induktionskochfeld, Backofen, Kühlschrank mit großem separaten Gefrierfach und einer Echtholzarbeitsplatte.\r\nIn den Wohnräumen befindet sich ein Parkettfußboden und im Badezimmer ein Fliesenfußboden.\r\nVom Wohnzimmer gelangen Sie auf eine gemütliche Terrasse.\r\nDas Badezimmer ist mit einer Badewanne, einem Waschtrockner und einem beleuchteten Spiegelschrank ausgestattet.', '\r\n\r\nAusstattungsmerkmale: \r\n-Parkettboden\r\n-Fliesen-Bodenbelag\r\n-Innenliegendes Bad (ohne Fenster)\r\n-Bad mit Wanne\r\n-WMA im Bad\r\n-Terrasse\r\n-Einbauküche\r\n-Küche mit Fenster', 'Der Stadtteil Gohlis - Süd liegt nördlich vom Stadtzentrum Leipzig.\r\nGanz in der Nähe liegt das Rosental und der Leipziger Auwald. Auch der Auensee, der zum Entspannen und Erholen einlädt, ist schnell erreicht. Außerdem bietet Gohlis sehr viel Kultur; unter anderem das Schillerhaus und das Gohliser Schlösschen.\r\nAlle wichtigen Geschäfte und Dienstleister wie eine Apotheke, eine Bäckerei, ein Geldinstitut, Ärzte oder ein Supermarkt sind in wenigen Gehminuten zu erreichen. Ganz in der Nähe befindet sich der Zoo und der Auwald und sind bequem zu Fuß zu erreichen.\r\nWeil das denkmalgeschützte Wohngebäude an einer Nebenstraße liegt, können die Bewohner ihre Freizeit in Ruhe zu Hause genießen.\r\nWer gerne schnell ins Grüne möchte, findet genügend Parks, die nur wenige Minuten vom Wohnhaus entfernt liegen.\r\nNatürlich kann das reichhaltige Kulturangebot und Nachtleben der Stadt aufgrund der Nähe zur Innenstadt gut genutzt werden. Das ist sicher ein entscheidender Vorteil für das Wohnen in einem attraktiven Stadtteil wie Gohlis in einer Großstadt wie Leipzig.', 'Folgende Unterlagen werden angefordert/benötigt:\r\n- Selbstauskunft\r\n- Schufaeinwilligung\r\n- Vorvermieterbescheinigung \r\n- Kopie Personalausweis\r\n- Einkommensnachweise\r\n- Nachweis einer Haftpflichtversicherung\r\n\r\nDer Mietvertrag wird mit einer Mindestlaufzeit von einem Jahr und einer Staffelmiete abgeschlossen.\r\n\r\nDie Formulare finden Sie unter www.kuenne-immobilien.de/vermietung.']";showqualicontactform;profile0;false;;true;top;Sachsen;Leipzig;Deutschland;04155;51,3569597953692;12,370796145834367;false;n;y;n;551;4;5367601;n;no_information;001.5367601;y;;energy_required;gas;0;;n;;n;;central_heating;34;wohnung_miete;no_information;0,active;;n;53.94;2;n;;2;2;3;572894;no_information;https://pictures.immobilienscout24.de/listings/1fc3d3ac-6787-455a-a875-3e280a26613f-1341266429.jpg/ORIG/resize/118x118%3E/extent/118x118/format/jpg/quality/80;10;4.41;;;Sachsen;Leipzig;Gohlis_Süd;102848903;124;"Prellerstra&szlig;e";Prellerstraße;100 MBit/s;true;;;100 MBit/s;true;MagentaZuhause L;web,email,bank,music,dl-ul,game,sd,mltstr,hd,fast-ul-dl;über VDSL;REGULAR;https://padlock.link/ml;https://padlock.link/ioml;telekom_layer_magenta_l;ONE_YEAR_FREE;40 MBit/s;67;;ground_floor;1996;5;04155
2020-01-01 21:59:52.429990;/expose/85959354;"['\r\n\r\nAusstattungsmerkmale: \r\n-Bad mit Fenster\r\n-WMA im Bad\r\n-offene Küche\r\n-Laminatboden\r\n-Fliesen-Bodenbelag\r\n-Bad mit Wanne\r\n-Küche mit Fenster', ""Südlich von Rödel- und Antonienstraße gelegen, finden Sie hier den Leipziger Volkspark mit Freibad und Stadion, der den 'Eingang zum Auwald bildet und so eine 'grüne Passage' bis ins Zentrum, die Südvorstadt, Connewitz und sogar bis nach Markkleeberg an den Cospudener See ermöglicht. \r\nDas Zentrum Kleinzschochers ist der 'Adler', die Kreuzung von Antonien- und Zschocherscher Straße, in deren Umfeld sich verschiedene Ladengeschäfte und gastronomische Einrichtungen angesiedelt haben. Hier finden Sie auch Schulen und Anbindung an den öffentlichen Nahverkehr.  Kulturelles Highlight des Viertels bildet die wiedereröffnete Schauburg mit anspruchsvollem Programmkino.\r\nMit der Straßenbahnlinie 4 erreichen Sie in kurzer Zeit den Bahnhof und das Stadtzentrum."", 'Folgende Unterlagen werden angefordert/benötigt:\r\n- Selbstauskunft\r\n- Schufaeinwilligung    \r\n- Vorvermieterbescheinigung \r\n- Kopie Personalausweis\r\n- Einkommensnachweise\r\n- Nachweis einer Haftpflichtversicherung\r\n\r\nDie Formulare finden Sie unter www.kuenne-immobilien.de/vermietung.\r\n\r\nDer Mietvertrag wird mit einer Mindestlaufzeit von einem Jahr abgeschlossen.']";showqualicontactform;profile0;false;;true;top;Sachsen;Leipzig;Deutschland;04229;51,31454841226554;12,321345959367981;false;n;n;n;454;3;5367601;n;refurbished;001.5367601;y;;;no_information;4;;n;;n;;central_heating;24;wohnung_miete;no_information;0,active;;n;75.66;3;n;;3;3;4;551825;negotiable;https://pictures.immobilienscout24.de/listings/672b45b7-1636-4a78-b49d-af76f018c857-1341263348.jpg/ORIG/resize/118x118%3E/extent/118x118/format/jpg/quality/80;13;3.39;;;Sachsen;Leipzig;Kleinzschocher;85959354;170;"Eythraer Stra&szlig;e";Eythraer_Straße;100 MBit/s;true;;;100 MBit/s;true;MagentaZuhause L;web,email,bank,music,dl-ul,game,sd,mltstr,hd,fast-ul-dl;über VDSL;REGULAR;https://padlock.link/ml;https://padlock.link/ioml;telekom_layer_magenta_l;ONE_YEAR_FREE;40 MBit/s;;;roof_storey;;;04229
2020-01-01 21:59:58.526803;/expose/114551034;['saniertes Mehrfamilienhaus\n\ndie Wohnung wurde gerade komplett Renoviert !!!', 'Küche mit Fenster\nBad mit Wanne und Fenster\nsonst Laminat', 'in Halle (Saale) - Südliche Innenstadt\nStraßenbahn 10 Min.'];showqualicontactform;profile0;false;;true;top;Sachsen;Leipzig;Deutschland;04315;51,3394046552848;12,410108015415561;false;n;n;n;490;3;293495;n;refurbished;001.293495;n;;no_information;no_information;5;;y;;y;;central_heating;20;wohnung_miete;normal;0,active;1996;n;76;3;n;;3;3;5;1169;no_information;https://pictures.immobilienscout24.de/listings/1783bd1f-84d1-4cad-84c4-9288252971e2-1334969393.jpg/ORIG/resize/118x118%3E/extent/118x118/format/jpg/quality/80;9;4.6;16.5;4.6;Sachsen;Leipzig;Volkmarsdorf;114551034;150;"Bernhardstra&szlig;e";Bernhardstraße;100 MBit/s;true;;;100 MBit/s;true;MagentaZuhause L;web,email,bank,music,dl-ul,game,sd,mltstr,hd,fast-ul-dl;über VDSL;REGULAR;https://padlock.link/ml;https://padlock.link/ioml;telekom_layer_magenta_l;ONE_YEAR_FREE;40 MBit/s;;640;roof_storey;1930;1;04315
2020-01-01 21:59:59.762502;/expose/87511557;['Traumhafte und lichtdurchflutete Maisonette in Reudnitz zu vermieten!\r\n\r\nAusstattung: Neubau mit Lift - 5. Obergeschoss + Dachgeschoss / Wohnraum mit bodentiefen Fenstern / Schlafraum / Küche / Bad mit Wanne / oberer Wohnbereich: Galerie sowie weiteres Zimmer / Laminatboden\r\n \r\nDer zur Wohnung gehörige untere Tiefgaragen-Duplexstellplatz kostet 25,00 EUR monatlich und muss mit angemietet werden.\r\n\r\nHaben wir Ihr Interesse an einer Besichtigung geweckt? Telefon: 0341 / 983 60 40\r\nUnser Vermietungsteam freut sich auf Ihren Anruf!'];;profile0;false;;true;top;Sachsen;Leipzig;Deutschland;04317;51,3306440021738;12,39768877442837;true;n;n;n;485;3;645498;y;mint_condition;001.645498;n;C;energy_consumption;district_heating;5;disabled;n;4411;n;;central_heating;43;wohnung_miete;normal;0,active;;y;65;3;n;1;3;3;;Prager43-Mais.-WE19;no_information;https://pictures.immobilienscout24.de/listings/48d45852-b28e-4b33-ad20-ad7a35e534f4-1142401051.jpg/ORIG/resize/118x118%3E/extent/118x118/format/jpg/quality/80;12;5.8;19.44;5.8;Sachsen;Leipzig;Reudnitz_Thonberg;87511557;210;"Prager Stra&szlig;e";Prager_Straße;100 MBit/s;true;;;100 MBit/s;true;MagentaZuhause L;web,email,bank,music,dl-ul,game,sd,mltstr,hd,fast-ul-dl;über VDSL;REGULAR;https://padlock.link/ml;https://padlock.link/ioml;telekom_layer_magenta_l;ONE_YEAR_FREE;40 MBit/s;77.1;695;maisonette;1998;5;04317
